question,options,answer,explanation,topic,difficulty,chapter
What is the primary purpose of unit testing in software development?,"['To test the interaction between different modules of a software system.', 'To verify the functionality of individual components or units of code in isolation.', 'To assess the overall performance and scalability of the entire application.', ""To ensure the software meets the user's requirements and expectations.""]",B,"Unit testing focuses on testing individual units of code, ensuring each works correctly before integration.  Options A, C, and D describe integration testing, performance testing, and acceptance testing respectively.",Unit Testing,Easy,8.3
Which of the following is NOT a typical characteristic of a well-written unit test?,"['Independent execution', ' Testable in isolation', 'Dependence on external resources', ' Clear pass/fail criteria']",C,Well-written unit tests should be independent and not rely on external factors like databases or network connections to avoid unexpected failures.,Unit Testing,Medium,8.3
A unit test typically involves which of the following steps?,"['Designing the system architecture', 'Deploying the application to a production environment', 'Setting up the test environment, executing the unit, and asserting the results.', 'Gathering requirements from stakeholders.']",C,"Unit testing involves preparing the test environment, running the code being tested, and verifying its behavior against expected results.  Options A, B and D are outside the scope of unit testing.",Unit Testing,Easy,8.3
What is a common framework used for conducting unit testing in Python?,"['JUnit', 'NUnit', 'pytest', 'Mocha']",C,"pytest is a widely-used Python testing framework. JUnit and NUnit are primarily used in Java and .NET, respectively, while Mocha is a JavaScript framework.",Unit Testing,Medium,8.3
"The principle of ""First Write the Test"" emphasizes what aspect of software development?","[' Debugging efficiency', 'Test-Driven Development (TDD)', ' Code optimization', ' Software documentation']",B,"""Test-first"" is a core tenet of Test-Driven Development (TDD), where tests are written before the code they are intended to test.",Unit Testing,Medium,8.3
Which of the following best describes the primary goal of integration testing?,"['To verify that individual modules of software function correctly in isolation.', 'To ensure the seamless interaction and data flow between different modules of a software system.', 'To test the overall performance and usability of the complete software system.', ""To identify and correct errors in the system's user interface.""]",B,"Integration testing focuses on verifying the connections and interactions between different parts of a system, ensuring they work together correctly.  Unit testing (A) focuses on individual modules. System testing (C) is a higher-level test.  User interface testing (D) is a specific type of testing.",Integration testing,Easy,8.3
"A ""Big Bang"" approach to integration testing involves:","['Testing individual modules in isolation before combining them.', 'Integrating and testing modules incrementally, one at a time.', 'Combining all modules at once and testing the entire system as a whole.', 'Using a top-down approach, testing higher-level modules first.']",C,"The ""Big Bang"" approach combines all modules simultaneously for integration testing, unlike incremental approaches (B) or top-down (D).  Option (A) describes unit testing.",Integration testing,Medium,8.3
"What is a potential disadvantage of the ""Big Bang"" approach to integration testing?","['It is excessively time-consuming.', 'It is difficult to isolate the source of errors.', 'It requires extensive automation tools.', 'It is only suitable for small software systems.']",B,"A major drawback of the Big Bang approach is that when errors occur, pinpointing their origin among many integrated modules can be extremely challenging.",Integration testing,Medium,8.3
In which stage of the software development lifecycle (SDLC) is integration testing typically performed?,"['Requirements Gathering', 'Design', 'Implementation', 'Testing']",D,"Integration testing is a specific type of testing that occurs within the broader testing phase of the SDLC. While it's related to implementation (C), it's a distinct testing activity.",Integration testing,Easy,8.3
"Which integration testing strategy involves testing modules in a hierarchical manner, starting from the top level?","['Bottom-up integration', 'Big Bang integration', 'Top-down integration', 'Sandwich integration']",C,Top-down integration starts with the highest-level modules and gradually integrates lower-level modules.  Bottom-up (A) does the opposite. Big Bang (B) integrates everything at once. Sandwich (D) is a hybrid.,Integration testing,Medium,8.3
What is a crucial aspect of system testing that needs to be considered when designing test cases?,"[' User interface aesthetics', ' Individual module functionality', ' Handling of edge cases like overflow and zero values', ' Database schema optimization']",C),"System testing focuses on the entire system's behavior, including how it handles boundary conditions (edge cases) such as overflow, negative values, and zero.  Options A, B, and D are important aspects of software development but not the primary focus of system testing.",System testing,Easy,8.3
"During system testing, what kind of input values are particularly important to test?","[' Only positive integer inputs', ' Only large input values', ' A range of inputs, including boundary conditions', ' Only typical user inputs']",C),"Thorough system testing requires evaluating the system's response to various input values, including boundary conditions (like very small/large numbers, zero, negative numbers) that can potentially reveal errors or unexpected behavior.  Options A, B, and D represent incomplete testing strategies.",System testing,Easy,8.3
Which of the following best describes the purpose of system testing?,"[' To verify individual modules function correctly.', ' To identify usability issues in the user interface.', "" To evaluate the integrated system's performance as a whole."", ' To assess the efficiency of the database.']",C),"System testing is a level of software testing where the entire system is tested as an integrated unit to ensure it functions correctly as a whole. Options A, B and D address specific aspects of software development but not the overall aim of system testing.",System testing,Easy,8.3
"In the context of system testing, what does the condition 'O' typically represent?","[' Output', ' Operation', ' Overflow', ' Order']",C),'O' is often used as an abbreviation for 'Overflow' in test cases to denote testing for situations where the system's capacity is exceeded.,System testing,Medium,8.3
"Besides 'O' (overflow), 'N' (negative), and 'Z' (zero), what other type of input condition is commonly tested during system testing?","[' Positive integers only', ' Large values only', ' Carry or boundary conditions', ' Typical User Inputs']",C),"The passage mentions testing various conditions.  While 'N' and 'Z' are given, 'C' (Carry) or more broadly, boundary condition testing is a crucial part of ensuring system robustness.",System testing,Medium,8.3
Which of the following BEST describes the primary goal of component testing in software development?,"['To verify the integration of all software components.', 'To ensure individual components meet their specified requirements.', 'To assess the overall performance of the system.', 'To identify user interface flaws.']",B),"Component testing focuses on isolating individual components to verify they function correctly according to their specifications.  Integration testing addresses the interaction between components. System testing assesses the entire system, and UI testing focuses on the user interface.",Component testing,Easy,8.3
What is a crucial first step before commencing component testing?,"[' Developing the user manual.', ' Defining clear and measurable test cases.', ' Deploying the software to the production environment.', ' Conducting a system-wide performance test.']",B),Well-defined test cases that specify expected inputs and outputs are essential for effective component testing. The other options are subsequent steps or unrelated activities.,Component testing,Easy,8.3
A 'unit' in the context of unit testing (a subset of component testing) typically refers to which of the following?,"['An entire software module.', 'A group of related functions.', 'A single, independent function or procedure.', 'The entire software system.']",C),"Unit testing focuses on the smallest testable parts of a software system, usually a single function or procedure.  Larger units are tested in integration testing.",Component testing,Medium,8.3
Which testing method is MOST likely to uncover defects related to a specific component's internal logic?,"['Integration testing', 'System testing', 'User acceptance testing', 'Component testing']",D),"Component testing aims to find defects within individual components, while other testing methods focus on interactions between components or the overall system.",Component testing,Easy,8.3
"During component testing, a critical aspect is ensuring that the test environment closely resembles the:","[""User's home network configuration."", 'Production environment.', "" Developer's personal computer setup."", ""Testing team's preferred software configuration.""]",B),The testing environment should mirror the production environment as closely as possible to avoid unexpected behavior in the deployed system.,Component testing,Medium,8.3
Which of the following best describes the primary goal of acceptance testing?,"[""Identifying defects in the software's code during development."", ""Verifying that the software meets the user's requirements and is ready for deployment."", 'Assessing the performance and scalability of the software under various loads.', 'Evaluating the security vulnerabilities of the software system.']",B,"Acceptance testing focuses on validating that the software meets the specified requirements from the client's perspective, ensuring it's fit for its intended purpose before release.",Acceptance Testing,Easy,8.3
"In acceptance testing, who typically performs the testing activities?","['Software developers', 'Independent quality assurance testers', 'End-users or clients', 'System administrators']",C,Acceptance testing involves the end-users or clients to validate that the software meets their expectations and requirements.,Acceptance Testing,Easy,8.3
What is a common technique used in acceptance testing to ensure the software meets the client's needs?,"['Unit testing', 'Integration testing', 'User acceptance testing (UAT)', 'Regression testing']",C,User Acceptance Testing (UAT) is a specific type of acceptance testing where end-users directly test the software to validate its functionality and usability.,Acceptance Testing,Medium,8.3
A successful acceptance test typically results in:,"['The immediate release of the software to the public.', 'The identification of all potential bugs within the software.', "" Approval for the software's release to production."", ' The commencement of system integration testing.']",C,A successful acceptance test demonstrates that the software meets the user's needs and is ready for deployment to the production environment.,Acceptance Testing,Easy,8.3
Which of the following is NOT a characteristic of effective acceptance testing?,"[' Clearly defined acceptance criteria.', ' Thorough testing by end-users.', "" Focus on only the software's internal code."", ' Independent verification of requirements.']",C,"Acceptance testing focuses on the software's functionality from the user's perspective, not the internal code structure.  The focus is on meeting requirements, not code details.",Acceptance Testing,Medium,8.3
"What does the 'O' condition represent in the context of test case design, as mentioned in the provided information?","['Negative values', 'Zero values', 'Carry values', 'Overflow values']",D,"The provided information uses 'O' as an abbreviation for 'overflow', indicating a condition to be tested.",Test case design,Easy,8.3
"In test case design, what is typically represented by the letter 'N'?","['Overflow', 'Zero', 'Carry', 'Negative numbers']",D,"'N' commonly represents 'Negative' values in test case design, signifying a specific condition to be considered during testing.",Test case design,Easy,8.3
"Which of the following is NOT typically considered a fundamental condition when designing test cases, based on common testing methodologies?","['Zero values', 'Positive values', 'Boundary values', 'Irregular values']",D,"While edge cases are important, 'irregular values' is not a commonly used or universally defined fundamental condition in standard test case design methodologies.  Zero, positive, and boundary values are standard.",Test case design,Medium,8.3
The letter 'Z' in test case design often represents which specific test condition?,"['Overflow', 'Negative numbers', 'Zero values', 'Carry values']",C,"'Z' is commonly used as shorthand for 'Zero' values in test cases, highlighting the importance of testing with zero input.",Test case design,Easy,8.3
What is the significance of including 'C' (carry) as a condition in test case design?,"['To check for negative inputs', 'To handle potential overflow situations', 'To test for zero inputs', 'To verify the handling of arithmetic operations that exceed the capacity of a register or data type.']",D,"The 'C' (carry) condition is crucial for testing the correct handling of arithmetic operations where the result exceeds the capacity of the storage, resulting in a carry bit being set.",Test case design,Medium,8.3
Which of the following is NOT a primary benefit of test automation in software development?,"['Increased test coverage', 'Reduced testing time', 'Elimination of human error entirely', 'Improved software quality']",C,"While automation reduces human error, it doesn't eliminate it entirely.  There can still be errors in the test scripts themselves.",Test automation,Easy,8.3
A key challenge in automating tests involving complex sequencing and micro-operation logic is:,"[' Insufficient hardware resources', ' Developing robust and reliable test scripts', ' Lack of skilled testers', ' High initial investment costs']",B,Complex logic requires intricate test scripts that are prone to errors and require significant maintenance.,Test automation,Medium,8.3
What type of testing is particularly challenging to automate when dealing with highly complex system behavior?,"['Unit testing', 'Integration testing', 'User acceptance testing', 'Regression testing']",C,"User acceptance testing often relies heavily on subjective human judgment and real-world scenarios, making complete automation difficult.",Test automation,Medium,8.3
"In the context of test automation, what does the term ""micro-operation"" typically refer to?","['A large-scale system operation', 'A single, low-level instruction or action', 'A complete software module', 'A user interface interaction']",B,"Micro-operations represent the smallest, most fundamental actions within a system's operation.",Test automation,Easy,8.3
Which software development methodology often emphasizes the use of automated tests throughout the entire development lifecycle?,"['Waterfall', 'Agile', 'Spiral', 'Prototyping']",B,"Agile methodologies strongly advocate for continuous integration and continuous delivery, which rely heavily on automated testing for rapid feedback and iterative development.",Test automation,Medium,8.3
"In software testing, what does a ""Test variable"" typically represent?","['The expected outcome of a test case.', 'A binary indicator (1 or 0) signifying test success or failure.', 'The input data used in a test case.', 'The duration of a test case execution.']",B,"A test variable often acts as a flag, indicating whether a test passed (1) or failed (0).",Metrics for testing,Easy,8.3
Which of the following is NOT a typical metric used in software testing?,"['Test coverage', 'Defect density', 'Code complexity', 'Project budget']",D,"Project budget is a project management metric, not a direct software testing metric.  Test coverage, defect density, and code complexity are all relevant to the effectiveness and efficiency of testing.",Metrics for testing,Medium,8.3
What is defect density in software testing?,"['The number of defects found per unit of time.', 'The number of defects found per line of code.', 'The number of defects found per tester.', 'The total number of defects found in a software application.']",B,Defect density is typically calculated as the number of defects per thousand lines of code (KLOC) or similar unit of code measurement.,Metrics for testing,Medium,8.3
A high test coverage percentage generally indicates:,"[' A low number of defects.', 'A high number of defects.', ' More comprehensive testing.', 'Less comprehensive testing.']",C,"Higher test coverage means a larger portion of the codebase has been executed during testing, suggesting more thorough testing.  However, high coverage doesn't guarantee the absence of defects.",Metrics for testing,Easy,8.3
What is the primary purpose of using metrics in software testing?,"['To increase the cost of testing.', 'To improve the quality and efficiency of the testing process.', 'To delay software release.', 'To decrease the number of testers required.']",B,"Metrics help in tracking progress, identifying bottlenecks, and making data-driven decisions to enhance the overall quality and efficiency of the software testing process.",Metrics for testing,Easy,8.3
What is a primary goal of algorithmic cost modeling in software development?,"['To optimize code readability.', 'To predict and manage resource consumption.', 'To improve software testing efficiency.', 'To enhance user interface design.']",B) To predict and manage resource consumption.,"Algorithmic cost modeling focuses on estimating the computational resources (time, memory, etc.) required by an algorithm, enabling better resource allocation and performance optimization.",Algorithmic cost modeling,Medium,8.3
Which of the following factors is NOT typically considered in algorithmic cost modeling?,"['Input size', 'Algorithm complexity', 'Compiler optimization level', ""User's internet speed""]",D) User's internet speed,"Algorithmic cost modeling primarily focuses on the intrinsic properties of the algorithm and the input data, not external factors like network speed.",Algorithmic cost modeling,Easy,8.3
What is Big O notation primarily used for in the context of algorithmic cost modeling?,"['Precisely measuring execution time in milliseconds.', 'Describing the space complexity of an algorithm.', ""Analyzing the asymptotic growth rate of an algorithm's resource usage."", ""Evaluating the code's maintainability.""]",C) Analyzing the asymptotic growth rate of an algorithm's resource usage.,Big O notation provides a high-level understanding of how the algorithm's resource needs scale with increasing input size.,Algorithmic cost modeling,Medium,8.3
A software application exhibits O(n^2) time complexity. What does this indicate?,"['The execution time increases linearly with input size.', 'The execution time remains constant regardless of input size.', 'The execution time increases quadratically with input size.', 'The execution time decreases exponentially with input size.']",C) The execution time increases quadratically with input size.,O(n^2) indicates that the execution time is proportional to the square of the input size (n).,Algorithmic cost modeling,Medium,8.3
Which of the following is an example of a resource that algorithmic cost modeling might analyze?,"['User satisfaction ratings.', 'Number of lines of code.', 'Memory usage.', 'Software development team size.']",C) Memory usage.,"Memory usage is a key resource considered in algorithmic cost modeling, along with processing time and other computational resources.",Algorithmic cost modeling,Easy,8.3
"Which scheduling method is best suited for projects with well-defined tasks and dependencies, allowing for precise time estimation and resource allocation?","['Critical Path Method (CPM)', 'Program Evaluation and Review Technique (PERT)', 'Gantt Chart', 'Agile Methodologies']",A) Critical Path Method (CPM),"CPM is specifically designed for projects with deterministic task durations, making it ideal for precise scheduling and resource planning.  PERT, while also a network scheduling technique, handles probabilistic task durations. Gantt charts are visual aids, not scheduling methods themselves, and Agile is iterative and less suitable for projects requiring fixed timelines.",Project duration and staffing,Medium,8.3
What is a common technique used to mitigate risks associated with project staff turnover?,"[' Reducing project scope', ' Cross-training team members', ' Increasing project deadlines', ' Hiring only experienced personnel']",B) Cross-training team members,"Cross-training ensures that multiple team members possess the skills necessary for various tasks, reducing the impact of individual departures.  The other options may not directly address staff turnover.",Project duration and staffing,Easy,8.3
"In project management, what does the term ""resource leveling"" refer to?","[' Assigning the most skilled resource to each task', ' Adjusting resource allocation to smooth out peaks and valleys in demand', ' Reducing the overall number of resources assigned to the project', ' Prioritizing tasks based on resource availability']",B) Adjusting resource allocation to smooth out peaks and valleys in demand,"Resource leveling aims to optimize resource utilization by distributing workload more evenly over time, preventing resource over-allocation during certain phases.",Project duration and staffing,Medium,8.3
A project is significantly behind schedule. Which of the following is NOT a typical recovery strategy?,"[' Crashing the schedule', ' Fast-tracking tasks', ' Reducing project scope', ' Increasing team morale through team building exercises']",D) Increasing team morale through team building exercises,"While team morale is important, improving it doesn't directly address schedule delays. Crashing, fast-tracking, and scope reduction are all standard methods to recover from schedule slippage.",Project duration and staffing,Easy,8.3
What is a potential drawback of employing a large project team?,"[' Increased productivity', ' Improved communication', ' Increased coordination overhead', ' Reduced project costs']",C) Increased coordination overhead,"Larger teams often lead to more complex communication channels and coordination challenges, which can negatively impact efficiency.  Increased productivity and reduced costs aren't guaranteed with larger teams.",Project duration and staffing,Easy,8.3
What is a critical aspect of software quality assurance that focuses on preventing defects rather than detecting them?,"['Testing', 'Debugging', 'Prevention', 'Verification']",C,"Prevention focuses on proactively avoiding defects through methods like code reviews and design improvements, unlike testing and debugging which are reactive. Verification is a broader concept that includes prevention.",Software quality assurance,Medium,8.3
Which of the following is NOT a common method used in software quality assurance to identify defects?,"['Unit testing', 'Integration testing', 'Code compilation', 'System testing']",C,"Code compilation checks for syntax errors and ensures the code can be compiled, but it doesn't identify logic errors or defects in functionality which is the main focus of software quality assurance.",Software quality assurance,Easy,8.3
What is the primary goal of software quality assurance?,"['To reduce development costs', 'To ensure software meets specified requirements', 'To improve programmer efficiency', 'To accelerate the development process']",B,Software quality assurance aims to guarantee that the software meets its intended purpose and functions correctly according to pre-defined specifications.,Software quality assurance,Easy,8.3
Which software quality attribute describes the ability of the software to perform its intended function under stated conditions for a specified period?,"['Reliability', 'Usability', 'Maintainability', 'Efficiency']",A,Reliability refers to the consistency and dependability of the software over time.,Software quality assurance,Medium,8.3
"In software quality assurance, what does the term ""defect"" typically refer to?","['A missing feature requested by the client.', ""An error in the software's design or code that causes it to behave unexpectedly."", ""A delay in the software's delivery schedule."", 'A high level of user satisfaction.']",B,"A defect represents an error, flaw, or fault in the software that leads to incorrect or unexpected behavior.",Software quality assurance,Easy,8.3
Which of the following is NOT a primary goal of a formal technical review?,"['Identifying defects early in the development lifecycle', 'Improving the quality of the product or process', 'Ensuring adherence to project timelines strictly, above all else', 'Facilitating communication and knowledge sharing among team members']",C,"While timely completion is important, it's secondary to identifying defects and improving quality.  Formal technical reviews prioritize quality and defect prevention.",Formal technical reviews,Easy,8.3
