question,options,answer,explanation,topic,difficulty,chapter
What is the primary purpose of modular design in engineering projects?,"['To increase the overall cost of the project.', 'To simplify the manufacturing process.', 'To improve maintainability and reduce complexity.', 'To use fewer materials in construction.']",C,"Modular design breaks down complex systems into smaller, independent modules, making them easier to understand, maintain, and modify. This improves efficiency and reduces overall complexity.",Modular Design,Easy,9.2
Which of the following best describes a key characteristic of a well-defined module in a system?,"['High level of interdependency with other modules.', 'Complex internal structure requiring extensive external interaction.', 'Single, well-defined function or purpose.', 'Lack of clear input and output interfaces.']",C,"A well-defined module has a specific, singular function, minimizing its interaction and dependencies on other parts of the system.",Modular Design,Medium,9.2
"In the context of software engineering, what is a significant advantage of using modular programming techniques?","['Increased code execution time.', 'Reduced code reusability.', 'Easier debugging and testing of individual components.', 'More challenging integration of different modules.']",C,"Modular programming allows developers to test and debug each module independently, simplifying the overall testing process and making it more efficient.",Modular Design,Medium,9.2
How does modularity contribute to the scalability of an engineering system?,"['It necessitates a complete system redesign for any expansion.', 'It makes it difficult to add new functionalities or features.', 'It allows for easier expansion and modification by adding or replacing modules.', ""It limits the overall system's performance and efficiency.""]",C,Modularity enables scalability by allowing for the addition or replacement of modules to expand the system’s capabilities without requiring a complete overhaul.,Modular Design,Medium,9.2
"What is a potential disadvantage of using modular design, especially in large-scale projects?","['Increased efficiency in development and maintenance.', 'Reduced interoperability between modules.', 'Improved system reliability.', 'Increased complexity in interface management between modules.']",D,"While modular design offers many advantages, managing the interfaces and interactions between numerous modules can become complex in large projects.",Modular Design,Medium,9.2
What defines the starting point of a problem within a state space search framework?,"['Goal State', 'State Space', 'Initial State', 'Path Cost']",C,The initial state is explicitly defined as the starting point of the problem-solving process in a state space search.,Problem as a state space search,Easy,9.2
"In a state space search, what element assigns a numerical value to the progression from the initial state to a current state?","['Goal Test', 'Operators', 'State Space', 'Path Cost']",D,"Path cost quantifies the cost associated with a path, making it the correct answer.",Problem as a state space search,Medium,9.2
A well-defined problem necessitates which of the following characteristics?,"['Ambiguous Initial State', 'Undefined State Space', 'Explicit Goal State', 'Unpredictable Operator Outcomes']",C,"A well-defined problem requires a clearly defined goal state, among other criteria.",Problem as a state space search,Easy,9.2
What is a Constraint Satisfaction Problem (CSP)?,"['A problem with no defined solution.', 'A problem solvable only through trial and error.', 'A problem where the solution must satisfy specific constraints.', 'A problem with an undefined initial state.']",C,CSPs are explicitly defined by their requirement to meet given constraints.,Problem as a state space search,Medium,9.2
Which of these is NOT a component of a problem definition within a state space search?,"['Operators', 'Path Cost', 'Random State Selection', 'Goal State']",C,Random state selection is not a formal component of a structured state space search problem definition.,Problem as a state space search,Medium,9.2
What is the crucial element that determines if a state within a problem's state space is the desired solution?,"['Initial State', 'Path Cost', 'Goal Test', 'Operator']",C,The Goal Test is a function that determines whether a given state satisfies the problem's objective.,Problem formulation,Easy,9.2
"In the context of problem formulation, what does the term ""operator"" represent?","['The overall cost of solving the problem.', 'The starting point of the problem-solving process.', ""Actions that change the system's state."", 'The set of all possible problem states.']",C,Operators are the actions that move the system from one state to another within the state space.,Problem formulation,Easy,9.2
"A problem is considered ""well-defined"" if it possesses which of the following characteristics?","['Ambiguous initial state and a vaguely defined goal.', 'A clearly defined initial state, a clearly defined goal state, and known operators.', ' An undefined state space and unpredictable action outcomes.', 'Only a defined goal state, irrespective of the initial state or operators.']",B,"A well-defined problem has unambiguous specifications for its initial state, goal state, state space, and operators.",Problem formulation,Medium,9.2
Which of the following is NOT a necessary component for defining a problem as a state space search?,"['Initial State', 'Goal State', 'Time Constraint', 'Operators']",C,"While time constraints might be relevant in real-world applications, they aren't a fundamental part of defining a problem within the state space search framework.",Problem formulation,Medium,9.2
What type of problem requires the solution to adhere to a set of predefined limitations or rules?,"['State Space Search Problem', 'Deterministic Problem', 'Constraint Satisfaction Problem (CSP)', 'Path Cost Problem']",C,A Constraint Satisfaction Problem (CSP) is explicitly defined by constraints that the solution must satisfy.,Problem formulation,Easy,9.2
What is a crucial characteristic of a well-defined problem in the context of state space search?,"['Ambiguous initial state', 'Implicit goal state', 'Undefined state space', 'Deterministic outcomes']",D,"A well-defined problem necessitates deterministic outcomes, meaning actions have predictable effects.  Ambiguity in the initial state, implicit goal states, and undefined state spaces are all characteristics of *ill*-defined problems.",Well-defined problems,Easy,9.2
"In a well-defined problem, what describes the actions available to transition between states?","['Path Cost', 'Goal Test', 'Operators', 'State Space']",C,"Operators define the actions that move the system from one state to another within the state space. Path cost is a numerical value, the goal test determines if a state is the goal, and the state space is the collection of all possible states.",Well-defined problems,Easy,9.2
Which of the following is NOT a characteristic of a well-defined problem?,"['Clear initial state', 'Explicit goal state', 'Unpredictable action outcomes', 'Defined state space']",C,Well-defined problems require predictable action outcomes (deterministic outcomes). Unpredictable outcomes make a problem ill-defined.,Well-defined problems,Medium,9.2
A problem where the solution must adhere to specific limitations or requirements is known as what type of problem?,"[' Deterministic Problem', ' State Space Search Problem', ' Constraint Satisfaction Problem', ' Well-defined Problem']",C,Constraint Satisfaction Problems (CSPs) explicitly involve constraints or conditions that the solution must satisfy.,Well-defined problems,Medium,9.2
What component of a problem's formulation determines whether a given state is the desired solution?,"['Initial State', 'Operators', 'Goal Test', 'Path Cost']",C,The goal test is a function that verifies if a particular state matches the defined goal state.,Well-defined problems,Easy,9.2
What is a crucial characteristic of a Constraint Satisfaction Problem (CSP)?,"[' Minimizing path cost between states.', ' Satisfying a set of predefined constraints.', ' Predicting unpredictable outcomes.', ' Utilizing a heuristic search algorithm.']",B,A CSP's core definition is that its solution must adhere to specified constraints or conditions.,Constraint satisfaction problem,Easy,9.2
"In the context of problem formulation, what needs to be clearly defined to guide the search process effectively?","[' The number of possible operators', ' The total path cost of all possible solutions', ' The initial state, goal state, operators, and path costs', ' Only the goal state and path costs']",C,"A well-formed problem requires clear definitions of the starting point, desired outcome, available actions, and their associated costs.",Constraint satisfaction problem,Medium,9.2
Which of the following is NOT a characteristic of a well-defined problem?,"[' A clearly specified initial state.', ' Uncertain or ambiguous goal state.', ' Defined state space encompassing all possibilities.', ' Known operators for transitions between states.']",B,A well-defined problem necessitates a clearly defined goal state to determine solution success.,Constraint satisfaction problem,Easy,9.2
"What defines the ""State Space"" in a problem formulated as a state space search?","['The cost of reaching a particular state', 'The initial state of the problem', 'All possible states reachable from the initial state', 'The goal state of the problem']",C,The state space encompasses every state achievable from the starting point.,Constraint satisfaction problem,Easy,9.2
What is a key difference between a general state space search problem and a Constraint Satisfaction Problem (CSP)?,"[' State space search problems always have deterministic outcomes.', 'CSPs always involve finding the shortest path.', 'CSPs explicitly incorporate constraints that solutions must satisfy.', 'State space search problems do not have a defined goal state.']",C,"The defining feature of a CSP is the necessity to satisfy given constraints, a characteristic not inherent in all state space searches.",Constraint satisfaction problem,Medium,9.2
Which uninformed search technique guarantees finding the shortest path in an unweighted graph?,"['Depth-First Search (DFS)', 'Depth-Limited Search (DLS)', 'Breadth-First Search (BFS)', 'Iterative Deepening Search (IDS)']",C,"Breadth-First Search systematically explores all nodes at a given depth before moving to the next level, ensuring the shortest path is found in an unweighted graph.",Uninformed search techniques,Easy,9.2
What data structure is primarily used by Depth-First Search?,"['Queue', 'Priority Queue', 'Stack', 'Heap']",C,"Depth-First Search utilizes a stack (Last-In, First-Out) to manage the order of node exploration.",Uninformed search techniques,Easy,9.2
Iterative Deepening Search combines the advantages of which two other uninformed search techniques?,"['BFS and Bidirectional Search', 'DFS and Bidirectional Search', 'DFS and BFS', 'DLS and Bidirectional Search']",C,Iterative Deepening Search leverages the depth-first exploration of DFS and the shortest-path guarantee of BFS (when the depth limit is sufficient).,Uninformed search techniques,Medium,9.2
Which uninformed search technique is susceptible to getting trapped in infinitely deep branches?,"['Breadth-First Search', 'Iterative Deepening Search', 'Depth-Limited Search', 'Depth-First Search']",D,"Depth-First Search can become stuck exploring a single, infinitely deep branch, failing to explore other potential solutions.",Uninformed search techniques,Easy,9.2
Depth-Limited Search addresses a key limitation of which other uninformed search technique?,"['Breadth-First Search', 'Iterative Deepening Search', 'Bidirectional Search', 'Depth-First Search']",D,Depth-Limited Search mitigates the risk of infinite loops inherent in Depth-First Search by imposing a maximum search depth.,Uninformed search techniques,Medium,9.2
Which uninformed search algorithm guarantees finding the shortest path in an unweighted graph?,"['Depth-First Search (DFS)', 'Depth-Limited Search (DLS)', 'Breadth-First Search (BFS)', 'Iterative Deepening Search (IDS)']",C,"Breadth-First Search explores all nodes at the current depth before moving to the next, ensuring the shortest path is found first in an unweighted graph.",Informed Search,Easy,9.2
What data structure is primarily used by Depth-First Search?,"['Queue', 'Priority Queue', 'Stack', 'Heap']",C,"Depth-First Search utilizes a stack (Last-In, First-Out) to manage its exploration of nodes.",Informed Search,Easy,9.2
Which search algorithm addresses the issue of infinite paths encountered in Depth-First Search by imposing a depth limit?,"['Breadth-First Search', 'Iterative Deepening Search', 'Bidirectional Search', 'Depth-Limited Search']",D,Depth-Limited Search prevents infinite descent by setting a maximum search depth.,Informed Search,Medium,9.2
"In the context of informed search, what is a heuristic?","['A data structure used for managing search states.', 'A guarantee of finding the optimal solution.', 'Problem-specific knowledge used to guide the search.', 'An algorithm for exploring unweighted graphs.']",C,A heuristic provides problem-specific knowledge to improve the efficiency of a search algorithm.,Informed Search,Medium,9.2
Which informed search algorithm prioritizes nodes based solely on an estimated distance to the goal?,"['A* Search', 'Hill Climbing Search', 'Greedy Best-First Search', 'Simulated Annealing']",C,"Greedy Best-First Search selects the node seemingly closest to the goal based on the heuristic, without considering the cost to reach that node.",Informed Search,Medium,9.2
"In a two-player zero-sum game, what does the Minimax algorithm aim to achieve for the maximizing player?","['Minimize the maximum possible loss', 'Maximize the minimum possible gain', ""Minimize the opponent's maximum gain"", ""Maximize the opponent's minimum loss""]",B) Maximize the minimum possible gain,"The Minimax algorithm seeks to maximize the player's minimum guaranteed payoff, ensuring the best outcome even if the opponent plays optimally.",Game playing,Medium,9.2
What is the primary purpose of alpha-beta pruning in the context of the Minimax algorithm?,"['To improve the accuracy of the heuristic evaluation function.', 'To increase the search depth explored by the algorithm.', 'To reduce the computational cost of the search.', 'To guarantee finding the absolute optimal solution.']",C) To reduce the computational cost of the search.,"Alpha-beta pruning strategically eliminates branches of the game tree that cannot affect the final decision, significantly reducing the number of nodes evaluated.",Game playing,Medium,9.2
Which of the following best describes a zero-sum game?,"['A game where players cooperate to achieve a common goal.', ""A game where one player's gain is always exactly balanced by another player's loss."", 'A game with multiple possible outcomes, none of which is guaranteed.', 'A game where players have incomplete information about the game state.']",B) A game where one player's gain is always exactly balanced by another player's loss.,"In a zero-sum game, the total gains of all players always sum to zero.  One player's win is directly equivalent to another's loss.",Game playing,Easy,9.2
"In the alpha-beta pruning algorithm, what does the 'beta' value represent?","['The maximum value found so far at a ""max"" node.', 'The minimum value found so far at a ""min"" node.', 'The best move found so far for the maximizing player.', 'The depth of the search tree currently being explored.']","B) The minimum value found so far at a ""min"" node.","Beta tracks the minimum score the minimizing player is assured of, used to prune branches that cannot yield a better outcome for the minimizing player.",Game playing,Medium,9.2
A game is formally defined as a search problem.  What is NOT a component of this definition?,"['Initial state', 'Successor function', ' Heuristic function', 'Terminal test']",C) Heuristic function,"While heuristic functions are often used in game-playing algorithms to estimate the value of states, they are not a fundamental component of the formal definition of a game as a search problem.  The core components are the initial state, successor function, terminal test, and utility function.",Game playing,Medium,9.2
"In simulated annealing, what is the role of the temperature parameter?","['It determines the search space size.', 'It controls the probability of accepting worse solutions.', 'It defines the number of iterations.', 'It sets the initial state of the search.']",B,"The temperature parameter in simulated annealing directly influences the probability of accepting moves that worsen the current solution. Higher temperatures allow more exploration, while lower temperatures favor exploitation of the current best solution.",Adversarial search techniques,Medium,9.2
Which of the following is NOT a characteristic of adversarial search in AI as described in the context of games?,"['Deterministic environment', 'Fully observable environment', 'Two agents with opposing goals', 'Probabilistic outcomes for each action']",D,"Adversarial search, in the context described, deals with deterministic environments where the outcome of each action is known.  Probabilistic outcomes are not a characteristic feature.",Adversarial search techniques,Medium,9.2
Local beam search is best characterized as:,"['A depth-first search algorithm.', 'A path-based algorithm that tracks multiple states.', 'A breadth-first search algorithm.', 'A heuristic search that focuses on a single state.']",B,"Local beam search maintains and expands k states simultaneously, unlike algorithms that focus on a single path.",Adversarial search techniques,Easy,9.2
"In simulated annealing, a high temperature setting leads to:","['A more deterministic search.', 'Faster convergence to a solution.', 'A greater chance of exploring ""bad"" moves.', 'A guaranteed optimal solution.']",C,"High temperature increases the probability of accepting moves that temporarily worsen the solution, allowing for more exploration of the search space.",Adversarial search techniques,Easy,9.2
What is a key difference between simulated annealing and hill-climbing?,"['Hill-climbing uses a temperature parameter.', 'Simulated annealing always finds the optimal solution.', 'Simulated annealing allows for the acceptance of worse solutions.', 'Hill-climbing explores more widely than simulated annealing.']",C,"Unlike hill-climbing which only accepts better solutions, simulated annealing incorporates a probability of accepting worse solutions, enabling it to escape local optima.",Adversarial search techniques,Medium,9.2
"In the Minimax algorithm, what is the role of the ""maximizing player""?","['To minimize the maximum value of the position.', 'To maximize the minimum value of the position.', 'To randomly select a move from available options.', 'To always choose the first available move.']",B) To maximize the minimum value of the position.,"The maximizing player aims to choose the move that leads to the best possible outcome, even considering the opponent's best response (which will minimize the player's score).",Mini-max Search,Easy,9.2
What is the primary purpose of alpha-beta pruning in the context of Minimax search?,"['To increase the search depth.', 'To improve the heuristic evaluation function.', 'To reduce the search space explored.', 'To guarantee finding the optimal solution faster.']",C) To reduce the search space explored.,"Alpha-beta pruning eliminates the exploration of branches that are guaranteed to be worse than already explored options, thus improving efficiency.",Mini-max Search,Medium,9.2
The Minimax algorithm is best described as what type of search?,"['Breadth-first search', 'Depth-limited search', 'Iterative deepening search', 'Best-first search']",B) Depth-limited search,"Minimax is a depth-first search algorithm, but it's typically applied with a limited depth to avoid computationally expensive searches.",Mini-max Search,Easy,9.2
"In alpha-beta pruning, what does the value 'alpha' represent at a ""max"" node?","['The minimum score the minimizing player is assured of.', 'The maximum score the maximizing player is assured of.', 'The average score of all possible moves.', 'The score of the last evaluated move.']",B) The maximum score the maximizing player is assured of.,Alpha tracks the best value found so far for the maximizing player at a given node.,Mini-max Search,Medium,9.2
How does perfect move ordering affect the efficiency of alpha-beta pruning?,"['It has no effect.', 'It significantly reduces the search space.', 'It increases the search space.', 'It makes the algorithm slower.']",B) It significantly reduces the search space.,"Optimal move ordering allows alpha-beta pruning to eliminate many more branches, maximizing its efficiency.",Mini-max Search,Medium,9.2
"In the context of Alpha-Beta pruning, what does the 'alpha' value represent for a maximizing player?","['The minimum score the minimizing player is assured of.', 'The maximum score the maximizing player is assured of.', 'The average score achievable by the maximizing player.', 'The worst possible score for the maximizing player.']",B) The maximum score the maximizing player is assured of.,"Alpha represents the best (maximum) value found so far at a ""max"" node, representing the minimum score the maximizing player is guaranteed to achieve.",Alpha-Beta Pruning,Medium,9.2
Alpha-beta pruning is a modification of which primary search algorithm?,"['Breadth-First Search', 'Depth-Limited Search', 'A* Search', 'Minimax Algorithm']",D) Minimax Algorithm,Alpha-beta pruning is an optimization technique that improves the efficiency of the Minimax algorithm.,Alpha-Beta Pruning,Easy,9.2
"What is the primary effect of ""good move ordering"" in Alpha-Beta pruning?","['It increases the search space.', 'It decreases the effectiveness of pruning.', 'It improves the effectiveness of pruning.', 'It does not affect the pruning process.']",C) It improves the effectiveness of pruning.,"Good move ordering allows the algorithm to prune more effectively, leading to a reduction in computation time.",Alpha-Beta Pruning,Medium,9.2
"In Alpha-Beta pruning, under what condition would a ""beta cut-off"" occur at a minimizing node?","['When beta is greater than alpha.', 'When alpha is greater than or equal to beta.', 'When alpha and beta are equal.', 'When depth is zero.']",B) When alpha is greater than or equal to beta.,"A beta cut-off occurs when the current best value for the minimizing player (beta) is less than or equal to the best value already found for the maximizing player (alpha), meaning further exploration of the branch is unnecessary.",Alpha-Beta Pruning,Medium,9.2
Which statement is TRUE regarding Alpha-Beta pruning and its impact on the final result?,"['Pruning affects the final result, leading to a suboptimal solution.', 'Pruning does not affect the final result if the algorithm is implemented correctly.', 'Pruning only affects the final result in specific game scenarios.', 'The final result is always improved by pruning.']",B) Pruning does not affect the final result if the algorithm is implemented correctly.,"Alpha-beta pruning is an optimization technique; it does not change the core logic of the Minimax algorithm, so the final result (the best move) remains unchanged.",Alpha-Beta Pruning,Easy,9.2
