question,options,answer,explanation,topic,difficulty,chapter
Which of the following organizations is NOT typically involved in establishing networking guidelines?,"['IEEE', 'ANSI', 'NASA', 'ISO']",C,"NASA (National Aeronautics and Space Administration) is primarily focused on space exploration and aeronautics, not networking standards.  IEEE, ANSI, and ISO are all involved in developing and establishing networking standards.",Networking model,Easy,5.1
How many layers are in the OSI model?,"['4', '5', '7', '10']",C,The Open Systems Interconnection (OSI) model is a seven-layer model for network communications.,Networking model,Easy,5.1
The TCP/IP model is primarily used on which network?,"['Local Area Network (LAN)', 'Wide Area Network (WAN)', 'The Internet', 'Metropolitan Area Network (MAN)']",C,The TCP/IP model is the foundational model for communication on the internet.,Networking model,Easy,5.1
Which layer in both the OSI and TCP/IP models is responsible for end-to-end communication?,"['Data Link Layer', 'Network Layer', 'Transport Layer', 'Application Layer']",C,The transport layer in both models handles end-to-end data delivery and reliability.,Networking model,Medium,5.1
What is the main difference between the OSI and TCP/IP models regarding the number of layers?,"['The OSI model has fewer layers.', 'The TCP/IP model has fewer layers.', 'They have the same number of layers.', ' The number of layers depends on the network type.']",B,"The TCP/IP model has four layers, while the OSI model has seven.",Networking model,Medium,5.1
Which of the following organizations is NOT typically involved in establishing networking guidelines and standards?,"['IEEE', 'ISO', 'W3C', 'NASA']",D,"NASA is a space agency, not a standards organization for networking. IEEE, ISO, and W3C are all involved in creating and maintaining networking standards.",Protocols and Standards,Easy,5.1
How many layers are present in the OSI model?,"['4', '5', '6', '7']",D,The Open Systems Interconnection (OSI) model is a seven-layer model for network communication.,Protocols and Standards,Easy,5.1
"The TCP/IP model, commonly used on the internet, comprises how many layers?","['Five', 'Seven', 'Four', 'Three']",C,"The TCP/IP model has four layers: link, internet, transport, and application.",Protocols and Standards,Easy,5.1
Which layer in the OSI model deals directly with the physical cabling and signal transmission?,"['Application Layer', 'Transport Layer', 'Network Layer', 'Physical Layer']",D,The Physical Layer is the lowest layer in the OSI model and is responsible for the physical transmission of data.,Protocols and Standards,Medium,5.1
What is the primary difference between the OSI model and the TCP/IP model in terms of their layered architecture?,"['Data transmission speed', 'Number of layers', 'Type of protocols used', 'Network security features']",B,"The OSI model has seven layers, while the TCP/IP model has four.  This is a fundamental architectural difference.",Protocols and Standards,Medium,5.1
Which layer of the OSI model is responsible for the reliable end-to-end delivery of data?,"['Physical Layer', 'Data Link Layer', 'Network Layer', 'Transport Layer']",D,"The Transport layer in the OSI model manages the reliable transmission of data between applications.  It handles segmentation, error detection, and flow control.",OSI model,Medium,5.1
How many layers comprise the TCP/IP model?,"['Five', 'Seven', 'Four', 'Three']",C,"The TCP/IP model, a less layered model than OSI, is composed of four layers.",OSI model,Easy,5.1
Which of the following organizations is NOT typically involved in establishing networking guidelines?,"['ISO', 'IEEE', 'NASA', 'ITU']",C,"While NASA is involved in numerous technological endeavors, it is not primarily focused on establishing general networking guidelines like ISO, IEEE, and ITU.",OSI model,Easy,5.1
The OSI model's presentation layer is primarily concerned with which aspect of data communication?,"['Physical transmission of bits', 'Data formatting and encoding', 'Routing packets across networks', 'End-to-end connection management']",B,"The presentation layer handles data formatting, encryption, and other aspects of data presentation to ensure that the data is in a usable form for the application layer.",OSI model,Medium,5.1
What is the highest layer in the OSI model?,"['Network Layer', 'Transport Layer', 'Session Layer', 'Application Layer']",D,"The Application layer is the topmost layer of the OSI model, interacting directly with the user's application software.",OSI model,Easy,5.1
Which of the following is NOT a layer in the TCP/IP model?,"['Application', 'Session', 'Transport', 'Internet']",B,"The TCP/IP model has four layers: link, internet, transport, and application. The session layer is part of the OSI model, not the TCP/IP model.",TCP/IP model,Easy,5.1
How many layers comprise the TCP/IP model?,"['5', '7', '4', '3']",C,The TCP/IP model is a four-layer network model.,TCP/IP model,Easy,5.1
What is the name of the layer in the TCP/IP model responsible for end-to-end communication?,"['Link Layer', 'Internet Layer', 'Transport Layer', 'Application Layer']",C,The transport layer in the TCP/IP model handles end-to-end communication between applications.,TCP/IP model,Medium,5.1
The TCP/IP model is primarily used in which network?,"['Local Area Networks (LANs) only', 'Wide Area Networks (WANs) only', 'The Internet', 'Both LANs and WANs but not the Internet']",C,The TCP/IP model is the dominant network model used on the Internet.,TCP/IP model,Easy,5.1
Which standard organization is NOT explicitly mentioned in the provided context as establishing networking guidelines?,"['IEEE', 'ISO', 'IETF', 'ITU']",C,"The passage mentions IEEE, ANSI, ITU, and ISO.  IETF (Internet Engineering Task Force) is another important organization, but not listed in the given text.",TCP/IP model,Medium,5.1
Which networking device primarily uses MAC addresses to forward data packets?,"['Router', 'Hub', 'Switch (Layer 2)', 'Modem']",C,"Layer 2 switches operate at the data link layer and use MAC addresses to forward data packets within a local network.  While hubs broadcast to all devices, switches are more efficient.","Networking Devices (Hubs, Bridges, Switches, and Routers)",Easy,5.1
What is the primary difference between a hub and a switch in a local area network (LAN)?,"['Hubs use IP addresses, switches use MAC addresses.', 'Hubs are faster, switches are slower.', 'Hubs broadcast data to all connected devices, switches forward data selectively.', 'Hubs operate at Layer 3, switches at Layer 2.']",C,"Hubs broadcast data to all connected devices, leading to collisions and inefficiency, while switches forward data selectively to the intended recipient based on MAC addresses.","Networking Devices (Hubs, Bridges, Switches, and Routers)",Easy,5.1
A network device that operates at the Data Link Layer (Layer 2) and offers more functionality than a hub is a:,"['Router', 'Modem', 'Bridge', 'Repeater']",C,"Bridges operate at the data link layer and provide more sophisticated functionality than hubs, including filtering and forwarding data based on MAC addresses.","Networking Devices (Hubs, Bridges, Switches, and Routers)",Medium,5.1
Which of the following networking devices can operate at both Layer 2 (MAC address) and Layer 3 (IP address)?,"['Hub', 'Bridge', 'Layer 3 Switch', 'Repeater']",C,"Layer 3 switches, also known as multilayer switches, can operate at both the data link layer (Layer 2) and the network layer (Layer 3), using both MAC and IP addresses for routing decisions.","Networking Devices (Hubs, Bridges, Switches, and Routers)",Medium,5.1
"In large networks, what device is generally preferred over hubs to connect computers within the same subnet?","['Routers', 'Bridges', 'Switches', 'Repeaters']",C,"Switches offer significant performance advantages over hubs in larger networks due to their selective forwarding capabilities, reducing collisions and improving overall network efficiency.","Networking Devices (Hubs, Bridges, Switches, and Routers)",Easy,5.1
Which of the following is NOT an example of unguided transmission media?,"['Fiber optic cable', 'Microwaves', 'Radio waves', 'Satellite communication']",A,"Fiber optic cable is a guided transmission medium, utilizing physical cables to transmit data.  Microwaves, radio waves, and satellite communication all rely on electromagnetic waves for data transmission without physical cables.",Transmission media,Easy,5.1
What characteristic of guided transmission media makes them suitable for high-speed networks?,"['Susceptibility to electromagnetic interference', 'Low bandwidth capacity', 'Short transmission distances', 'High bandwidth']",D,"High bandwidth is a key characteristic of guided transmission media, enabling the transmission of large amounts of data quickly, making them ideal for high-speed networks.",Transmission media,Easy,5.1
Unguided transmission media primarily utilize which method for data transmission?,"['Physical conductors', 'Electromagnetic waves', 'Optical fibers', 'Coaxial cables']",B,"Unguided transmission media transmit data through electromagnetic waves, unlike guided media which use physical conductors or optical fibers.",Transmission media,Easy,5.1
A significant advantage of guided transmission media over unguided media is:,"['Greater susceptibility to interference', 'Lower bandwidth capacity', ' Improved security and less vulnerability to eavesdropping', 'Increased cost-effectiveness for long distances']",C,"Guided transmission media offer better security and reduced vulnerability to eavesdropping compared to unguided media, where signals can be intercepted more easily.",Transmission media,Medium,5.1
Which of the following is a potential disadvantage of using unguided transmission media?,"['High bandwidth capacity', ' Immunity to electromagnetic interference', ' Susceptibility to interference from environmental factors', ' Low cost of implementation']",C,"Unguided transmission media are susceptible to interference from various environmental factors, unlike guided media which are generally more shielded.",Transmission media,Medium,5.1
