question,options,answer,explanation,topic,difficulty,chapter
What is the role of the 'e' symbol in the transition function ∆ of the pushdown automaton?,"['It represents an error state.', 'It represents the empty string or null input.', 'It represents the final state.', 'It represents the start symbol on the stack.']",B,"In the context of pushdown automata, 'e' typically represents the empty string or the absence of an input symbol.",Push down automata,Medium,6.2
What is the set of stack symbols (Γ) for the pushdown automaton M?,"['{a, b, c}', '{p, q}', '{S, a, b, c}', '{e}']",C,"The passage clearly defines the stack alphabet Γ as {S, a, b, c}.",Push down automata,Easy,6.2
Which of the following transitions pops 'a' from the stack?,"['((q, e, S), (q, aSa))', '((q, e, S), (q, e))', '((q, a, a), (q, e))', '((q, e, S), (q, bSb))']",C,"The transition ((q, a, a), (q, e)) reads 'a' from the input and pops 'a' from the stack, replacing it with the empty string 'e'.",Push down automata,Medium,6.2
Which type of Pushdown Automata (PDA) is often used to demonstrate the equivalence between Context-Free Languages (CFLs) and PDAs?,"['Non-deterministic Finite Automata (NFA) PDA', 'Deterministic Finite Automata (DFA) PDA', 'Empty Stack PDA', 'Turing Machine PDA']",C,"Empty Stack PDAs and Final State PDAs are both used in proofs regarding CFLs and PDAs, but the Empty Stack PDA is more commonly used to show equivalence.",Equivalence of context free language and PDA,Medium,6.2
What is a key concept demonstrated by the equivalence theorem relating Context-Free Languages (CFLs) and Pushdown Automata (PDAs)?,"['All regular languages are context-free.', 'All context-sensitive languages are context-free.', ' The same set of languages can be recognized by both CFLs and PDAs.', 'PDAs are more powerful than Turing Machines.']",C,The theorem establishes that both formalisms define the same class of languages.,Equivalence of context free language and PDA,Easy,6.2
A proof of the equivalence between Context-Free Languages and Pushdown Automata typically involves proving which two lemmas?,"['Lemma 1: Every CFG is accepted by some PDA; Lemma 2: Every PDA accepts a regular language.', 'Lemma 1: Every CFL is accepted by some PDA; Lemma 2: If a language is accepted by a PDA, it is a CFL.', 'Lemma 1: Every PDA accepts a recursive language; Lemma 2: Every CFL is decidable.', 'Lemma 1: Every regular language is a CFL; Lemma 2: Every PDA accepts a regular language.']",B,These two lemmas directly address the inclusion of CFLs in the set of PDA-accepted languages and vice-versa.,Equivalence of context free language and PDA,Medium,6.2
What is the primary goal of constructing a PDA equivalent to a given Context-Free Grammar (CFG)?,"['To prove that CFGs are more powerful than PDAs.', 'To demonstrate that the CFG can only accept regular languages.', 'To show that a given CFL can be accepted by a PDA.', 'To simplify the CFG for easier analysis.']",C,"The construction aims to show that any language generated by a CFG can also be accepted by a PDA, a key step in proving equivalence.",Equivalence of context free language and PDA,Easy,6.2
"In the context of proving the equivalence of Context-Free Languages and Pushdown Automata, what does the construction of a PDA equivalent to a CFG illustrate?","['The limitations of PDAs in recognizing languages.', 'The inherent complexity of context-free languages.', 'The capacity of PDAs to accept context-free languages.', 'The superiority of CFGs over PDAs.']",C,This construction directly demonstrates one half of the equivalence theorem—that all CFLs are accepted by some PDA.,Equivalence of context free language and PDA,Medium,6.2
What is the condition on the length of the string 'w' in the Pumping Lemma for Regular Languages?,"['|w| < n', '|w| ≤ n', '|w| ≥ n', '|w| = n']",C,"The Pumping Lemma states that for a regular language L, there exists an integer n such that any string w in L with length greater than or equal to n can be pumped.",Pumping lemma for context free language,Easy,6.2
"In the Pumping Lemma for Regular Languages, what must be true about the substring 'y'?","['y = e (empty string)', 'y ≠ e (not an empty string)', '|y| > n', '|y| = n']",B,The substring 'y' cannot be an empty string; it must have a length greater than zero for the pumping process to be meaningful.,Pumping lemma for context free language,Easy,6.2
"According to the Pumping Lemma for Regular Languages, what condition must be met concerning the length of the substring 'xy'?","['|xy| > n', '|xy| ≥ n', '|xy| < n', '|xy| ≤ n']",D,The lemma specifies that the combined length of substrings 'x' and 'y' must be less than or equal to n.,Pumping lemma for context free language,Medium,6.2
"Which of the following strings, derived from the Pumping Lemma, is guaranteed to also be in the regular language L, for any non-negative integer i?","['xyz', 'xyyz', 'xyiz', 'xy<sup>i</sup>z']",D,The Pumping Lemma states that xy<sup>i</sup>z (where <sup>i</sup> represents the substring 'y' repeated i times) will always be a member of the language L for any non-negative integer i.,Pumping lemma for context free language,Medium,6.2
The Pumping Lemma provides a method to prove which of the following?,"['A language is context-free.', 'A language is regular.', 'A language is not regular.', 'A language is not context-free.']",C,The Pumping Lemma is primarily used to prove that a language is *not* regular.  It is a proof by contradiction technique.,Pumping lemma for context free language,Medium,6.2
Which of the following best describes a context-free grammar?,"['A grammar where the production rules depend entirely on the surrounding context of a non-terminal symbol.', 'A grammar where the production rules are independent of the surrounding context of a non-terminal symbol.', 'A grammar that only generates strings of a specific length.', 'A grammar that can only generate regular languages.']",B,Context-free grammars are defined by their independence from the surrounding context when applying production rules.,Properties of context free Language,Easy,6.2
"In a context-free grammar, what is the term 'context' referring to?","['The length of the string being generated.', 'The surrounding symbols of a non-terminal symbol in a production rule.', 'The specific type of grammar being used.', 'The order of operations in the production rules.']",B,The context refers to the symbols immediately preceding and following a non-terminal symbol within a production rule.,Properties of context free Language,Easy,6.2
A production rule like A → aA is context-free because:,"['It only applies to the start symbol.', 'It depends on the surrounding symbols of A.', 'It can be applied regardless of the surrounding symbols of A.', 'It generates only a single terminal symbol.']",C,The key characteristic of context-free rules is their independence from surrounding context.,Properties of context free Language,Medium,6.2
What type of language is generated by a context-free grammar?,"['Only regular languages.', 'Only context-sensitive languages.', 'Context-free languages.', 'Only languages with a finite number of strings.']",C,"Context-free grammars, by definition, generate context-free languages.",Properties of context free Language,Easy,6.2
Consider the production rule S → aaAb.  The symbol 'A' is in what context?,"[""No context, as it's the start symbol."", ""The context of 'a' only."", ""The context of 'aa' and 'b'."", ""The context of 'b' only.""]",C,"The symbol 'A' is directly preceded by 'aa' and followed by 'b'; hence, it is within the context of 'aa' and 'b'.",Properties of context free Language,Medium,6.2
