question,options,answer,explanation,topic,difficulty,chapter
What is a key characteristic of an effective formal technical review process?,"[' Informal and unstructured discussions', ' Sole reliance on individual expertise', ' Pre-defined checklists and review criteria', ' Limited participant involvement']",C,"Effective reviews utilize structured processes, including checklists and defined criteria, to ensure thoroughness and consistency.",Formal technical reviews,Easy,8.3
"In a formal technical review, who is typically responsible for leading the review meeting and facilitating the discussion?","['The project manager only', 'The most senior engineer only', 'A designated moderator or reviewer', 'The author of the document being reviewed']",C,A neutral moderator or reviewer leads the meeting to ensure an objective and efficient process.,Formal technical reviews,Medium,8.3
What type of document is frequently reviewed in a formal technical review process in engineering?,"['Marketing brochures', 'Project management plans', 'Engineering designs and specifications', 'Company newsletters']",C,Formal technical reviews are predominantly used to scrutinize technical documents like designs and specifications to ensure quality and adherence to standards.,Formal technical reviews,Easy,8.3
"Besides finding defects, what other benefit can be derived from a well-conducted formal technical review?","['Reduced project costs only', 'Improved team morale only', 'Enhanced knowledge sharing and skill development within the team', 'Increased individual workload']",C,"Formal reviews provide opportunities for team members to learn from each other, improving their understanding and skills.  While cost reduction is a potential outcome, knowledge sharing and skill development are direct benefits.",Formal technical reviews,Medium,8.3
What is a key characteristic of a formal approach to software quality assurance (SQA)?,"[' It relies heavily on informal reviews and ad-hoc testing.', 'It emphasizes subjective assessments and individual opinions.', 'It follows a structured and documented process.', 'It lacks defined metrics and quality standards.']",C,"Formal SQA methodologies utilize defined processes, documentation, and metrics to ensure consistent and measurable quality.",Formal approaches to SQA,Easy,8.3
Which of the following is NOT typically a component of a formal SQA plan?,"['Defined quality metrics', ' Testing procedures', ' Random, unplanned testing', ' Review processes']",C,"Formal SQA plans are characterized by planned and structured activities, not random testing.",Formal approaches to SQA,Medium,8.3
A formal SQA approach often incorporates which of the following to manage and track defects?,"[' Informal communication only', ' A defect tracking system', ' Reliance on memory and informal notes', ' No specific defect management process']",B,Formal SQA relies on systematic defect tracking and management for efficient resolution.,Formal approaches to SQA,Easy,8.3
How does a formal SQA approach contribute to improved software quality?,"['By eliminating the need for testing.', 'By relying solely on individual developer skills.', 'By providing a structured and repeatable process for identifying and resolving defects.', 'By reducing the documentation required for the software development process.']",C,Formal SQA provides a framework to systematically identify and rectify defects leading to better software quality.,Formal approaches to SQA,Medium,8.3
Which of these best describes the goal of a formal SQA process?,"['To increase development speed regardless of quality.', 'To ensure the software meets predefined quality standards.', 'To minimize the effort spent on testing.', 'To eliminate the need for documentation.']",B,The primary aim of formal SQA is to ensure the software aligns with predetermined quality benchmarks.,Formal approaches to SQA,Easy,8.3
Which of the following is NOT a common statistical method used in software quality assurance?,"['Regression analysis', 'Hypothesis testing', 'ANOVA (Analysis of Variance)', ' Qualitative Content Analysis']",D,"Regression analysis, hypothesis testing, and ANOVA are quantitative statistical methods frequently employed in software quality assurance to analyze data and draw inferences about software performance and reliability. Qualitative content analysis is a qualitative method, not a statistical one.",Statistical software quality assurance,Medium,8.3
"In software testing, what does a high p-value typically indicate in a hypothesis test regarding a software bug?","['Strong evidence to reject the null hypothesis (bug exists)', 'Strong evidence to accept the null hypothesis (no bug exists)', 'Insufficient evidence to reject the null hypothesis (bug might or might not exist)', ' The test is inconclusive.']",C,"A high p-value suggests that the observed results are likely due to chance, failing to provide sufficient evidence to reject the null hypothesis (often that there is no bug).",Statistical software quality assurance,Medium,8.3
What type of statistical analysis is most suitable for comparing the mean defect densities across multiple software development teams?,"['Chi-square test', ' t-test', 'ANOVA (Analysis of Variance)', 'Linear Regression']",C,"ANOVA is designed to compare means across three or more groups (in this case, software development teams).  A t-test is for comparing two groups.  Chi-square is used for categorical data. Linear regression is for modeling relationships between variables.",Statistical software quality assurance,Medium,8.3
What statistical measure is often used to quantify the variability or spread of defect densities within a software module?,"['Mean', 'Median', 'Mode', 'Standard Deviation']",D,Standard deviation measures the dispersion of data around the mean.  It indicates how much the defect densities vary within the software module.,Statistical software quality assurance,Easy,8.3
A software testing team is analyzing the failure rate of a system over time. Which statistical distribution might be a useful model for this type of data?,"['Normal Distribution', 'Poisson Distribution', 'Binomial Distribution', ' Uniform Distribution']",B,The Poisson distribution models the probability of a given number of events occurring in a fixed interval of time or space if these events occur with a known average rate and independently of the time since the last event.  This aligns well with modeling software failure rates.,Statistical software quality assurance,Medium,8.3
What is a primary characteristic of good software metrics?,"['Subjectivity and ambiguity', 'Complexity and difficulty of measurement', 'Objectivity and quantifiability', 'Reliance on qualitative assessments']",C,Good software metrics should be objective and quantifiable to allow for reliable comparison and analysis.  Subjectivity and qualitative assessments introduce bias and hinder the evaluation process.,A framework for software metrics,Easy,8.3
Which of the following is NOT a typical goal of using software metrics in a software development project?,"[' Improving software quality', ' Reducing development time', ' Increasing code complexity', ' Tracking project progress']",C,"The goal of software metrics is to improve efficiency and quality, not to intentionally increase code complexity.  Complexity should be managed and ideally reduced where possible.",A framework for software metrics,Medium,8.3
A software metric focused on the number of bugs found per thousand lines of code is an example of what type of metric?,"['Process metric', 'Product metric', 'Project metric', 'Resource metric']",B,"This metric directly measures a characteristic of the software product itself (the code). Process, project, and resource metrics focus on different aspects of the software development process.",A framework for software metrics,Medium,8.3
What is a potential risk associated with using inappropriate or poorly designed software metrics?,"['Improved project management', 'Increased developer motivation', 'Misleading project assessments', 'Enhanced software quality']",C,"Poor metrics can lead to inaccurate conclusions about the project's status and performance, potentially resulting in poor decisions.",A framework for software metrics,Easy,8.3
Which of the following is an example of a process metric in software development?,"['Lines of code', 'Number of defects', 'Cyclomatic complexity', 'Defect density per function point']",D,Defect density per function point is a metric that measures the number of defects in relation to the functionality delivered. It is a measure of the efficiency of the development process rather than a measure of the product itself.,A framework for software metrics,Medium,8.3
"In the context of structural analysis, what is the primary function of a stiffness matrix?","['To represent the nodal displacements of a structure.', 'To relate nodal forces to nodal displacements.', 'To define the material properties of structural elements.', 'To determine the critical buckling load of a structure.']",B,The stiffness matrix relates the applied forces at the nodes of a structure to the resulting displacements at those nodes.  This relationship is fundamental to solving for the structural response.,Matrices for analysis and design model,Medium,8.3
Which type of matrix is commonly used to represent the connectivity between elements in a finite element analysis?,"['Mass matrix', 'Stiffness matrix', 'Connectivity matrix', 'Transformation matrix']",C,"A connectivity matrix describes which nodes are connected to which elements in a finite element model, crucial for assembling the global stiffness matrix.",Matrices for analysis and design model,Medium,8.3
What does a singular stiffness matrix indicate in a structural analysis model?,"['A well-conditioned and stable model.', 'An over-constrained structure.', 'A mechanism or an unstable structure.', 'Accurate representation of structural behavior.']",C,A singular stiffness matrix indicates a mechanism (an unstable structure with redundant constraints or missing constraints) and prevents a unique solution.,Matrices for analysis and design model,Medium,8.3
"In the context of a finite element analysis, what is the role of a transformation matrix?","['To define element properties.', 'To relate local element coordinates to global coordinates.', 'To assemble the global stiffness matrix.', 'To solve the system of equations.']",B,"Transformation matrices are used to convert the local coordinate system of individual elements to a common global coordinate system for the entire structure, enabling assembly of the global stiffness matrix.",Matrices for analysis and design model,Medium,8.3
A load vector in structural analysis typically represents:,"['The material properties of the structure.', 'The displacements at each node.', 'The forces applied to the structure.', 'The connectivity of the elements.']",C,The load vector contains the external forces acting on the structure at each node.  These forces are used in conjunction with the stiffness matrix to solve for the nodal displacements.,Matrices for analysis and design model,Easy,8.3
Which of the following best describes the nature of ISO standards?,"['Mandatory regulations enforced by national governments.', ' Recommendations for best practices, offering flexibility in implementation.', ' Rigid specifications leaving no room for adaptation to specific contexts.', ' Internal company policies applicable only within the organization.']",B,ISO standards are voluntary guidelines that provide a framework for best practices.  They allow for adaptation and flexibility to suit various applications.,ISO standards,Easy,8.3
What is a primary characteristic of a well-designed ISO standard?,"[' Complex and difficult to understand, requiring specialized expertise.', ' Highly specific to a single industry or company.', ' Easily adaptable and applicable across a range of contexts.', ' Rigid and inflexible, prioritizing strict adherence.']",C,"Effective ISO standards are designed to be adaptable and applicable across diverse situations, not just limited contexts.",ISO standards,Medium,8.3
The development and maintenance of ISO standards is generally carried out by:,"[' Individual national governments.', ' A single multinational corporation.', ' A consortium of international experts and organizations.', ' Individual engineers independently.']",C,ISO standards are developed through collaboration between experts and organizations worldwide.,ISO standards,Easy,8.3
How do ISO standards impact organizations that choose to implement them?,"[' They impose significant mandatory costs without any benefits.', ' They automatically guarantee a competitive market advantage.', ' They provide a framework for improved consistency and efficiency.', ' They completely eliminate the need for internal quality control.']",C,"Implementing ISO standards can streamline processes and improve quality control, leading to greater efficiency and consistency.",ISO standards,Medium,8.3
The adoption of ISO standards is typically:,"[' Mandatory for all businesses, regardless of size or industry.', ' Completely optional, with no incentives for adoption.', ' Voluntary, offering potential benefits such as increased credibility.', ' Restricted to specific industries, such as manufacturing.']",C,"While there are benefits to adoption, companies are not forced to follow ISO standards.",ISO standards,Easy,8.3
What is a key characteristic of the Capability Maturity Model Integration (CMMI)?,"['It is exclusively designed for software development.', 'It is a rigid, inflexible framework.', 'It is adaptable to various applications.', 'It focuses solely on individual employee performance.']",C,"CMMI is designed to be adaptable and applicable across a wide range of projects and organizations, not just software development.  It's a framework for process improvement, not a rigid system.",CMMI,Easy,8.3
How does CMMI aim to improve organizational performance?,"['By solely focusing on employee training.', 'By standardizing processes for enhanced efficiency and effectiveness.', 'By solely relying on external audits.', 'By ignoring internal organizational structures.']",B,"CMMI's core purpose is to improve organizational performance through process improvement and standardization, leading to increased efficiency and effectiveness.",CMMI,Medium,8.3
Which of the following is NOT a primary goal of implementing CMMI?,"['Improved project management practices.', 'Enhanced product quality.', 'Increased employee turnover.', 'Reduced project risks.']",C,"CMMI aims to improve project management, product quality, and risk reduction.  Increased employee turnover is not a goal; in fact, a well-implemented CMMI might lead to *reduced* turnover due to improved processes and organizational stability.",CMMI,Medium,8.3
What type of model is CMMI considered to be?,"['A purely prescriptive model with rigid steps.', 'A completely descriptive model with no defined steps.', 'A process improvement model.', 'A purely project management model.']",C,"CMMI is a process improvement model that provides a framework for organizations to assess and improve their processes.  While it offers guidance, it's not strictly prescriptive.",CMMI,Easy,8.3
In what context is CMMI most commonly applied?,"['Only in small, independent businesses.', ' Exclusively in the manufacturing sector.', 'Across various industries and organizations for process improvement.', 'Only in government projects.']",C,CMMI is applicable to a broad range of industries and organizational sizes to improve processes and achieve better results.  Its usage is not limited to a specific sector or organizational type.,CMMI,Easy,8.3
What is a key characteristic of a well-defined Software Quality Assurance (SQA) plan?,"['It focuses solely on detecting bugs after software release.', 'It lacks specific metrics for measuring quality.', 'It outlines specific processes and responsibilities for ensuring software quality.', 'It is inflexible and difficult to adapt to changing project needs.']",C,"A well-defined SQA plan details the processes, responsibilities, and metrics used to ensure software quality throughout the development lifecycle.  Options A, B, and D describe poorly defined plans.",SQA plan,Easy,8.3
Which of the following is NOT a typical component of a comprehensive SQA plan?,"['Test strategy and methodologies', ' Defect tracking and reporting procedures', ' Project budget allocation for marketing', ' Resource allocation and responsibilities']",C,"While budget is relevant to a project, allocating budget specifically for marketing is outside the scope of a typical SQA plan, which focuses on quality assurance activities.",SQA plan,Medium,8.3
What is the primary goal of implementing an SQA plan within a software development project?,"['To maximize the speed of software development.', 'To minimize the cost of software development.', 'To ensure the delivery of high-quality software.', 'To enhance the marketing appeal of the software.']",C,"The core purpose of an SQA plan is to systematically improve software quality throughout the development process.  While speed and cost are factors, quality is the ultimate objective.",SQA plan,Easy,8.3
How does a well-structured SQA plan contribute to risk mitigation in software development?,"['By eliminating all potential risks.', 'By accelerating development to reduce exposure to risks.', 'By proactively identifying and addressing potential quality issues.', 'By solely focusing on resolving defects after software release.']",C,A robust SQA plan anticipates and manages risks by implementing processes that identify and mitigate quality issues early in the development lifecycle.,SQA plan,Medium,8.3
Which of the following best describes the adaptability of a good SQA plan?,"['It should be rigidly fixed to maintain consistency.', ' It should be easily adaptable to changing project requirements and risks.', 'It should be developed only at the beginning of the project and remain unchanged.', 'It should be simple and lack detailed processes.']",B,"Effective SQA plans are flexible enough to accommodate evolving project demands and newly identified risks, ensuring continuous quality improvement.",SQA plan,Easy,8.3
What is a key objective of configuration management planning in software development?,"['To minimize software development costs.', 'To ensure consistent and reliable software builds.', 'To enhance user interface design.', 'To accelerate the software testing phase.']",B,"Configuration management planning aims to establish and maintain the integrity of the software throughout its lifecycle, resulting in consistent and reliable builds.  While cost reduction and faster testing are desirable outcomes, they are not the primary objective of configuration management. User interface design is a separate aspect of software development.",Configuration management planning,Medium,8.3
Which of the following is NOT typically a component of a configuration management plan?,"['Version control procedures', 'Change management processes', 'Software testing strategies', 'Baseline establishment']",C,"Software testing strategies, while important for software quality, are distinct from configuration management, which focuses on managing changes to the software's configuration items. Version control, change management, and baseline establishment are core components of configuration management.",Configuration management planning,Medium,8.3
What is a baseline in the context of configuration management?,"['A set of user requirements.', 'A formal snapshot of a software system at a specific point in time.', 'A risk assessment document.', 'A software testing report.']",B,"A baseline represents a formally approved version of a software system, serving as a reference point for future changes.  Baselines are used to control and track modifications.",Configuration management planning,Medium,8.3
"The process of identifying, controlling, and tracking changes to a software system is known as:","['Software testing', 'Requirement gathering', 'Configuration management', 'Project planning']",C,"Configuration management encompasses the entire lifecycle of managing changes to a software system, including identification, control, and tracking.",Configuration management planning,Easy,8.3
Why is configuration management crucial in large-scale software projects?,"['It simplifies the user interface.', 'It improves communication between developers.', 'It helps maintain consistency and traceability throughout the development lifecycle, reducing integration issues and improving overall quality.', 'It reduces the need for detailed documentation.']",C,"In large projects, managing numerous components and changes becomes exceedingly complex. Configuration management provides structure and control, avoiding conflicts and ensuring a consistent final product.  While improved communication is beneficial, it's not the primary reason for configuration management's importance in large-scale projects.",Configuration management planning,Medium,8.3
Which of the following is NOT a key element of effective change management?,"[' Clearly defined goals and objectives', ' Ignoring resistance to change', ' Open communication and feedback mechanisms', ' Comprehensive planning and implementation']",B,Ignoring resistance to change is detrimental to successful change management.  Effective change management addresses and manages resistance proactively.,Change management,Easy,8.3
What is a potential negative consequence of poorly managed organizational change?,"['Increased employee morale', 'Improved productivity', 'Decreased employee turnover', 'Increased project failure rates']",D,"Poorly managed change often leads to project delays, cost overruns, and ultimately, project failure.",Change management,Easy,8.3
The Lewin's change management model typically involves which three stages?,"['Planning, Implementation, Evaluation', 'Freezing, Changing, Refreezing', ' Analysis, Design, Implementation', ' Conceptualization, Development, Deployment']",B,"Lewin's model describes the process of unfreezing the current state, implementing the change, and refreezing the new state.",Change management,Medium,8.3
"Which approach emphasizes a gradual, incremental approach to organizational change rather than a large-scale, disruptive transformation?","['Transformational change', 'Revolutionary change', 'Evolutionary change', 'Radical change']",C,"Evolutionary change focuses on small, iterative changes over time, in contrast to a more sudden and dramatic transformational change.",Change management,Medium,8.3
A key factor in successfully navigating resistance to change within an organization is:,"['Ignoring dissenting opinions.', ' Imposing the change without consultation.', ' Proactive communication and addressing concerns.', ' Minimizing employee involvement in the process.']",C,Open communication and addressing employee concerns are crucial for managing resistance to change effectively.,Change management,Easy,8.3
What is a key characteristic of effective version control in software development?,"[' Preventing concurrent development efforts.', ' Maintaining a single, immutable codebase.', ' Tracking changes and enabling rollback to previous versions.', ' Restricting access to the source code repository.']",C),"Effective version control systems allow developers to track changes over time, collaborate efficiently, and revert to earlier versions if needed.  Options A, B, and D are incorrect as they hinder the collaborative and iterative nature of software development.",Version and release management,Easy,8.3
Which of the following is NOT a typical stage in a software release management process?,"[' Testing', ' Deployment', ' Code Refactoring (only when necessary)', ' Requirement Gathering']",C),"While code refactoring is a valuable practice, it's not a discrete stage *within* the typical release management process itself.  Requirements gathering, testing, and deployment are all crucial and distinct steps.",Version and release management,Medium,8.3
What is a primary benefit of using a robust version control system for managing software releases?,"[' Reducing the cost of hardware.', ' Increasing the complexity of the development process.', ' Improving collaboration and reducing conflicts among developers.', ' Eliminating the need for software testing.']",C),"Version control systems facilitate teamwork by tracking changes, allowing parallel development, and resolving merge conflicts efficiently. The other options are incorrect; robust version control doesn't reduce hardware costs, increase complexity, or eliminate testing.",Version and release management,Easy,8.3
What is a common approach to managing different versions of a software application simultaneously?,"[' Using a single, monolithic codebase.', ' Branching and merging within a version control system.', ' Deleting older versions of the code.', ' Manually copying and pasting code segments.']",B),"Branching allows developers to work on separate features or bug fixes concurrently without affecting other parts of the software. Merging integrates these changes back into the main codebase once they're ready. Options A, C, and D are inefficient and error-prone approaches.",Version and release management,Medium,8.3
"In release management, what is the purpose of a ""rollback"" plan?","[' To expedite the initial release of software.', ' To immediately remove all existing code.', ' To revert to a previous stable version of the software in case of issues.', ' To enhance the user interface of the software.']",C),"A rollback plan is a crucial part of release management, enabling a quick return to a known working version if problems arise after a new release. The other options are not related to the primary purpose of a rollback plan.",Version and release management,Easy,8.3
