question,options,answer,explanation,topic,difficulty,chapter
What is a primary function of computer graphics?,"[' Analyzing sound waves', ' Generating graphics using computers', ' Controlling robotic movements', ' Simulating weather patterns']",B,Computer graphics fundamentally involves the creation of images using computational methods.,Overview of Computer Graphics,Easy,6.4
From which diverse fields do the objects represented in computer graphics originate?,"[' Only from the field of mathematics', ' Primarily from the field of physics', ' From diverse fields including physical, mathematical, engineering, architectural, abstract structures, and natural phenomena', 'Exclusively from architectural design principles']",C,"The text explicitly states that objects in computer graphics are drawn from a wide range of fields, including physical, mathematical, engineering, architectural, abstract, and natural phenomena.",Overview of Computer Graphics,Medium,6.4
Which of the following is NOT a core aspect of computer graphics?,"['Creation of images', 'Manipulation of images', 'Storage of images', ' Analysis of human speech']",D,"Analysis of human speech is outside the scope of computer graphics, which focuses on image generation, manipulation and storage.",Overview of Computer Graphics,Easy,6.4
What type of structures are mentioned as sources of objects for computer graphics?,"['Only physical structures', 'Only abstract structures', ' Both physical and abstract structures', 'Neither physical nor abstract structures']",C,The passage explicitly refers to both physical and abstract structures as sources for objects used in computer graphics.,Overview of Computer Graphics,Easy,6.4
The field of computer graphics is primarily concerned with:,"[' The design of computer hardware.', 'The development of computer software for data analysis.', 'The generation, storage, and manipulation of images.', 'The study of artificial intelligence algorithms.']",C,"The definition provided directly states that computer graphics is concerned with the creation, storage, and manipulation of images.",Overview of Computer Graphics,Medium,6.4
Which component of a computer system is primarily responsible for processing and manipulating visual data for display on a monitor?,"['Central Processing Unit (CPU)', 'Random Access Memory (RAM)', 'Graphics Processing Unit (GPU)', 'Hard Disk Drive (HDD)']",C,"The GPU is specifically designed to handle the complex calculations required for rendering images and videos, accelerating graphics performance.  The CPU handles general processing, RAM is for temporary data storage, and the HDD stores data persistently.",Graphics Hardware,Easy,6.4
What is the primary function of a frame buffer in graphics hardware?,"[' Processing 3D models', ' Storing the image to be displayed on the screen', ' Managing keyboard input', ' Controlling the sound card']",B,The frame buffer is a dedicated memory area that holds the image data that is being displayed on the screen.  The other options describe unrelated functions.,Graphics Hardware,Medium,6.4
"What is the term for the number of pixels displayed on a screen, often expressed as width x height?","[' Resolution', ' Refresh rate', ' Bit depth', ' Aspect ratio']",A,"Resolution refers to the total number of pixels used to display an image.  Refresh rate is how often the image is updated, bit depth is color information per pixel, and aspect ratio is the screen's width-to-height ratio.",Graphics Hardware,Easy,6.4
Which of the following is NOT a common type of graphics memory?,"['GDDR6', 'DDR4', 'HBM2', 'GDDR5X']",B,"DDR4 is a type of main system memory (RAM), not specifically designed for graphics processing. GDDR6, HBM2, and GDDR5X are all types of graphics memory optimized for high bandwidth.",Graphics Hardware,Medium,6.4
What technology improves the visual quality by smoothing jagged edges of lines and shapes in images?,"[' Texture Mapping', ' Anti-aliasing', ' Z-buffering', ' Rasterization']",B,"Anti-aliasing techniques reduce the jagged appearance (""aliasing"") of lines and shapes by blending colors at the edges of pixels. The other options are related to graphics processing but don't directly address smoothing jagged edges.",Graphics Hardware,Medium,6.4
Which of the following systems was the first to utilize command and control CRT display consoles with light pens for operator interaction?,"['The Whirlwind computer', 'The Sketchpad system', 'SAGE air-defense system', 'None of the above']",C,The SAGE air-defense system is explicitly mentioned as the first to use command and control CRT display consoles with light pens.,Display Technology,Easy,6.4
What type of display technology was used for output in the Whirlwind computer developed at MIT?,"['LCD', 'LED', 'CRT', 'OLED']",C,The passage states that the Whirlwind computer used computer-driven CRT displays.,Display Technology,Easy,6.4
"What is a light pen, as described in the context of early display technology?","['A type of stylus for drawing on a touchscreen.', 'A hand-held pointing device that senses light emitted by objects on a screen.', 'A software program used to control display parameters.', 'A type of early keyboard input device.']",B,The passage defines a light pen as a hand-held pointing device that senses light emitted from the screen.,Display Technology,Medium,6.4
"Who is credited with developing the Sketchpad system, an important milestone in display technology?","[' Douglas Engelbart', 'Charles Babbage', ' Ivan Sutherland', 'Ada Lovelace']",C,The passage explicitly names Ivan Sutherland as the creator of the Sketchpad system.,Display Technology,Easy,6.4
"In what decade did the SAGE air-defense system, a pioneering example of command and control CRT displays, become operational?","['1940s', '1960s', '1970s', '1950s']",D,The passage mentions the SAGE system's development in the middle 1950s.,Display Technology,Easy,6.4
What is a pixel in the context of raster-scan displays?,"[""A single line of data in a display's memory."", 'A unit of measurement for screen size.', 'A picture element representing a point on the screen.', 'A type of display technology.']",C,"A pixel (picture element) is the smallest addressable unit of a display.  Options A, B, and D are incorrect descriptions of a pixel.",Architecture of Raster-Scan Displays,Easy,6.4
Which of the following devices significantly contributed to the widespread adoption of bitmap graphics for user interaction?,"['Mainframe computers', 'Early electromechanical calculators', 'Personal computers with built-in raster graphics displays', 'Typewriters']",C,"The passage highlights personal computers with built-in raster graphics displays (like the Xerox Star, Apple Macintosh, and IBM PC) as key drivers in the popularization of bitmap graphics.",Architecture of Raster-Scan Displays,Easy,6.4
How is a bitmap represented in a computer's memory?,"['As a series of color names', 'As a sequence of characters', 'As a rectangular array of ones and zeros', 'As a collection of geometric shapes']",C,The passage defines a bitmap as a representation of a rectangular array of points using ones and zeros.,Architecture of Raster-Scan Displays,Medium,6.4
What is the significance of the ones and zeros in a bitmap representation?,"['They represent the location of the pixels on the screen.', 'They define the resolution of the display.', 'They represent the color or intensity of each pixel.', 'They represent the size of the display.']",C,"While the ones and zeros ultimately contribute to all of these, their most fundamental function is representing the color or intensity of each pixel.  The other options are consequences of this representation.",Architecture of Raster-Scan Displays,Medium,6.4
Which of the following best describes the arrangement of pixels on a screen using a raster scan display?,"['Circular', 'Random', 'Rectangular array', 'Triangular']",C,The passage explicitly states that a bitmap is a representation of a rectangular array of points.,Architecture of Raster-Scan Displays,Easy,6.4
What is a pixel in the context of computer displays?,"[""A single transistor on a display's control chip."", 'A unit of measurement for screen brightness.', 'A picture element representing a single point on the screen.', 'A type of digital signal processing algorithm.']",C,"A pixel, short for ""picture element,"" is the smallest addressable unit on a display.",Vector Displays,Easy,6.4
Which of the following is a characteristic of bitmap graphics?,"['Uses mathematical equations to define images.', 'Offers infinite scalability without loss of quality.', 'Represents images as a grid of individual pixels.', 'Primarily used in professional vector-based design software.']",C,"Bitmap graphics represent images as a grid of pixels, unlike vector graphics which use mathematical equations.",Vector Displays,Easy,6.4
Early personal computers commonly used which type of graphics display?,"['Vector displays', 'Holographic displays', 'Raster graphics displays', '3D stereoscopic displays']",C,"The passage mentions the Xerox Star, Apple Macintosh, and IBM PC as examples of early personal computers utilizing raster graphics.",Vector Displays,Medium,6.4
"What does the term ""bitmap"" refer to in the context of computer graphics?","['A type of display technology using electron beams.', 'A compressed image format commonly used on the internet.', 'A representation of an image as a grid of pixels using a binary code.', 'A method of storing image data using mathematical vectors.']",C,A bitmap is a binary representation (ones and zeros) of the rectangular array of points (pixels) on the screen.,Vector Displays,Medium,6.4
"In a bitmap image, what does each individual point represent?","['A single color value', 'A vector line segment', 'A single byte of data', 'A complex mathematical equation']",A,"Each point, or pixel, in a bitmap image represents a single color value.",Vector Displays,Easy,6.4
"Which type of processor offers a balance between the performance of general-purpose processors and the flexibility of custom, single-purpose processors?","['General-purpose processors', 'Custom single-purpose processors', 'Application-Specific Instruction-set Processors (ASIPs)', 'Microcontrollers']",C,ASIPs are designed to provide a compromise between the general-purpose nature and the specialized performance of other processor types.,Display Processors,Easy,6.4
In what application domains are Application-Specific Instruction-set Processors (ASIPs) particularly well-suited?,"['Automotive control systems only', 'Telecommunications, multimedia, and encryption', 'Simple embedded systems exclusively', 'High-performance computing and scientific simulations only']",B,The passage explicitly mentions these three areas as ideal applications for ASIPs.,Display Processors,Easy,6.4
"Compared to custom single-purpose processors, what key advantage do ASIPs offer?","['Lower power consumption', 'Significantly higher clock speeds', 'Greater flexibility', 'Smaller physical size']",C,The passage states that ASIPs offer more flexibility than custom single-purpose processors.,Display Processors,Easy,6.4
What is a potential drawback of using custom single-purpose processors compared to ASIPs?,"['Higher cost of manufacturing', 'Lack of flexibility', 'Lower performance', 'Increased power consumption']",B,The passage implies that the lack of flexibility in custom processors is a key reason for preferring ASIPs.,Display Processors,Medium,6.4
Which of the following best describes the performance characteristic of ASIPs relative to general-purpose processors?,"['Significantly lower performance', 'Comparable performance', 'Better performance', 'Inconsistent performance']",C,The passage indicates that ASIPs provide better performance than general-purpose processors.,Display Processors,Easy,6.4
Which of the following is NOT an example of an output device?,"['Monitor', 'Printer', 'Keyboard', 'Speaker']",C,"Keyboards are input devices, allowing users to input data. Monitors, printers, and speakers are all output devices, displaying or presenting processed data.",Output Devices,Easy,6.4
What is the primary function of an output device in a computer system?,"['To store data permanently.', 'To receive user input.', 'To process data into usable information.', 'To present processed data to the user.']",D,Output devices are designed to display or present the results of data processing to the user in a comprehensible format.,Output Devices,Easy,6.4
A device that converts digital data into a hard copy is classified as what type of device?,"['Input device', 'Storage device', 'Output device', 'Processing device']",C,"Printers convert digital data into a physical, printed form, making them output devices.",Output Devices,Medium,6.4
Which of the following best describes the relationship between output devices and the CPU?,"[""Output devices directly control the CPU's processing speed."", 'Output devices are independent of the CPU and operate autonomously.', 'Output devices receive processed data from the CPU for presentation.', 'Output devices send raw data to the CPU for processing.']",C,"The CPU processes data, and output devices receive this processed data to display or present it to the user.",Output Devices,Medium,6.4
"Besides monitors and printers, what other common device typically falls under the category of output devices?","['Hard drive', 'Mouse', 'Speakers', 'Scanner']",C,"Speakers output audio data, making them an output device. Hard drives are storage, and mice and scanners are input devices.",Output Devices,Easy,6.4
Which of the following is NOT an example of an input device?,"['Keyboard', 'Scanner', 'Printer', 'Mouse']",C,"Printers are output devices, displaying processed data. Keyboards, scanners, and mice are all input devices.",Input Devices,Easy,6.4
What is the primary function of input devices?,"['To store data persistently.', 'To process data for output.', 'To allow users to input data into a system.', 'To display processed data to the user.']",C,Input devices facilitate the entry of data into a computer system.  Storage and processing are handled by other device types.,Input Devices,Easy,6.4
A device that converts scanned documents into digital format falls under which category?,"['Output Device', 'Storage Device', 'Input Device', 'Processing Device']",C,Scanners are input devices that convert physical documents into digital data for computer processing.,Input Devices,Medium,6.4
Which of the following best describes the role of drivers in relation to peripheral devices?,"['They store data persistently.', 'They process data for output.', 'They facilitate communication between the peripheral and the CPU.', 'They allow users to input data.']",C,Drivers are software that enables communication between a peripheral device and the central processing unit (CPU).,Input Devices,Medium,6.4
A user interacts with a computer system primarily through which type of devices?,"['Storage devices', 'Output devices', 'Input devices', 'Processing devices']",C,Users interact directly with the system to input data via input devices like keyboards and mice.  Output and storage devices are secondary in user interaction.,Input Devices,Easy,6.4
Which of the following fields does NOT typically utilize computer graphics?,"['Medicine', 'Agriculture', 'Engineering', 'Advertising']",B,"While agriculture may use some data visualization, it's not as heavily reliant on computer graphics as the other options.  Medicine, engineering, and advertising all extensively use computer graphics for various applications.",Graphics Software,Easy,6.4
What is a primary function of computer graphics in user interfaces?,"[' Processing numerical data', ' Visualizing objects in 2D and 3D', ' Managing system memory', ' Controlling hardware peripherals']",B,"Computer graphics are fundamentally about the visual representation of data, particularly in two and three dimensions, which is crucial for user interaction.",Graphics Software,Easy,6.4
In which area is the application of computer graphics considered indispensable for visualizing objects?,"['Only in entertainment', 'Primarily in education', 'Across a wide range of fields', 'Exclusively in scientific research']",C,"The passage explicitly states that computer graphics are indispensable across many areas, not limited to a single field.",Graphics Software,Medium,6.4
Computer graphics plays a vital role in visualizing which types of objects?,"['Only microscopic objects', 'Only macroscopic objects', 'Both 2D and 3D objects', 'Only abstract concepts']",C,The passage explicitly mentions the visualization of both 2D and 3D objects.,Graphics Software,Easy,6.4
The integration of computer graphics is particularly important in which aspect of computing?,"['Data storage', 'Network security', 'User interfaces', 'Programming languages']",C,The passage highlights the integral role of computer graphics within computer user interfaces.,Graphics Software,Medium,6.4
"Which standard is commonly used for floating-point arithmetic, defining rules for its fundamental operations?","['ANSI C', 'IEEE 802.11', 'IEEE 754', 'ISO 9001']",C,The IEEE 754 standard specifically addresses floating-point arithmetic operations.,Software Standards,Easy,6.4
What is a key application of logical operations in computer systems?,"[' Calculating trigonometric functions', ' Data encryption', ' Sorting algorithms', ' Signal processing']",B,"Logical operations are fundamental to tasks such as data encryption, error checking and mask generation.",Software Standards,Easy,6.4
The memory hierarchy is designed to optimize which three primary factors?,"[' Power consumption, heat dissipation, and size', ' Speed, cost, and capacity', ' Bandwidth, latency, and throughput', ' Security, reliability, and availability']",B,"The memory hierarchy balances speed, cost, and capacity to provide efficient memory management.",Software Standards,Medium,6.4
"In the context of floating-point arithmetic, what operations are typically defined by standards like IEEE 754?","[' Integration and differentiation', ' Addition, subtraction, multiplication, and division', ' Bitwise AND, OR, and XOR', ' Sorting and searching']",B,IEEE 754 specifies rules for the basic arithmetic operations on floating-point numbers.,Software Standards,Easy,6.4
What is the primary purpose of a memory hierarchy?,"['To increase the speed of the CPU.', 'To improve the overall system performance by balancing speed, cost, and capacity.', 'To reduce the amount of RAM needed.', 'To simplify memory addressing.']",B,"A memory hierarchy is structured to optimize speed, cost, and capacity.",Software Standards,Medium,6.4
