question,options,answer,explanation,topic,difficulty,chapter
"What is the matrix representation of a 3D translation with translation distances tx, ty, and tz along the x, y, and z axes respectively?","[' [ 1  0  0  tx ]', '  1  0  ty ]', '  0  1  tz ]', '  0  0  1 ]', ' [ 1  0  0  0 ]', '  1  0  0 ]', '  0  1  0 ]', 'x ty tz 1 ]', ' [ tx  0  0  1 ]', '  ty  0  1 ]', '  0  tz  1 ]', '  0  0  1 ]', ' [ 0  0  0  tx ]', '  0  0  ty ]', '  0  0  tz ]', '  0  0  1 ]']",A,The given matrix correctly represents a 3D homogeneous transformation matrix for translation.  The bottom row ensures proper matrix multiplication with homogeneous coordinates.,Three-dimensional translation,Medium,6.6
"In a 3D homogeneous coordinate system, what is the effect of applying the translation matrix T = [ 1 0 0 2; 0 1 0 3; 0 0 1 4; 0 0 0 1 ] to a point P = (x, y, z, 1)?","['The point remains unchanged.', 'The point is translated by (2, 3, 4).', 'The point is scaled by a factor of 2, 3, and 4 along x, y, and z axes, respectively.', 'The point is rotated.']",B,"Multiplying the transformation matrix T by the homogeneous coordinates of point P will result in a point P' = (x+2, y+3, z+4, 1), representing a translation of (2, 3, 4).",Three-dimensional translation,Medium,6.6
Which parameter(s) determine the magnitude and direction of translation in a 3D translation matrix?,"['The elements along the main diagonal.', 'The elements in the bottom row.', 'The elements in the last column (excluding the last element).', 'The determinant of the matrix.']",C,"The parameters tx, ty, and tz, located in the last column of the translation matrix, directly specify the translation distances along the x, y, and z axes respectively.",Three-dimensional translation,Easy,6.6
"What is the resulting point P' if a point P = (1, 2, 3) is translated by (4, 5, 6)?","['(1, 2, 3)', '(5, 7, 9)', '(4, 5, 6)', '(-3, -3, -3)']",B,"The new point's coordinates are the sum of the original point coordinates and the translation vector: (1+4, 2+5, 3+6) = (5, 7, 9).",Three-dimensional translation,Easy,6.6
A 3D translation can be represented as a  4x4 homogeneous transformation matrix. What is the purpose of the '1' in the bottom right corner of this matrix?,"['To indicate the scale factor.', 'To ensure correct matrix multiplication with homogeneous coordinates.', 'To represent the rotation angle.', 'It has no specific purpose.']",B,The '1' in the bottom-right corner is essential for proper matrix multiplication when using homogeneous coordinates. It allows translations to be represented as linear transformations.,Three-dimensional translation,Medium,6.6
"What is the result of applying a 3D rotation of θ about the x-axis to a point (x, y, z) in homogeneous coordinates?","['(x, ycosθ + zsinθ, ysinθ - zcosθ)', '(x, ycosθ - zsinθ, ysinθ + zcosθ)', '(xcosθ, ysinθ, z)', '(x, y, z)']",B),"The provided text gives the transformation equations for a 3D rotation about the x-axis in homogeneous coordinates as: x' = x, y' = ycosθ - zsinθ, z' = ysinθ + zcosθ.  Option B correctly reflects these equations.",Three-dimensional rotation,Medium,6.6
Which coordinate remains unchanged after a rotation of θ about the x-axis in a three-dimensional space?,"['y', 'z', 'x', 'None of the above']",C),The rotation about the x-axis only affects the y and z coordinates. The x-coordinate remains unchanged.,Three-dimensional rotation,Easy,6.6
"The transformation equations for rotations about the y and z axes in 3D space can be derived using what technique, based on the x-axis rotation example?","['Linear Interpolation', 'Cyclic Permutation', 'Matrix Inversion', 'Numerical Integration']",B),"The passage explicitly states that cyclic permutation of the x, y, and z coordinates is used to derive the transformation equations for rotations around other axes.",Three-dimensional rotation,Medium,6.6
"In the homogenous coordinate representation of a 3D rotation about the x-axis, what is the value of the element in the second row and third column of the transformation matrix?","['cosθ', 'sinθ', '-sinθ', '0']",C),The passage shows the transformation matrix. The element in the second row and third column is -sinθ.,Three-dimensional rotation,Medium,6.6
What mathematical function is used to describe the change in the y and z coordinates after a 3D rotation about the x-axis by an angle θ?,"['Exponential Function', 'Logarithmic Function', 'Trigonometric Functions', 'Linear Function']",C),"The transformation equations use sine and cosine, which are trigonometric functions.",Three-dimensional rotation,Easy,6.6
What condition ensures that a three-dimensional scaling transformation preserves the original shape of an object?,"['sx ≠ sy ≠ sz', 'sx = sy = 0, sz ≠ 0', 'sx = sy = sz', 'sx = 0, sy = sz']",C) sx = sy = sz,"Uniform scaling, where the scaling factors along all three axes (sx, sy, sz) are equal, preserves the original shape.  Non-uniform scaling (different scaling factors) will distort the object.",Three-dimensional scaling,Medium,6.6
"In a 3D scaling transformation matrix, what value represents the scaling factor along the y-axis?","['sx', 'sy', 'sz', '0']",B) sy,The scaling transformation matrix shows sy as the scaling factor along the y-axis.,Three-dimensional scaling,Easy,6.6
Which of the following matrices represents a uniform scaling transformation in 3D space?,"['[[2, 0, 0], [0, 3, 0], [0, 0, 1]]', '[[1, 0, 0], [0, 1, 0], [0, 0, 1]]', '[[2, 0, 0], [0, 2, 0], [0, 0, 2]]', '[[0, 0, 0], [0, 0, 0], [0, 0, 0]]']","C) [[2, 0, 0], [0, 2, 0], [0, 0, 2]]","A uniform scaling has equal scaling factors on all axes. Only option C shows equal scaling factors (2) along x, y, and z axes.",Three-dimensional scaling,Medium,6.6
"A scaling transformation with sx = 2, sy = 1, and sz = 0.5 will result in what kind of distortion?","['No distortion', 'Uniform scaling', 'Non-uniform scaling', 'Rotation']",C) Non-uniform scaling,"Different scaling factors along the x, y, and z axes lead to non-uniform scaling, resulting in a distorted shape.",Three-dimensional scaling,Easy,6.6
"What is the result of applying a scaling transformation with sx = 0, sy = 0, sz = 0 to a 3D point?","['The point remains unchanged.', 'The point is translated.', 'The point is scaled uniformly.', 'The point collapses to the origin.']",D) The point collapses to the origin.,"Scaling factors of zero along all axes will result in the point being mapped to the origin (0,0,0).",Three-dimensional scaling,Medium,6.6
What is the primary method used to reflect an object across a plane that is not aligned with the standard coordinate planes?,"['Direct application of a single reflection matrix', 'A series of transformations', 'Inversion about the origin', 'Scaling along the normal vector']",B) A series of transformations,"Reflecting an object across an arbitrarily oriented plane typically requires a sequence of transformations, such as translation and rotation, to align the plane with a standard coordinate plane before performing the reflection.",Three-dimensional reflection,Medium,6.6
"In a 3D reflection about an arbitrary plane, which step typically involves aligning the plane's normal vector with a coordinate axis?","['Translation', 'Scaling', 'Rotation', 'Shearing']",C) Rotation,"A key step in reflecting about an arbitrary plane is rotating the plane so its normal vector aligns with a coordinate axis (like the z-axis), simplifying the reflection process.",Three-dimensional reflection,Medium,6.6
"Before reflecting an object across an arbitrary plane in 3D space, what transformation is often applied to simplify the process?","['Dilation', 'Shear transformation', 'Translation', 'Perspective projection']",C) Translation,Translating a point on the reflection plane to the origin simplifies subsequent transformations needed for reflection.,Three-dimensional reflection,Easy,6.6
What is the purpose of translating a point on the reflection plane to the origin during a 3D reflection?,"['To change the scale of the object', 'To simplify the reflection calculation', 'To rotate the object 90 degrees', 'To invert the object']",B) To simplify the reflection calculation,"This translation simplifies the mathematical operations involved in performing the reflection, making it computationally easier.",Three-dimensional reflection,Easy,6.6
"After translating a point on the reflection plane to the origin and rotating the plane's normal vector, what plane is the reflection effectively performed about?","['xy-plane', 'yz-plane', 'xz-plane', 'z=0 plane']",D) z=0 plane,The combination of translation and rotation transforms the arbitrary reflection plane into a plane parallel to and coincident with the z=0 plane.,Three-dimensional reflection,Medium,6.6
What is the effect of a three-dimensional shear transformation relative to the z-axis on the z-coordinate?,"['It is proportionally increased.', 'It is proportionally decreased.', 'It remains unchanged.', 'It is reversed.']",C,The transformation matrix clearly shows that the z-coordinate is not altered.  The shear only affects the x and y coordinates based on the z value.,Three-dimensional shear transformation,Easy,6.6
"In a 3D shear transformation relative to the z-axis, which coordinates are affected by parameters 'a' and 'b'?","['x and z', 'y and z', 'x and y', 'Only z']",C,"Parameters 'a' and 'b' directly modify the x and y coordinates respectively, according to the provided transformation matrix.",Three-dimensional shear transformation,Medium,6.6
Which transformation matrix element is always 1 in a 3D shear transformation relative to the z-axis?,"['a', 'b', 'The element in the third row and third column', 'The element in the first row and first column']",C,"The diagonal element representing the z-coordinate transformation remains 1, indicating no change in the z value.",Three-dimensional shear transformation,Easy,6.6
A three-dimensional shear transformation relative to the z-axis modifies the x and y coordinates based on what value?,"['The x coordinate', 'The y coordinate', 'The z coordinate', 'The sum of x and y coordinates']",C,The transformation explicitly states that the change in x and y is proportional to the z-coordinate.,Three-dimensional shear transformation,Medium,6.6
"What type of transformation is represented by the matrix SHz,  given its effect on the coordinates?","['Rotation', 'Scaling', 'Shear', 'Translation']",C,"The description explicitly defines the transformation as a shear, altering coordinates proportionally without changing their ratios.",Three-dimensional shear transformation,Easy,6.6
What is the process for creating a composite transformation matrix using individual transformation matrices?,"['Adding the individual transformation matrices.', 'Subtracting the individual transformation matrices.', 'Multiplying the individual transformation matrices in order from left to right.', 'Multiplying the individual transformation matrices in order from right to left.']",D,"Composite transformation matrices are formed by multiplying individual transformation matrices. For column matrix representation of coordinates, the multiplication order is from right to left.",3D composite transformation,Medium,6.6
"In a 3D composite transformation using column matrix representation of coordinates, the order of matrix multiplication is crucial. Which direction of multiplication correctly reflects this?","['From left to right', 'From right to left', ""It doesn't matter, the result is the same."", 'It depends on the type of transformation.']",B,"The order of matrix multiplication is crucial in composite transformations.  For column matrix representation of coordinates, matrices must be multiplied from right to left to get the correct composite transformation.",3D composite transformation,Medium,6.6
Which mathematical operation is fundamentally used to combine individual transformation matrices into a single composite transformation matrix?,"['Addition', 'Subtraction', 'Division', 'Multiplication']",D,The core operation for creating a composite transformation matrix is the multiplication of individual transformation matrices.,3D composite transformation,Easy,6.6
A composite transformation matrix represents:,"['A single, isolated transformation.', 'The combined effect of multiple transformations.', 'The inverse of a single transformation.', 'The determinant of a single transformation.']",B,A composite transformation matrix summarizes the result of applying multiple transformations sequentially.,3D composite transformation,Easy,6.6
"If you have three transformation matrices, T1, T2, and T3, representing rotation, scaling, and translation respectively, what is the correct order to multiply them to form a composite transformation matrix for a point represented as a column vector?","['T1 * T2 * T3', 'T3 * T2 * T1', 'T2 * T1 * T3', 'T3 * T1 * T2']",B,"For column vector representation, the order is from right to left. Thus, T3 (translation) is applied first, then T2 (scaling), and finally T1 (rotation).",3D composite transformation,Medium,6.6
Which of the following is NOT a typical stage in a 3D viewing pipeline?,"['Modeling', 'Rendering', 'Shading', 'Data Acquisition']",D) Data Acquisition,"Data acquisition is a preliminary step in creating 3D models, but it is not considered part of the 3D viewing pipeline itself. The pipeline focuses on transforming and displaying existing 3D data. Modeling, rendering, and shading are core stages.",3D viewing pipeline,Medium,6.6
What is the primary function of the rendering stage in a 3D viewing pipeline?,"['Creating the 3D model geometry', 'Assigning colors and textures to surfaces', 'Converting 3D data into a 2D image', ""Defining the camera's position and viewpoint""]",C) Converting 3D data into a 2D image,"Rendering is the process of taking a 3D scene description and generating a 2D image that can be displayed on a screen.  Modeling creates the geometry, shading assigns colors and textures, and the camera parameters are defined in a separate stage.",3D viewing pipeline,Easy,6.6
"The process of assigning surface properties such as color, texture, and reflectivity to a 3D model is known as:","['Modeling', 'Rendering', 'Shading', 'Transformation']",C) Shading,"Shading determines how light interacts with the surfaces of a 3D model, thus defining its appearance.  Modeling creates the model's form; rendering converts the model to an image; transformation alters the model's position or orientation.",3D viewing pipeline,Easy,6.6
"In a 3D viewing pipeline, what is the role of the transformation stage?","[""To apply textures to the model's surfaces"", 'To convert 3D data into a 2D image', ""To manipulate the 3D model's position and orientation"", 'To define the lighting conditions in the scene']",C) To manipulate the 3D model's position and orientation,"The transformation stage involves applying geometric transformations (translation, rotation, scaling) to the 3D model to position it correctly in the scene relative to the camera.  Texture application occurs in shading, image conversion in rendering, and lighting is defined separately.",3D viewing pipeline,Medium,6.6
Which of these is a common technique used in the rendering stage of a 3D viewing pipeline to realistically depict light and shadow effects?,"[' Boolean operations', ' Ray tracing', ' Spline interpolation', ' Bézier curves']",B) Ray tracing,"Ray tracing is a rendering technique that simulates the path of light rays to create realistic images, including accurate shadows and reflections. Boolean operations are used in modeling, while spline interpolation and Bézier curves are used in defining shapes and curves.",3D viewing pipeline,Medium,6.6
What is the fundamental principle underlying vector projection?,"[' Determining the magnitude of a vector.', ' Resolving a vector into its perpendicular components.', ' Finding the angle between two vectors.', ' Calculating the cross product of two vectors.']",B,Vector projection fundamentally involves decomposing a vector into components parallel and perpendicular to another vector.,Projection concepts,Easy,6.6
"If a vector 'v' is projected onto a vector 'u', what does the resulting projected vector represent?","[""The component of 'v' perpendicular to 'u'."", ""The sum of vectors 'v' and 'u'."", ""The component of 'v' parallel to 'u'."", ""The difference between vectors 'v' and 'u'.""]",C,The projection of 'v' onto 'u' gives the component of 'v' that lies along the direction of 'u'.,Projection concepts,Medium,6.6
The scalar projection of vector A onto vector B is defined as:,"['|A|cos θ', '|A||B|cos θ', '|A||B|sin θ', 'A.B / |B|']",D,The scalar projection gives the length of the projected vector and is calculated as the dot product of A and the unit vector in the direction of B.,Projection concepts,Medium,6.6
Which of the following is NOT directly used in calculating the vector projection of vector 'a' onto vector 'b'?,"[""The dot product of 'a' and 'b'"", ""The magnitude of 'b'"", ""The cross product of 'a' and 'b'"", ""The unit vector in the direction of 'b'""]",C,"Vector projection utilizes the dot product, magnitudes, and unit vectors but not the cross product.",Projection concepts,Medium,6.6
"In three-dimensional space, how many components are typically used to represent the projection of a vector onto another vector?","['1', '2', '3', '4']",C,"Even though a projection might be onto a single axis (resulting in a scalar component), in 3D space, the projected vector itself is still described by its three components (x, y, z).",Projection concepts,Easy,6.6
"In orthographic projection, what is the primary purpose of projecting parallel lines onto a single plane?","['To create a three-dimensional representation.', 'To accurately represent the true shape of an object.', 'To simplify complex three-dimensional shapes into two dimensions.', 'To enhance the perspective of the object.']",C,"Orthographic projection simplifies 3D objects into 2D representations by projecting parallel lines onto a plane, eliminating perspective.",Orthographic projection,Easy,6.6
Which of the following transformations is NOT directly represented by a simple matrix multiplication in homogeneous coordinates?,"['Scaling', 'Rotation', 'Translation', 'Perspective projection']",D,"While translation, scaling, and rotation can be represented by matrix multiplication in homogeneous coordinates, perspective projection requires a more complex transformation matrix.",Orthographic projection,Medium,6.6
What is the effect of the shear transformation represented by x' = x + shy.x and y' = y + shx.y on a square?,"['Rotation', 'Scaling', 'Distortion/Skewing', 'Translation']",C,"The given equations describe a shear transformation, resulting in a skewed or distorted shape.",Orthographic projection,Medium,6.6
"In the context of homogeneous coordinates, what is the primary advantage of representing transformations using matrices?","['Enhanced visual appeal of the object.', 'Easier calculation of object volumes.', 'Simplified representation of combined transformations.', 'Improved accuracy in measuring distances.']",C,"Using matrices allows for the simple combination of multiple transformations (like rotation, scaling, and translation) through matrix multiplication.",Orthographic projection,Medium,6.6
Which transformation maintains the relative distances between points in a projected image?,"['Perspective projection', 'Orthographic projection', 'Shear transformation', 'Affine transformation (excluding shear)']",B,"Orthographic projection, unlike perspective projection, maintains parallel lines parallel and relative distances unchanged.",Orthographic projection,Easy,6.6
"In parallel projection, which property remains constant for all points in space?","['Distance from the projection plane', 'Angle to the projection plane', 'Distance from the projection line', 'Direction of projection lines']",D,Parallel projection maintains constant direction for projection lines.  The other options vary depending on the point's location.,Parallel projection,Medium,6.6
What is the defining characteristic of orthographic projection?,"['Projection lines converge at a single point.', 'Projection lines are parallel to each other and perpendicular to the projection plane.', 'Projection lines are parallel to each other but oblique to the projection plane.', 'Projection lines are arbitrary in direction.']",B,Orthographic projection is specifically defined by parallel projection lines perpendicular to the projection plane.,Parallel projection,Medium,6.6
Which type of projection is characterized by non-parallel projection lines converging at a single point?,"['Parallel Projection', 'Orthographic Projection', 'Perspective Projection', 'Axonometric Projection']",C,Perspective projection is uniquely defined by converging projection lines.,Parallel projection,Easy,6.6
A vector in 3D space is projected onto a plane using parallel projection.  What determines the magnitude of the projected vector's components?,"[""The vector's magnitude only."", ""The vector's direction only."", ""Both the vector's magnitude and direction."", ""The distance between the vector's origin and the projection plane.""]",C,The projected vector's magnitude depends on both the original vector's magnitude and its direction relative to the projection plane.,Parallel projection,Medium,6.6
"In a parallel projection, if the direction cosines of the projection are cy and cz for the y and z components respectively, what does this represent?","['The magnitudes of the projected vector components.', 'The angles between the projection lines and the y and z axes.', 'The distances from the origin to the projected point in y and z directions.', 'The direction cosines of the projected vector.']",A,"Direction cosines, in this context, represent the magnitudes of the projected components, scaled by the original vector's magnitude.",Parallel projection,Medium,6.6
"In perspective projection, what is the primary factor influencing the apparent size of an object?","[""Object's material properties"", ""Object's distance from the viewer"", ""Object's color"", ""Object's weight""]",B,"Perspective projection simulates how we see in the real world.  Objects further away appear smaller, while closer objects appear larger. This is directly related to the distance from the viewer.",Perspective projection,Easy,6.6
Which of the following best describes a characteristic of perspective projection?,"['Parallel lines remain parallel.', ' All lines converge at a single point.', ' Lines converge at a vanishing point.', "" It doesn't consider distance.""]",C,"Perspective projection accurately represents the convergence of parallel lines to a vanishing point, creating a sense of depth.",Perspective projection,Medium,6.6
What is the term for the point in perspective projection where parallel lines appear to converge?,"['Focal point', 'Vanishing point', 'Convergence point', 'Projection point']",B,"The vanishing point is a crucial element in perspective projection, representing the apparent convergence of parallel lines.",Perspective projection,Easy,6.6
How does perspective projection differ fundamentally from orthographic projection?,"['Perspective projection uses 2D planes.', 'Perspective projection ignores distance.', 'Perspective projection accounts for distance and viewpoint.', 'Perspective projection uses a single vanishing point.']",C,"Orthographic projection shows objects from a single viewpoint without perspective distortion, while perspective projection considers distance and viewpoint, making distant objects appear smaller.",Perspective projection,Medium,6.6
"In a simple perspective projection, assuming a single vanishing point, which lines will converge at this point?","['Lines perpendicular to the projection plane.', 'Lines parallel to the projection plane.', 'Lines at 45 degrees to the projection plane.', 'All lines regardless of orientation.']",A,Parallel lines perpendicular to the projection plane converge at the vanishing point in a simple perspective projection.,Perspective projection,Medium,6.6
