question,options,answer,explanation,topic,difficulty,chapter
What does VHDL stand for?,"['Very High Speed Integrated Circuit Hardware Description Language', 'Virtual Hardware Description Language', 'Versatile Hardware Description Language', 'Very High-level Simulation Circuit Hardware Description Language']",A,VHDL stands for Very High Speed Integrated Circuit Hardware Description Language.,VHDL Overview,Easy,4.6
What is the primary purpose of VHDL?,"['To control robotic arms', 'To model and simulate digital systems', 'To design analog circuits', 'To program microcontrollers']",B,VHDL is primarily used for modeling and simulating digital systems.,VHDL Overview,Easy,4.6
In what decade was VHDL developed?,"['1960s', '1970s', '1980s', '1990s']",C,VHDL was developed in the 1980s.,VHDL Overview,Easy,4.6
What type of language is VHDL considered to be?,"['Low-level programming language', 'Assembly language', 'High-level language', 'Machine language']",C,VHDL is a high-level language.,VHDL Overview,Medium,4.6
Which country's initiative was instrumental in the development of VHDL?,"['Japan', 'United Kingdom', 'Germany', 'United States']",D,VHDL's development was part of a U.S. initiative.,VHDL Overview,Medium,4.6
"In VHDL, what method is typically used to detect overflow in unsigned arithmetic operations?","['Sign bit analysis', 'Carry detection', 'Range checking', 'Exception handling']",B,Carry detection is the standard method for detecting overflow in unsigned arithmetic within VHDL.  Sign bit analysis is used for signed arithmetic. Range checking and exception handling are less direct methods for overflow detection.,Overflow and data representation using VHDL,Easy,4.6
Which VHDL data type is best suited for representing a single binary digit?,"['INTEGER', 'REAL', 'BIT', 'ARRAY']",C,"The BIT type in VHDL is specifically designed to represent a single binary digit (0 or 1).  INTEGER and REAL are for numerical values, and ARRAY is a composite type.",Overflow and data representation using VHDL,Easy,4.6
"What VHDL data type allows the definition of user-specified values, such as states in a state machine?","['Scalar Type', 'Composite Type', 'Enumeration Type', 'Signed Type']",C,"Enumeration types in VHDL enable the creation of custom data types with named values, perfectly suited for representing states (e.g., IDLE, READ, WRITE).",Overflow and data representation using VHDL,Medium,4.6
"In VHDL, signed overflow occurs when:","['The result of an unsigned operation exceeds the bit range.', 'A carry bit is generated in an unsigned operation.', 'The result of a signed operation exceeds the defined bit range.', 'An invalid data type is used in an operation.']",C,Signed overflow is specifically defined as the result of a signed arithmetic operation exceeding the representable range based on the number of bits.,Overflow and data representation using VHDL,Medium,4.6
Which of the following is NOT a scalar type in VHDL?,"['BIT', 'STD_LOGIC', 'ARRAY', 'INTEGER']",C,"ARRAY is a composite data type, capable of holding multiple values; BIT, STD_LOGIC, and INTEGER are all scalar types, representing single values.",Overflow and data representation using VHDL,Easy,4.6
"In VHDL, what is the purpose of the `SIGNED` type?","['To represent unsigned integers only.', 'To represent complex numbers.', 'To represent signed integers.', 'To represent floating-point numbers.']",C,"The `SIGNED` type in VHDL is specifically designed to handle signed arithmetic operations, unlike `UNSIGNED` which is for non-negative numbers.",Design of combinational and sequential logic using VHDL,Easy,4.6
Which VHDL library is typically used for numeric operations?,"['IEEE.STD_LOGIC_TEXT', 'IEEE.NUMERIC_STD', 'IEEE.BOOLEAN_LOGIC', 'IEEE.BIT_VECTOR_LIB']",B,"The `IEEE.NUMERIC_STD` library provides the necessary packages and types for performing numeric operations, including those involving signed and unsigned numbers.",Design of combinational and sequential logic using VHDL,Medium,4.6
What type of circuit has outputs that are solely determined by the current inputs?,"['Sequential circuit', 'Latched circuit', 'Combinational circuit', 'Feedback circuit']",C,"Combinational circuits, unlike sequential circuits, lack memory elements and therefore their outputs are a direct function of their inputs at any given time.",Design of combinational and sequential logic using VHDL,Easy,4.6
"In the VHDL statement `Result <= A + B;`, assuming `A` and `B` are declared as `SIGNED`, what operation is performed?","['Unsigned addition', 'Boolean OR operation', 'Signed addition', 'Bitwise XOR operation']",C,"Since `A` and `B` are of type `SIGNED`, the `+` operator performs signed addition, taking into account the signs of the operands.",Design of combinational and sequential logic using VHDL,Medium,4.6
Which of the following best describes the use of VHDL in digital circuit design?,"['Simulation of analog circuits only', 'Design and simulation of both combinational and sequential logic', 'Design of only combinational logic circuits', 'Verification of PCB layouts']",B,"VHDL is a Hardware Description Language used for the design, simulation, and verification of both combinational and sequential digital logic circuits.",Design of combinational and sequential logic using VHDL,Easy,4.6
"In VHDL pipelining, what is the primary purpose of intermediate registers between pipeline stages?","['To increase the overall latency of the design.', 'To synchronize data flow between stages.', 'To reduce the clock frequency.', 'To increase the complexity of the design.']",B),"Intermediate registers are crucial for synchronizing data transfer between pipeline stages, ensuring that data from one stage is correctly transferred to the next stage at the appropriate clock cycle.",Pipelining using VHDL,Medium,4.6
What is a crucial step in designing a pipelined system in VHDL to ensure optimal throughput?,"['Minimizing the number of pipeline stages.', ' Using asynchronous signal transfer between stages.', 'Balancing the delay of each pipeline stage.', ' Increasing the bit width of the data signals.']",C),"Balancing the delay across pipeline stages prevents one stage from becoming a bottleneck, maximizing throughput.",Pipelining using VHDL,Medium,4.6
Which of the following is NOT a typical benefit of pipelining a design in VHDL?,"['Increased throughput.', 'Reduced latency.', 'Improved clock frequency.', 'Parallel processing of data.']",B),Pipelining increases throughput by processing multiple data items concurrently but introduces latency as data must pass through all stages.,Pipelining using VHDL,Medium,4.6
"In the provided VHDL code example of a pipelined adder, what does the signal `stage1` represent?","['The final sum.', 'An intermediate sum.', 'The input A.', 'The input B.']",B),`stage1` holds the result of the first addition stage (A+B) before being further processed in `stage2`.,Pipelining using VHDL,Easy,4.6
What is the primary role of the clock signal (`CLK`) in a VHDL pipelined design?,"['To control the data input.', 'To control the data output.', 'To synchronize the operation of different pipeline stages.', 'To determine the bit width of the data.']",C),"The clock signal synchronizes data transfer and processing between pipeline stages, ensuring correct operation.",Pipelining using VHDL,Easy,4.6
