question,options,answer,explanation,topic,difficulty,chapter
Which of the following is NOT a typical function of a CASE tool used for configuration management?,"['Version control', 'Impact analysis', 'Code compilation', 'Change management']",C,"Code compilation is a function of a compiler, not typically a direct function of a CASE tool for configuration management, though CASE tools might integrate with compilers.  Version control, impact analysis, and change management are core functions.",CASE tools for configuration management,Easy,8.3
A primary benefit of using CASE tools in software configuration management is:,"['Reduced development time only', 'Improved code readability only', 'Enhanced team collaboration and traceability', 'Lower hardware costs only']",C,"While CASE tools can contribute to reduced development time, improved code readability, and lower hardware costs (indirectly through efficiency), their primary benefit lies in enhancing collaboration and providing better traceability of changes throughout the software development lifecycle.",CASE tools for configuration management,Medium,8.3
"What is a key challenge in effectively utilizing CASE tools for configuration management in large, distributed development teams?","[' Lack of skilled personnel', 'High initial cost of the software', 'Maintaining data consistency across multiple locations', 'All of the above']",D,All the options represent significant challenges. Skilled personnel are needed to operate and maintain the tools.  The initial investment can be substantial. And ensuring consistent data across geographically dispersed teams is a major hurdle.,CASE tools for configuration management,Medium,8.3
Which type of CASE tool would be most useful for visualizing and understanding the relationships between different components within a complex software system?,"[' Testing tools', ' Data modelling tools', ' Requirements management tools', ' Code generation tools']",B,"Data modelling tools are designed to visually represent the structure and relationships within a system, aiding in understanding the system's architecture and component interactions.",CASE tools for configuration management,Easy,8.3
How do CASE tools typically support the process of change management in software configuration?,"['By automatically generating code changes', 'By tracking changes, managing versions, and facilitating approvals', 'By eliminating the need for software testing', 'By preventing any software changes from being implemented']",B,"CASE tools for configuration management track changes, manage different versions of software components, and help enforce a controlled change process, including approvals and impact assessments. They do not automatically generate code changes or prevent changes entirely.",CASE tools for configuration management,Medium,8.3
