question,options,answer,explanation,topic,difficulty,chapter
What is data independence in the context of database management?,"['The ability to access data from multiple sources simultaneously.', 'The ability to modify the database schema at one level without affecting higher levels.', 'The process of converting data into a usable format.', 'The level of security applied to sensitive data.']",B,Data independence refers to the ability to make changes to the database structure (schema) at one level without requiring changes at other levels. This protects applications and user views from being impacted by schema modifications.,Data Abstraction and Data Independence,Easy,7.3
Which type of data independence ensures that changes to the conceptual schema do not affect external schemas or application programs?,"['Physical data independence', 'Logical data independence', 'Data Integrity', 'Data redundancy']",B,Logical data independence isolates external views (application programs and user views) from changes in the conceptual schema.  Changes to the overall database design don't necessitate changes to individual application programs.,Data Abstraction and Data Independence,Medium,7.3
A view in a database system primarily serves which purpose?,"['To store the physical location of data.', 'To provide a simplified and tailored perspective of the underlying data.', 'To enhance database security by encrypting all data.', 'To manage database transactions and concurrency.']",B,"Database views offer a customized subset of the data, presenting only the relevant information to users without exposing the entire database structure.",Data Abstraction and Data Independence,Easy,7.3
What is the primary benefit of separating data independence into logical and physical levels?,"['Increased data storage capacity.', 'Improved data retrieval speed.', 'Reduced risk of data loss.', 'Enhanced flexibility and maintainability of the database system.']",D,"Separating data independence into logical and physical levels allows for modifications at one level (e.g., changing the physical storage) without impacting higher levels (e.g., application views), improving maintainability and allowing for database optimization without disrupting applications.",Data Abstraction and Data Independence,Medium,7.3
Physical data independence addresses which aspect of database schema modifications?,"['Changes to the conceptual schema.', 'Changes to the external schema.', 'Changes to the physical storage and access methods.', 'Changes to data types and integrity constraints.']",C,"Physical data independence focuses on shielding higher levels of the database (logical and external schemas) from changes in how data is physically stored and accessed (e.g., changing the file system or storage devices).",Data Abstraction and Data Independence,Medium,7.3
What is the primary purpose of an Entity-Relationship (E-R) Model in database design?,"['To define data types and sizes for attributes.', 'To visually represent database structures and relationships.', 'To manage data transactions and concurrency.', 'To enforce data integrity constraints.']",B,"The E-R model is a visual tool for designing database structures, showing entities, attributes, and their relationships.",Schema and Instances,Easy,7.3
"In the context of databases, what is the relationship between a schema and an instance?","[""An instance is a physical representation of the schema's logical design."", 'A schema is a subset of an instance, containing only essential data.', 'A schema and an instance are interchangeable terms.', 'A schema is a blueprint, while an instance is a real-time record within the database.']",D,"The schema defines the structure (blueprint), while the instance is the actual data stored in the database.",Schema and Instances,Medium,7.3
"Which of the following best describes an ""entity"" in an Entity-Relationship model?","['A specific data type within a database table.', 'A relationship between two tables in a database.', 'A real-world object or concept represented in a database.', 'A constraint that ensures data integrity.']",C,"Entities represent real-world things, such as customers, products, or orders.",Schema and Instances,Easy,7.3
What is an attribute in the context of an Entity-Relationship Model?,"['A constraint on the data.', 'A specific instance of an entity.', 'A characteristic or property of an entity.', 'A relationship between two entities.']",C,"Attributes are the properties or characteristics of entities (e.g., age, name, price).",Schema and Instances,Easy,7.3
The Entity-Relationship (E-R) model uses which of the following to represent the connections between entities?,"['Attributes', 'Schemas', 'Instances', 'Relationships']",D,Relationships define how entities are connected to each other.,Schema and Instances,Medium,7.3
"In the Entity-Relationship (E-R) model, what represents real-world objects or concepts?","['Attributes', 'Relationships', 'Entities', 'Schemas']",C,"Entities in the E-R model represent real-world objects or concepts.  Attributes describe the characteristics of entities, and relationships define how entities are connected. Schemas are overall database designs.",E-R Model,Easy,7.3
What is the primary purpose of the Entity-Relationship (E-R) Model?,"['To manage database instances', 'To visually design and represent database structures', 'To define data types within a database', 'To enforce data integrity constraints']",B,"The E-R model is a visual tool used to design and represent the structure of a database before implementation.  While it indirectly supports the other options, its core function is visual database design.",E-R Model,Easy,7.3
Which of the following is NOT a fundamental component of the Entity-Relationship (E-R) Model?,"['Entities', 'Attributes', 'Relationships', 'Indexes']",D,"Entities, attributes, and relationships are the three fundamental components. Indexes are database optimization structures, not core E-R model components.",E-R Model,Medium,7.3
"In an E-R diagram, what describes the characteristics of an entity?","['Relationships', 'Entities', 'Schemas', 'Attributes']",D,"Attributes define the properties or characteristics of an entity.  For example, ""name"" and ""age"" would be attributes of a ""student"" entity.",E-R Model,Easy,7.3
The difference between a database schema and database instances lies primarily in:,"['Data types used', 'The number of tables', ' The blueprint versus the actual data', 'The relationships between tables']",C,"The schema is the blueprint or design of the database, while instances are the actual data stored in the database tables at a given point in time.",E-R Model,Medium,7.3
Which type of entity set possesses a primary key to uniquely identify each record?,"['Weak Entity Set', 'Strong Entity Set', 'Composite Entity Set', 'Derived Entity Set']",B,"Strong entity sets are defined by their possession of a primary key, unlike weak entity sets.",Strong and Weak Entity Sets,Easy,7.3
A weak entity set is characterized by its lack of:,"['Attributes', 'Relationships', 'Unique Identifier', 'Composite Key']",C,"A weak entity set, by definition, cannot uniquely identify its records without relying on a strong entity.",Strong and Weak Entity Sets,Easy,7.3
What is the purpose of a key in a database table?,"['To establish relationships between tables', 'To uniquely identify each record', 'To store data types', 'To define table structures']",B,"Keys, whether primary or foreign, serve to uniquely identify individual records within a table.",Strong and Weak Entity Sets,Medium,7.3
An attribute that is composed of multiple sub-attributes is called a(n):,"['Simple Attribute', 'Multivalued Attribute', 'Derived Attribute', 'Composite Attribute']",D,A composite attribute is made up of several smaller attributes.,Strong and Weak Entity Sets,Medium,7.3
Which of the following best describes a derived attribute?,"['An attribute that is not directly stored but calculated from other attributes.', 'An attribute that can hold multiple values.', 'An attribute that forms part of a composite key.', 'An attribute that uniquely identifies a weak entity.']",A,"A derived attribute is calculated from other attributes, not directly stored in the database.",Strong and Weak Entity Sets,Medium,7.3
What is the defining characteristic of a strong entity in database design?,"['It possesses multiple primary keys.', 'It relies on a weak entity for identification.', 'It has a primary key to uniquely identify each record.', 'It lacks attributes.']",C,"Strong entities are defined by their possession of a primary key, which uniquely identifies each record within the entity.",Attributes and Keys,Easy,7.3
Which type of attribute is calculated from other attributes within an entity?,"['Simple Attribute', 'Composite Attribute', 'Multivalued Attribute', 'Derived Attribute']",D,Derived attributes are calculated or derived from other attributes within the entity.,Attributes and Keys,Medium,7.3
What is the purpose of a key in a relational database?,"['To organize data alphabetically.', 'To uniquely identify records within a table.', 'To store metadata about the table.', 'To enforce data types.']",B,"Keys are crucial for uniquely identifying individual records within a database table, enabling efficient data retrieval and management.",Attributes and Keys,Easy,7.3
A weak entity is characterized by:,"['Having a unique identifier.', ' Being independent of other entities.', 'Lacking a unique identifier of its own.', 'Always having multiple attributes.']",C,A weak entity lacks its own unique identifier and relies on a strong entity for identification.,Attributes and Keys,Medium,7.3
An attribute that can hold more than one value for a single record is called a:,"['Simple attribute', 'Composite attribute', 'Derived attribute', 'Multivalued attribute']",D,"A multivalued attribute can hold several values for a single record, unlike simple attributes which hold only one value.",Attributes and Keys,Easy,7.3
What is the primary purpose of normalization in database design?,"['To increase data redundancy.', 'To simplify the database structure.', 'To minimize data redundancy and improve data integrity.', 'To create larger, more complex tables.']",C,Normalization aims to reduce data redundancy and improve data integrity by organizing data efficiently.,E-R Diagram,Easy,7.3
Which of the following best describes an E-R diagram?,"['A programming language for database management.', 'A graphical representation of entities and their relationships.', 'A method for data encryption.', 'A type of database query language.']",B,An E-R diagram is a visual tool used to represent entities and how they relate to each other within a database.,E-R Diagram,Easy,7.3
What is the main goal achieved by decomposing large tables into smaller ones during normalization?,"['Increased data inconsistency.', 'Creation of more complex relationships.', 'Improved data integrity and reduced redundancy.', 'Reduced query processing speed.']",C,Decomposition in normalization reduces redundancy and improves data integrity by making data more manageable and less prone to anomalies.,E-R Diagram,Medium,7.3
"The concept of ""normal forms"" is most closely associated with which database design process?","['Data encryption.', 'Data modeling.', 'Normalization.', 'Query optimization.']",C,Normal forms are the different levels achieved through the normalization process to reduce redundancy.,E-R Diagram,Medium,7.3
Data anomalies are most likely to occur in databases that are:,"['Highly normalized.', 'Properly indexed.', 'Unnormalized or poorly normalized.', 'Efficiently queried.']",C,"Unnormalized or poorly normalized databases are susceptible to data anomalies (insertion, update, deletion anomalies).",E-R Diagram,Medium,7.3
Which normal form eliminates repeating groups of data within a table?,"['2NF', '3NF', 'BCNF', '1NF']",D,"1NF is the foundational normal form that addresses the issue of repeating groups, ensuring all attributes are atomic.","Different Normal Forms (1st, 2nd, 3rd, BCNF)",Easy,7.3
A non-key attribute is transitively dependent on the primary key in which normal form?,"['1NF', '2NF', '3NF', 'This situation is not found in any normal form.']",C,"Transitive dependency, where a non-key attribute depends on another non-key attribute which in turn depends on the primary key, is eliminated in 3NF.","Different Normal Forms (1st, 2nd, 3rd, BCNF)",Medium,7.3
What is the primary characteristic addressed by the Second Normal Form (2NF)?,"['Elimination of transitive dependencies', 'Elimination of redundant data', 'Elimination of partial dependencies', 'Ensuring atomicity of attributes']",C,"2NF specifically focuses on removing partial dependencies, where a non-key attribute depends only on part of the primary key (in composite keys).","Different Normal Forms (1st, 2nd, 3rd, BCNF)",Medium,7.3
In which normal form is it guaranteed that all non-key attributes are fully functionally dependent on the entire primary key?,"['1NF', '2NF', '3NF', 'BCNF']",B,"2NF eliminates partial dependencies, ensuring that all non-key attributes depend on the entire primary key.","Different Normal Forms (1st, 2nd, 3rd, BCNF)",Medium,7.3
The concept of atomic values within attributes is primarily addressed in which normal form?,"['2NF', '3NF', 'BCNF', '1NF']",D,"1NF is concerned with ensuring that all attributes contain only single, indivisible values (atomic values).","Different Normal Forms (1st, 2nd, 3rd, BCNF)",Easy,7.3
What is a functional dependency in the context of relational database design?,"['A constraint ensuring referential integrity between tables.', 'A relationship where one attribute uniquely determines another.', 'A rule defining the order of attributes within a table.', 'A method for optimizing query execution speed.']",B,A functional dependency describes a situation where the value of one attribute (or set of attributes) determines the value of another attribute.,Functional Dependencies,Easy,7.3
Which normal form is stricter than 3NF and requires that every determinant be a candidate key?,"['1NF', '2NF', '3NF', 'BCNF']",D,"Boyce-Codd Normal Form (BCNF) is a higher level of normalization than 3NF, enforcing a stricter constraint on determinants.",Functional Dependencies,Medium,7.3
How do functional dependencies aid in database normalization?,"['They prevent data redundancy and anomalies.', 'They improve the speed of data insertion operations.', 'They simplify the design of primary keys.', 'They enforce data consistency across different databases.']",A,"By identifying redundant data and dependencies, functional dependencies guide the process of removing redundancy and minimizing anomalies.",Functional Dependencies,Easy,7.3
"If attribute 'A' uniquely determines attribute 'B', which statement correctly describes the functional dependency?","['B → A', 'A → B', 'A ⊂ B', 'B ⊂ A']",B,The notation A → B indicates that attribute A functionally determines attribute B.,Functional Dependencies,Medium,7.3
A determinant in a relational database refers to:,"['An attribute whose value uniquely identifies a tuple.', 'An attribute that is functionally dependent on another attribute.', 'An attribute that determines the value of one or more other attributes.', 'A set of attributes forming a primary key.']",C,A determinant is an attribute (or a group of attributes) that determines the value of other attributes.  A candidate key is a special case of a determinant.,Functional Dependencies,Medium,7.3
What is the primary function of integrity constraints in a database?,"['To optimize query performance.', 'To maintain data accuracy and consistency.', 'To control user access to the database.', 'To manage storage space efficiently.']",B,Integrity constraints are fundamental to ensuring the reliability and validity of data within a database system. They prevent inconsistencies and inaccuracies.,Integrity Constraints and Domain Constraints,Easy,7.3
Which type of constraint defines the permissible values for a specific database attribute?,"['Referential Integrity', 'Entity Integrity', 'Domain Constraint', 'Unique Constraint']",C,"Domain constraints directly specify the allowed values for an attribute, ensuring data conforms to predefined rules.",Integrity Constraints and Domain Constraints,Easy,7.3
Referential integrity primarily addresses which aspect of database design?,"['The uniqueness of primary keys.', 'The validity of data types.', 'The consistency of relationships between tables.', 'The size limits of database fields.']",C,"Referential integrity focuses on maintaining consistency across tables linked by foreign keys, preventing orphaned records and maintaining data relationships.",Integrity Constraints and Domain Constraints,Medium,7.3
Entity integrity is most closely associated with which database element?,"['Foreign Keys', 'Data Types', 'Primary Keys', 'Attributes']",C,"Entity integrity rules ensure the uniqueness and non-null nature of primary keys, guaranteeing the unique identification of each record in a table.",Integrity Constraints and Domain Constraints,Medium,7.3
A database relation is best described as:,"['A specific data type.', 'A set of integrity constraints.', 'A table storing data.', 'A query result set.']",C,"In relational database theory, a relation is synonymous with a table; it's a structured way to organize and store data in rows and columns.",Integrity Constraints and Domain Constraints,Easy,7.3
What is a derived relation in the context of relational databases?,"['A relation stored permanently in the database.', 'A relation created by joining multiple tables.', 'A relation defined using SQL queries or views.', 'A relation that contains only primary keys.']",C,"A derived relation is a temporary relation created dynamically using SQL queries or views, not permanently stored.","Relations (Joined, Derived)",Easy,7.3
Which SQL language component is primarily used for creating and modifying database structures?,"['Data Manipulation Language (DML)', 'Data Definition Language (DDL)', 'Transaction Control Language (TCL)', 'Data Control Language (DCL)']",B,"DDL (Data Definition Language) is responsible for defining the database structure, including creating, altering, and deleting tables, indexes, and other database objects.","Relations (Joined, Derived)",Easy,7.3
A joined relation is best described as:,"['A relation resulting from a calculation on a single table.', 'A relation formed by combining data from multiple relations.', 'A relation containing only unique values.', 'A relation that is automatically updated.']",B,"A joined relation combines data from multiple relations using join operations like INNER JOIN, OUTER JOIN, etc.","Relations (Joined, Derived)",Easy,7.3
What type of SQL command would you use to create a new table in a database?,"['SELECT', 'UPDATE', 'INSERT', 'CREATE TABLE']",D,The `CREATE TABLE` command is used in SQL's DDL (Data Definition Language) to define and create a new table.,"Relations (Joined, Derived)",Medium,7.3
Views in SQL are most closely related to which type of relation?,"['Joined Relations', 'Base Relations', 'Derived Relations', 'Temporary Relations']",C,"Views, being virtual tables based on the result-set of an SQL statement, are a specific type of derived relation.  They don't store data directly but present a customized view of underlying data.","Relations (Joined, Derived)",Medium,7.3
Which of the following is NOT a Data Definition Language (DDL) command?,"['CREATE', 'ALTER', 'DELETE', 'DROP']",C,"CREATE, ALTER, and DROP are used to define and modify database structures, which are DDL commands. DELETE is a Data Manipulation Language (DML) command used to manipulate data within tables.",Queries under DDL and DML Commands,Easy,7.3
What is the primary function of Data Manipulation Language (DML) commands?,"['Defining database structures.', 'Managing database users and permissions.', 'Manipulating data within tables.', 'Creating database backups.']",C,"DML commands are used for tasks such as inserting, updating, deleting, and retrieving data from database tables.",Queries under DDL and DML Commands,Easy,7.3
A database view is best described as:,"['A physical copy of a table.', 'A stored procedure that performs calculations.', 'A virtual table providing a customized data representation.', 'A type of database index.']",C,Views are virtual tables that offer a customized perspective of data without storing the data physically.,Queries under DDL and DML Commands,Medium,7.3
Which command would you use to add a new row to a database table?,"['UPDATE', 'ALTER', 'INSERT', 'SELECT']",C,The INSERT command is used to add new rows (records) into a database table.,Queries under DDL and DML Commands,Easy,7.3
What is the purpose of an assertion in a database?,"['To improve query performance.', 'To enforce specific conditions on data.', 'To create database backups automatically.', 'To manage database transactions.']",B,Assertions are constraints that ensure data integrity by enforcing specific conditions on the data stored in the database.,Queries under DDL and DML Commands,Medium,7.3
Which type of drawing best represents how an object appears to the human eye?,"['Sectional drawing', 'Orthographic projection', 'Isometric projection', 'Pictorial view']",D,"Pictorial views, including perspective and oblique projections, aim to show objects realistically as seen by the human eye.",Views,Easy,7.3
What is the primary purpose of a sectional drawing?,"[""To show the object's overall dimensions"", 'To reveal internal features of an object', ""To illustrate the object's external form"", 'To depict the object from multiple viewpoints']",B,Sectional drawings use cuts to expose the internal structure of an object.,Views,Easy,7.3
"In engineering design, what kind of views are frequently used to communicate design concepts realistically?","[' Working drawings', ' Assembly drawings', ' Pictorial views', ' Detail drawings']",C,Pictorial views provide a realistic representation for design presentations.,Views,Medium,7.3
Which of the following is NOT a primary characteristic of a pictorial view?,"[' Three-dimensional representation', ' Realistic appearance', ' Precise dimensional accuracy', ' Use in design presentations']",C,"While pictorial views aim for a realistic appearance, they may not always provide precise dimensional accuracy compared to orthographic projections.",Views,Medium,7.3
A drawing that shows an internal view of an object by cutting through it is known as what type of drawing?,"[' Perspective drawing', ' Oblique drawing', ' Sectional drawing', ' Isometric drawing']",C,Sectional drawings are specifically designed to reveal internal details by employing cross-sections.,Views,Easy,7.3
What is a database trigger?,"['A predefined query that retrieves data.', 'A predefined action automatically executed upon specific database events.', 'A type of relational algebra operator.', 'A security measure to prevent unauthorized access.']",B,A database trigger is a procedural code automatically invoked in response to certain events on a particular table or view in a database.,Assertions and Triggering,Easy,7.3
Which of the following best describes relational algebra?,"['A programming language for database management.', 'A formal language for describing database queries.', 'A type of database trigger.', 'A method for optimizing database performance.']",B,Relational algebra is a formal query language used to manipulate relational databases.  It provides a theoretical foundation for many practical query languages.,Assertions and Triggering,Easy,7.3
A trigger's execution is primarily driven by:,"['User input.', 'Scheduled tasks.', 'Database events.', 'External API calls.']",C,"Triggers are activated by specific events within the database, such as INSERT, UPDATE, or DELETE operations.",Assertions and Triggering,Medium,7.3
What is the main purpose of using assertions in a database?,"['To enhance database performance.', 'To ensure data integrity.', 'To improve query speed.', 'To manage user accounts.']",B,"Assertions define rules that must be true for the database at all times, ensuring data consistency and validity.",Assertions and Triggering,Medium,7.3
How do triggers differ from stored procedures?,"['Triggers are manually executed, while stored procedures are automatically executed.', 'Stored procedures are event-driven, while triggers are not.', 'Triggers are automatically executed in response to specific database events, while stored procedures are explicitly called.', 'Both are the same; they are just different names.']",C,"Stored procedures are explicitly called by users or applications, while triggers are implicitly invoked by the database system based on specific events.",Assertions and Triggering,Medium,7.3
Which SQL language component is primarily used for creating and modifying database structures?,"['Data Manipulation Language (DML)', 'Data Definition Language (DDL)', 'Data Control Language (DCL)', 'Transaction Control Language (TCL)']",B,"DDL (Data Definition Language) commands are used to define the database structure, including creating, altering, and deleting tables, indexes, and other database objects.  DML is for manipulating data within those structures.",Relational Algebra,Easy,7.3
A derived relation in a relational database is best described as:,"['A relation stored permanently in a database file.', 'A relation resulting from a join operation.', 'A relation created using SQL queries or views.', 'A relation with only primary key attributes.']",C,"Derived relations are virtual tables created dynamically through queries (SELECT statements) or views, not stored permanently like base relations.",Relational Algebra,Medium,7.3
