question,options,answer,explanation,topic,difficulty,chapter
The process of combining data from multiple tables in a relational database is generally known as:,"['Normalization', 'Denormalization', 'Joining', 'Indexing']",C,Joining is a core relational algebra operation used to combine rows from two or more tables based on a related column.,Relational Algebra,Easy,7.3
What is a key function of the Data Manipulation Language (DML) in SQL?,"['Defining database schemas', 'Managing user access privileges', 'Retrieving, inserting, updating, and deleting data', 'Controlling database transactions']",C,"DML commands, such as SELECT, INSERT, UPDATE, and DELETE, are used to manipulate data within database tables.",Relational Algebra,Easy,7.3
"In relational database management, what does a ""join"" operation achieve?","[' Removes duplicate rows from a table.', ' Combines data from multiple tables based on a common attribute.', ' Divides a large table into smaller tables.', ' Indexes a table for faster data retrieval.']",B,"A join operation links records from different tables based on a shared attribute, enabling retrieval of combined data.",Relational Algebra,Medium,7.3
Which relational algebra operation retrieves only the common records between two relations?,"['Selection (σ)', 'Projection (π)', 'Intersection (∩)', 'Union (∪)']",C,Intersection (∩) finds the common tuples (records) present in both relations.,Query Cost Estimation,Easy,7.3
"In relational algebra, which operation combines related records from multiple tables?","['Union (∪)', 'Difference (-)', 'Join (⨝)', 'Projection (π)']",C,The join operation (⨝) combines tuples from two relations based on a specified join condition.,Query Cost Estimation,Easy,7.3
What is the primary purpose of query cost estimation in database management?,"['To optimize data storage.', 'To evaluate query efficiency.', 'To ensure data integrity.', 'To manage user access permissions.']",B,Query cost estimation helps determine the efficiency and resource consumption of a given query.,Query Cost Estimation,Easy,7.3
Which relational algebra operation removes rows from a relation based on a given condition?,"['Projection (π)', 'Selection (σ)', 'Union (∪)', 'Join (⨝)']",B,"Selection (σ) filters rows based on a specified condition, retaining only those that satisfy the condition.",Query Cost Estimation,Medium,7.3
The relational algebra operation that finds records present in one relation but not in another is:,"['Intersection (∩)', 'Union (∪)', 'Difference (-)', 'Join (⨝)']",C,The difference (-) operation returns tuples present in the first relation but absent in the second.,Query Cost Estimation,Medium,7.3
Which of the following is NOT a fundamental query operation in relational database systems?,"['Selection', 'Projection', 'Iteration', 'Join']",C,"Selection, projection, and join are fundamental relational algebra operations. Iteration is a programming construct, not a core query operation.",Query Operations,Easy,7.3
A query optimizer's primary goal is to:,"[' Minimize network traffic.', ' Select the most efficient query execution plan.', ' Ensure data consistency.', ' Prevent SQL injection attacks.']",B,"Query optimizers analyze various execution plans to choose the one that minimizes resource consumption (CPU, I/O, memory).  While other options are important, they are not the primary function of a query optimizer.",Query Operations,Medium,7.3
"What is the purpose of the ""projection"" operation in a relational database query?","['To filter rows based on a specified condition.', 'To combine data from multiple tables.', 'To select specific columns from a table.', 'To sort the data in ascending or descending order.']",C,"Projection selects specific attributes (columns) from a relation (table).  Selection filters rows, joins combine tables, and sorting orders the data.",Query Operations,Easy,7.3
"The ""join"" operation in relational databases is primarily used for:","[' Deleting duplicate rows from a table.', ' Combining data from two or more tables based on a related column.', ' Creating new tables from existing ones.', ' Sorting the data within a single table.']",B,"A join operation combines rows from two or more tables based on a related column (e.g., foreign key relationships).",Query Operations,Easy,7.3
Factors considered by a query optimizer when choosing an execution plan include:,"[' Data type of the columns.', ' Disk I/O, CPU usage, and indexing strategies.', "" The user's operating system."", ' The programming language used to write the query.']",B,"Query optimizers prioritize efficient resource utilization. Disk I/O, CPU usage, and indexing heavily influence query performance. The other options are not direct factors in choosing an execution plan.",Query Operations,Medium,7.3
What is query optimization in the context of evaluating SQL expressions?,"['Converting SQL queries into a programming language.', 'Improving query performance by selecting the best execution strategy.', 'Storing data in a relational database.', 'Debugging SQL code.']",B,"Query optimization focuses on finding the most efficient way to execute a SQL query, leading to faster processing.",Evaluation of Expressions,Easy,7.3
"Which technique helps break down complex SQL queries into smaller, more manageable parts?","['Query normalization', 'Query rewriting', 'Indexing', 'Query decomposition']",D,Query decomposition is the process of breaking down complex queries to improve efficiency.,Evaluation of Expressions,Easy,7.3
"Besides query rewriting, what other technique contributes to efficient execution of SQL queries?","['Data encryption', 'Using efficient joins', 'Data visualization', 'Data warehousing']",B,"Efficient join methods are crucial for optimizing query performance, especially when dealing with large datasets.",Evaluation of Expressions,Medium,7.3
What is a primary goal of query optimization techniques?,"['Increasing the size of the database.', 'Improving query performance.', 'Reducing the complexity of the database schema.', 'Enhancing data security.']",B,The core purpose of query optimization is to speed up query execution.,Evaluation of Expressions,Easy,7.3
What does the process of converting high-level SQL queries into efficient execution plans involve?,"['Data mining techniques', 'Optimization techniques', 'Data compression algorithms', 'Statistical analysis methods']",B,The conversion from high-level SQL to efficient execution relies heavily on optimization strategies.,Evaluation of Expressions,Medium,7.3
What is the primary goal of query optimization in database systems?,"['Increasing the complexity of queries.', 'Reducing response times and resource consumption.', 'Limiting the number of users accessing the database.', 'Enhancing the storage capacity of the database.']",B,Query optimization aims to make queries more efficient by minimizing the time taken to execute them and the resources used in the process.,Query Optimization,Easy,7.3
Which of the following is NOT a direct benefit of efficient query optimization?,"['Improved database performance.', 'Reduced server load.', 'Increased database size.', 'Faster query execution.']",C,"While optimization improves overall performance, it doesn't directly lead to an increase in database size.  Increased size might be a consequence of other factors, not optimization itself.",Query Optimization,Medium,7.3
How does query optimization impact the scalability of a database system?,"['It makes the system less scalable.', 'It has no impact on scalability.', 'It improves the scalability of the system.', 'It only impacts scalability under high load.']",C,"Optimized queries allow the database to handle more requests efficiently, thereby increasing its scalability.",Query Optimization,Medium,7.3
What is a key characteristic of a well-optimized query?,"['High resource consumption.', 'Slow execution speed.', 'Efficient resource utilization.', 'Complex query structure.']",C,Efficient resource utilization is a hallmark of a well-optimized query. It uses minimal resources to achieve the desired results.,Query Optimization,Easy,7.3
The application of optimization techniques to database queries primarily focuses on which aspect of the system?,"['Data storage methods', 'Data security protocols', 'Data retrieval efficiency', 'Data backup strategies']",C,"Optimization directly relates to how efficiently data is retrieved, making it faster and less resource-intensive.",Query Optimization,Easy,7.3
What is the primary goal of query optimization in database management systems?,"['To enhance the readability of SQL queries.', 'To improve the performance of query execution.', 'To reduce the storage space required for query results.', 'To simplify the structure of complex SQL queries.']",B,Query optimization focuses on improving the speed and efficiency of retrieving data in response to a query.,Query Decomposition,Easy,7.3
"Which technique breaks down complex SQL queries into smaller, more manageable units for processing?","['Query Rewriting', 'Indexing', 'Query Decomposition', 'Efficient Joins']",C,"Query decomposition is specifically designed to break down large, complex queries into smaller, more easily processed subqueries.",Query Decomposition,Easy,7.3
How does query decomposition contribute to efficient query processing?,"['By increasing the complexity of the query.', 'By reducing the amount of data processed at once.', 'By requiring more storage space for intermediate results.', 'By making the query harder to understand.']",B,"Smaller subqueries process smaller datasets, resulting in overall faster execution.",Query Decomposition,Medium,7.3
What is a potential benefit of using query decomposition in a database system with a large volume of data?,"['Increased query complexity.', 'Reduced processing time.', 'Higher storage requirements.', 'Increased risk of errors.']",B,"Decomposition allows for parallel processing of smaller queries, significantly reducing total execution time, particularly beneficial with large datasets.",Query Decomposition,Medium,7.3
"In the context of database query processing, what is the relationship between query decomposition and efficient execution plans?","['They are unrelated concepts.', 'Query decomposition hinders the creation of efficient execution plans.', 'Query decomposition is a technique used to create more efficient execution plans.', 'Efficient execution plans are only possible without query decomposition.']",C,"Breaking down complex queries into smaller, simpler subqueries allows for the creation of more targeted and efficient execution plans.",Query Decomposition,Medium,7.3
