question,options,answer,explanation,topic,difficulty,chapter
Which of the following is NOT a core capability typically associated with Artificial Intelligence (AI)?,"['Learning from experience', 'Recognizing patterns', 'Independent emotional expression', 'Making decisions']",C,"While AI can simulate human-like behavior, independent emotional expression is not a core focus or capability of AI systems.  AI primarily focuses on cognitive functions like learning, decision-making, and pattern recognition.",Concept of Artificial Intelligence,Easy,9.1
Artificial intelligence (AI) primarily aims to simulate which aspect of human capabilities?,"['Physical strength and dexterity', 'Biological functions and processes', 'Intelligence and cognitive abilities', 'Artistic and creative talents']",C,"AI focuses on replicating human intelligence, encompassing reasoning, problem-solving, learning, and decision-making.  It does not directly address physical capabilities or biological processes.",Concept of Artificial Intelligence,Easy,9.1
"What is a key characteristic of an AI system's ability to ""learn from experience""?","[' Maintaining a constant set of pre-programmed responses.', ' Adapting its behavior based on new data and feedback.', ' Ignoring past failures and repeating previous actions.', ' Operating solely on pre-defined rules without modification.']",B,"Learning from experience implies the system modifies its behavior based on the outcomes of past actions and new data received.  A, C, and D describe systems lacking this adaptability.",Concept of Artificial Intelligence,Medium,9.1
The ability of an AI system to understand and respond to human language is often referred to as:,"[' Pattern Recognition', ' Machine Learning', ' Natural Language Processing', ' Deep Learning']",C,"Natural Language Processing (NLP) is the branch of AI that focuses on enabling computers to understand, interpret, and generate human language.",Concept of Artificial Intelligence,Medium,9.1
"In the context of AI, what does the term ""pattern recognition"" typically involve?","[' Randomly generating sequences of data.', ' Identifying recurring features or structures in data.', ' Ignoring inconsistencies and outliers in datasets.', ' Creating entirely new and unique data patterns.']",B,"Pattern recognition is the ability to identify regularities and similarities within data, a crucial aspect of many AI applications.",Concept of Artificial Intelligence,Easy,9.1
What is an agent in the context of AI?,"['A program that learns from data without human intervention.', 'An entity that perceives its environment and acts upon it to achieve goals.', 'A type of machine learning algorithm used for classification.', 'A system designed solely for data analysis.']",B,The definition provided in the passage clearly states that an agent is an entity that perceives and acts upon its environment to achieve specific goals.,AI Perspectives,Easy,9.1
Which philosophical area is NOT directly addressed when considering the ethical implications of AI?,"['Epistemology', 'Logic', 'Aesthetics', 'Ethics']",C,"While aesthetics might indirectly influence design choices, the passage highlights ethics, logic, and epistemology as the core philosophical areas directly relevant to AI's ethical considerations.",AI Perspectives,Medium,9.1
A crucial aspect of developing ethical AI systems involves:,"['Ignoring potential biases in algorithms.', 'Prioritizing speed over accuracy.', 'Addressing biases in machine learning models.', 'Limiting access to AI technology.']",C,The passage explicitly mentions addressing biases in machine learning models as a key aspect of developing ethical AI systems.,AI Perspectives,Easy,9.1
What is a core philosophical question raised by the development of AI?,"[' What is the best programming language for AI?', 'Can machines think?', 'How fast can computers calculate?', 'What is the most efficient data storage method?']",B,"The passage explicitly lists ""Can machines think?"" as a key philosophical question related to AI.",AI Perspectives,Easy,9.1
"Besides ethical considerations, what other philosophical branch is crucial for understanding AI?","['Sociology', ' Psychology', ' Logic', 'Anthropology']",C,"The passage mentions that philosophy underpins the ethical, *logical*, and epistemological aspects of AI, making logic another crucial philosophical branch.",AI Perspectives,Medium,9.1
"Which period is often referred to as an ""AI winter"" due to unmet expectations?","['1980s', '1990s-2000s', '1960s-1970s', '2010s-Present']",C,"The ""AI winter"" refers to a period of reduced funding and interest in AI research due to failure to meet overly optimistic expectations. This period is generally considered to be the 1960s-1970s.",History of AI,Easy,9.1
What type of AI systems gained popularity in the 1980s?,"['Deep learning networks', 'Expert systems', 'Natural Language Processing systems', 'Machine learning algorithms']",B,"Expert systems, which used rule-based architectures, were a prominent feature of AI development in the 1980s.",History of AI,Easy,9.1
Which field of AI experienced significant advancements in the 1990s and 2000s?,"['Primarily robotics', 'Exclusively expert systems', 'Machine learning and natural language processing', 'Only deep learning']",C,"The 1990s and 2000s witnessed substantial progress in machine learning, data mining, and natural language processing techniques.",History of AI,Easy,9.1
The current era of AI is largely characterized by the prominence of which technology?,"['Rule-based expert systems', 'Symbolic reasoning', 'Deep learning and neural networks', 'Algorithmic trading']",C,"The 2010s and beyond have seen the rise of deep learning and neural networks, leading to significant breakthroughs in various AI applications.",History of AI,Medium,9.1
Early AI research primarily focused on which of the following?,"['Deep learning algorithms', 'Machine learning techniques', 'Problem-solving and symbolic methods', 'Natural language processing']",C,The foundational stages of AI research emphasized problem-solving and symbolic methods as the core approaches.,History of AI,Easy,9.1
Which decade saw the peak of popularity for expert systems in Artificial Intelligence?,"['1960s', '1970s', '1980s', '1990s']",C,"The passage explicitly states that expert systems, utilizing rule-based architectures, became popular in the 1980s.",Applications of AI,Easy,9.1
"What period is characterized by the ""AI winter,"" a time of diminished enthusiasm for AI due to unmet expectations?","['1980s-1990s', '1960s-1970s', '1990s-2000s', '2010s-Present']",B,"The passage clearly identifies the 1960s and 1970s as the period of the ""AI winter.""",Applications of AI,Easy,9.1
In which field does AI find application in creating personalized treatment plans and predictive analytics?,"['Finance', 'Transportation', 'Entertainment', 'Healthcare']",D,The passage mentions healthcare as a sector where AI is used for personalized treatment plans and predictive analytics.,Applications of AI,Easy,9.1
Algorithmic trading and fraud detection are AI applications primarily found in which sector?,"['Education', 'Healthcare', 'Finance', 'Transportation']",C,The passage specifically links algorithmic trading and fraud detection to the finance sector's use of AI.,Applications of AI,Easy,9.1
The recent breakthroughs in image and speech recognition are largely attributed to the rise of which AI technology?,"['Expert systems', 'Data mining', 'Deep learning and neural networks', 'Rule-based architectures']",C,The passage states that the emergence of deep learning and neural networks in the 2010s and beyond led to significant advancements in image and speech recognition.,Applications of AI,Medium,9.1
Which mathematical field is fundamentally crucial for the development and application of AI algorithms?,"['Topology', 'Number Theory', 'Linear Algebra', 'Graph Theory']",C,"Linear algebra, with its focus on vectors, matrices, and linear transformations, underpins many AI algorithms, particularly in machine learning.  Other areas of mathematics are also important but linear algebra is foundational.",Foundations of AI,Medium,9.1
What is the primary role of mathematics within the field of Artificial Intelligence?,"['To provide aesthetically pleasing visualizations of data.', 'To offer a framework for ethical considerations in AI development.', 'To enable the modeling, analysis, and solution of intricate problems.', 'To facilitate the creation of user-friendly AI interfaces.']",C,"Mathematics provides the theoretical and computational tools necessary to build and understand AI systems, addressing complex problems.",Foundations of AI,Easy,9.1
"In the context of AI development, what is the significance of understanding the foundational elements of the field?","['It helps in building faster AI systems.', 'It improves the user experience of AI applications.', 'It allows for a deeper comprehension of AI system operation and functionality.', 'It simplifies the programming of AI algorithms.']",C,"Understanding the fundamentals allows for a more complete grasp of how AI functions, including its strengths and limitations.",Foundations of AI,Easy,9.1
"The statement ""Mathematics is the backbone of AI"" highlights which aspect of AI development?","['The ethical implications of AI.', 'The importance of computational resources.', 'The underlying mathematical framework that supports AI.', 'The societal impact of advanced AI.']",C,The statement directly emphasizes the crucial role of mathematics in providing the core structure and tools for AI.,Foundations of AI,Easy,9.1
Why is a strong understanding of the foundational elements of AI considered crucial for AI practitioners?,"['To enhance marketing and sales strategies for AI products.', 'To better understand how to debug and troubleshoot AI systems.', 'To gain a deeper understanding of how AI systems operate and function.', 'To improve the speed and efficiency of AI algorithms.']",C,A solid grasp of foundational concepts facilitates a more comprehensive understanding of the mechanisms and processes within AI systems.,Foundations of AI,Medium,9.1
"In simulated annealing, what does a high temperature parameter imply?","['A higher probability of accepting worse solutions.', 'A lower probability of accepting worse solutions.', 'No impact on the probability of accepting solutions.', 'A deterministic search process.']",A,"High temperature allows the algorithm to explore more of the search space by accepting moves that worsen the current solution, increasing the chance of finding a global optimum.",Introduction of agents,Medium,9.1
"What is a key characteristic of adversarial search in AI, as described in the context of games?","['Agents cooperate to achieve a common goal.', 'The environment is non-deterministic and partially observable.', ""Agents' utility values at the game's end are always equal and opposite."", 'Only one agent makes decisions.']",C,"Adversarial search, as defined within the provided context, involves two agents with directly opposing utility values at the game's conclusion.",Introduction of agents,Medium,9.1
Local beam search differs from a standard hill-climbing search primarily by:,"['Focusing solely on the best successor state.', 'Maintaining and exploring multiple states concurrently.', 'Using a predetermined annealing schedule.', 'Guaranteeing an optimal solution.']",B,"Local beam search keeps track of and expands k states simultaneously, unlike hill-climbing which only explores one state at a time.",Introduction of agents,Medium,9.1
"In simulated annealing, how does the temperature parameter typically change over time?","['It remains constant throughout the search.', 'It increases gradually.', 'It decreases gradually.', 'It fluctuates randomly.']",C,"The temperature starts high and gradually decreases according to a schedule, simulating an annealing process.",Introduction of agents,Easy,9.1
"Which of the following is NOT a characteristic of a game, as defined within the context of adversarial search in AI?","['Deterministic environment', 'Fully observable environment', 'Two agents with alternating turns', 'Stochastic outcomes with probabilistic transitions.']",D,"The definition explicitly states that AI games, in this context, are deterministic and fully observable, thus excluding stochasticity.",Introduction of agents,Medium,9.1
What is the primary function of actuators within an intelligent agent?,"['To perceive environmental changes.', 'To process information and make decisions.', 'To act upon the environment.', 'To communicate with other agents.']",C),"Actuators are the components of an intelligent agent that allow it to interact with and modify its environment.  Sensors, on the other hand, are responsible for perceiving the environment.",Structure of Intelligent agent,Easy,9.1
Which component of an intelligent agent is responsible for implementing its decision-making process?,"['Sensors', 'Actuators', 'Architecture', 'Agent Program']",D),The agent program is the software that contains the algorithms and logic that govern how the agent makes decisions based on its perceptions and goals.,Structure of Intelligent agent,Easy,9.1
An intelligent agent that takes the initiative to achieve its goals without external prompting demonstrates which property?,"['Reactivity', 'Autonomy', 'Social Ability', 'Proactiveness']",D),"Proactiveness refers to the ability of an agent to anticipate and act upon opportunities or to take initiative to achieve its goals, even without immediate external stimuli.",Structure of Intelligent agent,Medium,9.1
The PEAS framework is used to describe which aspect of intelligent agents?,"['The internal decision-making process.', ""The agent's communication protocols."", 'The key components and environment of an agent.', ""The agent's learning capabilities.""]",C),"The PEAS (Performance, Environment, Actuators, Sensors) framework provides a structured way to define the agent's performance measure, the environment it operates in, its actuators, and its sensors.",Structure of Intelligent agent,Medium,9.1
Which property of an intelligent agent describes its ability to respond quickly to changes in its environment?,"['Autonomy', 'Proactiveness', 'Reactivity', 'Social Ability']",C),Reactivity is the ability of an intelligent agent to promptly respond to changes and events in its environment.,Structure of Intelligent agent,Easy,9.1
What is the term for an intelligent agent's ability to initiate actions to accomplish its objectives?,"['Reactivity', 'Autonomy', 'Proactiveness', 'Social Ability']",C,"Proactiveness refers to an agent's ability to take initiative and act to achieve goals, rather than simply reacting to events.",Properties of Intelligent Agents,Easy,9.1
Which component of an intelligent agent is responsible for enabling interaction with the surrounding world?,"['Agent Program', 'Architecture', 'Sensors', 'Actuators']",D,Actuators are the components that allow an agent to act upon its environment.,Properties of Intelligent Agents,Easy,9.1
An intelligent agent that operates independently without continuous human guidance demonstrates which key property?,"['Reactivity', 'Proactiveness', 'Social Ability', 'Autonomy']",D,Autonomy describes an agent's ability to operate independently.,Properties of Intelligent Agents,Easy,9.1
Which property of intelligent agents describes their capacity to interact and cooperate with other agents or human users?,"['Autonomy', 'Reactivity', 'Proactiveness', 'Social Ability']",D,Social ability refers to an agent's capability to communicate and cooperate.,Properties of Intelligent Agents,Medium,9.1
"In the context of intelligent agents, what does the acronym PEAS stand for (although the exact meaning isn't required for this question)?","[' Performance, Environment, Actuators, Sensors', ' Perception, Execution, Actions, Sensors', ' Program, Environment, Agents, System', ' Performance, Environment, Agents, Strategies']",A,"While the precise meaning of each letter isn't needed, PEAS is a framework used to describe an agent's components and environment.  The most accurate representation from the provided options reflects the core components.",Properties of Intelligent Agents,Medium,9.1
"Which of the following best describes the PEAS (Performance, Environment, Actuators, Sensors) model's purpose in AI?","['To define the ethical considerations of intelligent agents.', 'To provide a framework for designing and analyzing intelligent agents.', 'To classify different types of artificial intelligence algorithms.', 'To establish standards for testing the performance of AI systems.']",B,"The PEAS model is a framework used to characterize an AI agent by specifying its performance measure, environment, actuators, and sensors.  It helps in understanding and designing agents.",PEAS description of Agents,Easy,9.1
"In the PEAS model, what does the ""Actuators"" component represent?","[""The agent's ability to perceive its environment."", 'The methods the agent uses to affect its environment.', ""The agent's internal goals and objectives."", 'The performance measure used to evaluate the agent.']",B,Actuators are the parts of an agent that allow it to act upon and change its environment.,PEAS description of Agents,Easy,9.1
"A self-driving car uses cameras, lidar, and radar to gather information about its surroundings.  In the PEAS model, these technologies would be considered which component?","['Actuators', 'Performance Measure', 'Environment', 'Sensors']",D,"Sensors are the components that allow an agent to perceive its environment.  Cameras, lidar, and radar are all examples of sensors.",PEAS description of Agents,Medium,9.1
"A robotic vacuum cleaner's objective is to clean a floor thoroughly. Within the PEAS framework, this objective is classified as which element?","['Actuators', 'Sensors', 'Environment', 'Performance Measure']",D,"The performance measure defines how well the agent achieves its goal (in this case, how thoroughly the floor is cleaned).",PEAS description of Agents,Medium,9.1
Consider a chess-playing AI.  Which of the following would NOT be considered part of its environment within the PEAS model?,"['The chessboard and pieces.', ""The opponent's moves."", ""The AI's internal memory."", 'The rules of chess.']",C,The environment encompasses everything external to the agent; the AI's internal memory is internal to the agent.,PEAS description of Agents,Medium,9.1
"Which type of agent considers the cost and risk associated with achieving a goal, in addition to the goal itself?","['Simple Reflexive Agent', 'Model-Based Agent', 'Goal-Based Agent', 'Utility-Based Agent']",D,"Utility-based agents explicitly incorporate a utility function to evaluate the desirability of different states and the costs of achieving them, unlike goal-based agents which only focus on achieving the goal.","Types of Agents: Simple Reflexive, Model Based, Goal Based, Utility Based",Medium,9.1
A simple reflexive agent's primary characteristic is its ability to:,"['Formulate goals and plan actions.', ' React directly to perceived environmental states.', ' Consider the utility of different actions.', ' Build and update an internal model of the environment.']",B,Simple reflexive agents react directly to percepts without any internal state or planning.,"Types of Agents: Simple Reflexive, Model Based, Goal Based, Utility Based",Easy,9.1
What distinguishes a goal-based agent from a utility-based agent?,"[' The ability to perceive the environment.', ' The use of a search algorithm.', ' The consideration of multiple goals simultaneously.', ' The evaluation of the desirability and cost of different goal states.']",D,"Goal-based agents aim to achieve a goal, while utility-based agents consider the desirability and cost associated with different states and the paths to reach them.","Types of Agents: Simple Reflexive, Model Based, Goal Based, Utility Based",Medium,9.1
Which agent type is best suited for handling situations where uncertainty is a significant factor?,"['Simple Reflexive Agent', 'Model-Based Agent', 'Goal-Based Agent', 'Utility-Based Agent']",D,"Utility-based agents can handle uncertainty better by evaluating multiple paths and considering costs and risks, unlike goal-based agents that solely focus on achieving the goal.","Types of Agents: Simple Reflexive, Model Based, Goal Based, Utility Based",Medium,9.1
In which type of agent is a numerical value assigned to represent the desirability of a state?,"['Simple Reflexive Agent', 'Model-Based Agent', 'Goal-Based Agent', 'Utility-Based Agent']",D,A utility function assigns numerical values to represent the desirability of different states within a utility-based agent.,"Types of Agents: Simple Reflexive, Model Based, Goal Based, Utility Based",Easy,9.1
"In the context of artificial intelligence, what distinguishes a deterministic environment from a stochastic one?","['The presence of multiple agents.', 'The predictability of outcomes given a specific action.', ""The observability of the environment's state."", ""The agent's ability to learn from its experiences.""]",B,"A deterministic environment guarantees the same outcome for the same action, whereas a stochastic environment involves randomness and unpredictability.","Environment Types: Deterministic, Stochastic, Static, Dynamic, Observable, Semi-observable, Single Agent, Multi Agent",Medium,9.1
An environment where the agent can perceive the complete state at any point in time is classified as:,"['Dynamic', 'Multi-agent', 'Stochastic', 'Fully Observable']",D,A fully observable environment provides the agent with complete information about its state.,"Environment Types: Deterministic, Stochastic, Static, Dynamic, Observable, Semi-observable, Single Agent, Multi Agent",Easy,9.1
Which environment type is characterized by the inability of the agent to perceive the complete state of the environment at any given time?,"['Deterministic', 'Static', 'Partially Observable', 'Single Agent']",C,A partially observable environment limits the agent's access to the complete environmental state.,"Environment Types: Deterministic, Stochastic, Static, Dynamic, Observable, Semi-observable, Single Agent, Multi Agent",Easy,9.1
What is the key difference between a single-agent and a multi-agent environment?,"['The level of observability.', 'The predictability of outcomes.', 'The number of agents acting within the environment.', 'The dynamism of the environment.']",C,"A single-agent environment has only one agent, while a multi-agent environment involves multiple interacting agents.","Environment Types: Deterministic, Stochastic, Static, Dynamic, Observable, Semi-observable, Single Agent, Multi Agent",Easy,9.1
An environment where the state changes over time is best described as:,"['Static', 'Deterministic', 'Fully Observable', 'Dynamic']",D,A dynamic environment is characterized by continuous changes in its state.,"Environment Types: Deterministic, Stochastic, Static, Dynamic, Observable, Semi-observable, Single Agent, Multi Agent",Easy,9.1
