question,options,answer,explanation,topic,difficulty,chapter
What is a key characteristic of a well-defined function in software engineering?,"[' It always returns a numerical value.', 'It performs multiple, unrelated tasks.', 'It has a single, specific purpose.', 'It requires extensive external data.']",C,"A well-defined function should focus on one specific task, promoting modularity and code readability. Options A, B, and D describe poorly designed functions.",Defining Models,Easy,8.4
"Which principle promotes the use of small, focused functions in programming?","[' Code obfuscation', ' Abstraction', ' Modularity', ' Polymorphism']",C,"Modularity emphasizes breaking down complex systems into smaller, independent modules (functions) for better organization and maintainability.",Defining Models,Medium,8.4
What is a potential consequence of using overly large and complex functions in a software program?,"['Increased program speed', 'Reduced code debugging time', 'Improved code readability', 'Difficulty in maintenance and modification']",D,"Large, complex functions are difficult to understand, debug, and modify, leading to increased maintenance costs and potential errors.",Defining Models,in maintenance and modification,8.4
The concept of separating a function's internal workings from its external interface relates most closely to which software engineering principle?,"[' Iteration', ' Encapsulation', ' Inheritance', ' Recursion']",B,"Encapsulation hides the internal details of a function, revealing only the necessary interface to the user.",Defining Models,Medium,8.4
A function that accurately reflects its purpose through its name and implementation demonstrates which quality attribute?,"[' Complexity', ' Efficiency', ' Readability', ' Scalability']",C,"Readable code is easily understood, and a function's name and implementation should clearly communicate its purpose.",Defining Models,Easy,8.4
Which of the following is NOT a typical step in a requirements elicitation process for a software project?,"['Conducting stakeholder interviews', 'Creating a detailed design document', 'Analyzing user stories', 'Developing use cases']",B) Creating a detailed design document,"Detailed design comes after requirements are gathered and analyzed.  Requirements elicitation focuses on understanding *what* the system should do, not *how* it should do it.",Requirement Process,Easy,8.4
What is the primary goal of requirements validation?,"['To ensure the system meets user needs.', 'To define the technical specifications of the system.', 'To estimate the project cost and schedule.', 'To design the user interface.']",A) To ensure the system meets user needs.,Validation verifies that the requirements are correct and complete from the user's perspective.,Requirement Process,Medium,8.4
A functional requirement describes:,"[""The system's non-functional characteristics, such as performance."", ""The system's physical appearance and user interface."", 'What the system should do.', 'How the system should be implemented.']",C) What the system should do.,Functional requirements specify the system's functionalities and capabilities.,Requirement Process,Easy,8.4
Which technique is commonly used to gather requirements directly from end-users?,"[' Code review', ' Unit testing', ' Prototyping', ' User interviews']",D) User interviews,User interviews are a direct method of understanding user needs and expectations.,Requirement Process,Easy,8.4
Ambiguous requirements can lead to:,"[' Improved system performance', ' Reduced development costs', ' Project delays and rework', ' Increased user satisfaction']",C) Project delays and rework,"Unclear requirements lead to misunderstandings and errors, causing delays and necessitating rework.",Requirement Process,Medium,8.4
"In software development, what is the primary function of conditional branching logic?","['To sequentially execute code statements.', 'To control the flow of execution based on conditions.', 'To define data structures and their properties.', 'To handle errors and exceptions in the program.']",B,"Conditional branching, using structures like if-else statements, allows a program to execute different code blocks depending on whether a condition is true or false, thus controlling the flow of execution.",Use Cases,Easy,8.4
"Which of the following best describes a ""use case"" in software engineering?","['A specific implementation detail of a software module.', 'A description of user interaction with a system.', 'A detailed technical specification of a software component.', 'A type of software testing methodology.']",B,A use case describes how a user interacts with a system to achieve a particular goal. It focuses on the user's perspective and the system's response.,Use Cases,Easy,8.4
What is a key benefit of clearly defined use cases during the software development lifecycle?,"['Reduced need for software testing.', 'Elimination of all software bugs.', 'Improved communication between stakeholders.', 'Decreased development time regardless of complexity.']",C,"Well-defined use cases facilitate better communication and understanding between developers, designers, and clients by outlining user interactions and system requirements.",Use Cases,Medium,8.4
"In the context of software requirements, how do use cases typically relate to user stories?","['Use cases are a replacement for user stories.', 'Use cases are more detailed than user stories.', 'User stories provide technical specifications, while use cases define user interactions.', 'User stories are more detailed than use cases.']",B,"While both describe user interactions, use cases typically offer a more formal and detailed description of the steps involved in a specific interaction than user stories.",Use Cases,Medium,8.4
Consider a banking application. Which of the following would NOT typically be represented as a use case?,"['Withdrawing cash from an ATM.', 'Transferring funds between accounts.', 'Designing the database schema for the application.', 'Depositing a check using a mobile app.']",C,"Designing the database schema is a technical implementation detail, not a description of user interaction with the system, which is the focus of a use case.  Use cases describe *what* the system does, not *how* it does it.",Use Cases,Medium,8.4
Which of the following best describes the fundamental principle of encapsulation in object-oriented programming?,"[' Restricting access to internal data of an object.', ' Creating multiple classes with the same name.', ' Inheriting properties from a parent class.', ' Defining methods that operate on external data.']",A,"Encapsulation is about bundling data and methods that operate on that data within a class, and controlling access to that data.  Options B, C, and D describe polymorphism, inheritance, and potentially procedural programming aspects, respectively.",Object Oriented Development Cycle,Easy,8.4
"In object-oriented programming, what is inheritance?","[' The ability of a class to have multiple instances.', ' Creating new classes based on existing classes.', ' The process of destroying an object.', ' A method that returns the class name.']",B,"Inheritance allows a new class (child class) to inherit properties and methods from an existing class (parent class), promoting code reusability and reducing redundancy.",Object Oriented Development Cycle,Easy,8.4
What is polymorphism in the context of object-oriented programming?,"[' The ability to create multiple instances of a single class.', ' The ability of an object to take on multiple forms.', ' A method for securely deleting objects from memory.', ' A programming technique for data encryption.']",B,Polymorphism allows objects of different classes to respond to the same method call in their own specific ways.,Object Oriented Development Cycle,Medium,8.4
What is the purpose of an abstract class in object-oriented programming?,"[' To define concrete implementations of methods.', ' To act as a blueprint for other classes, defining common methods without providing full implementations.', ' To store data independently of any objects.', 'To manage memory allocation.']",B,"Abstract classes serve as templates. They define a structure and common methods, but subclasses must provide the concrete implementations.",Object Oriented Development Cycle,Medium,8.4
Which of the following is NOT a core principle of object-oriented programming?,"['Abstraction', 'Polymorphism', 'Sequential Processing', 'Inheritance']",C,"Sequential processing is a procedural programming concept, not a core principle of object-oriented programming.  Abstraction, polymorphism, and inheritance are all fundamental to OOP.",Object Oriented Development Cycle,Easy,8.4
What is the primary purpose of the Unified Modeling Language (UML)?,"['To simulate the execution of software programs.', 'To visually represent the structure and behavior of software systems.', 'To manage software project timelines and budgets.', 'To write executable code in various programming languages.']",B,"UML is a standardized modeling language used to create visual models of software systems, including their structure, behavior, and interactions.",Unified Modeling Language,Easy,8.4
Which of the following is NOT a common UML diagram type?,"['Class diagram', 'Use case diagram', 'Gantt chart', 'Sequence diagram']",C,"Gantt charts are project management tools, not UML diagrams.  UML diagrams focus on visualizing software system design.",Unified Modeling Language,Easy,8.4
A class diagram in UML primarily illustrates which aspect of a software system?,"['The sequence of events during program execution.', 'The interactions between different software components.', 'The static structure and relationships between classes.', 'The dynamic behavior of a system over time.']",C,"Class diagrams show the classes, attributes, methods, and relationships between classes in a system, representing its static structure.",Unified Modeling Language,Medium,8.4
What does a UML use case diagram primarily depict?,"['The internal workings of a specific class.', 'The interactions between different objects within a system.', ""The system's functional requirements from a user's perspective."", 'The detailed code implementation of a system.']",C,Use case diagrams illustrate how users (actors) interact with the system to achieve specific goals.,Unified Modeling Language,Medium,8.4
"In UML, what is the purpose of a sequence diagram?","['To model the overall structure of a software system.', 'To show the flow of messages between objects over time.', 'To define the data types used within a system.', 'To visualize the inheritance relationships between classes.']",B,"Sequence diagrams illustrate the interactions between objects, showing the order of messages exchanged and the timing of events.",Unified Modeling Language,Medium,8.4
Which of the following best describes a conceptual model in building design?,"['A detailed blueprint showing precise dimensions and material specifications.', ""A simplified representation of a building's structure, systems, and relationships."", 'A physical model constructed from miniature building materials.', 'A computer-generated rendering of the finished building.']",B,"A conceptual model focuses on the overall design concept and relationships between elements, rather than detailed specifics.",Building Conceptual Model,Easy,8.4
"In the context of building design, what is the primary purpose of developing a conceptual model?","['To obtain building permits.', 'To finalize material selections.', 'To communicate the overall design vision and key relationships.', 'To calculate the precise cost of construction.']",C,The conceptual model serves as a communication tool to convey the core design ideas to stakeholders.,Building Conceptual Model,Easy,8.4
A well-developed conceptual model for a building project should primarily emphasize which aspect?,"['The exact number of bricks required.', 'The specific type of paint to be used.', 'The spatial relationships and functional organization of the building.', 'The detailed plumbing and electrical layouts.']",C,"Conceptual models prioritize the overall arrangement and function of the building's components, not minute details.",Building Conceptual Model,Medium,8.4
Which of the following is NOT typically a component of a building's conceptual model?,"[' Functional zoning of spaces.', ' Major structural elements.', ' Detailed electrical wiring diagrams.', ' Overall building massing and form.']",C,"Detailed diagrams are part of later, more detailed design phases, not the conceptual model.",Building Conceptual Model,Medium,8.4
How does a conceptual model differ from a detailed design model in building design?,"['A conceptual model is three-dimensional, while a detailed design model is two-dimensional.', 'A conceptual model is more detailed than a detailed design model.', 'A conceptual model emphasizes overall design intent and relationships while a detailed design model focuses on precise specifications.', 'A conceptual model is only used for residential buildings.']",C,The core distinction lies in the level of detail; conceptual models are high-level representations while detailed design models are precise and complete.,Building Conceptual Model,Medium,8.4
What is the primary purpose of an address field (AD field) in a data structure context?,"['To store numerical data.', 'To specify a location or identifier.', 'To hold boolean values (true/false).', 'To contain character strings only.']",B,The address field is used to identify a specific location or a particular data element within a larger data structure.,Adding Associations and Attributes,Easy,8.4
"In database management, what does an attribute typically represent?","['A relationship between tables.', 'A specific characteristic or property of an entity.', 'A command to execute a database operation.', 'The entire database schema.']",B,"An attribute describes a characteristic of an entity, like a person's name or age in a database of people.",Adding Associations and Attributes,Easy,8.4
Which of the following best describes an association in a data model?,"['A single data element.', 'A data type definition.', 'A connection or relationship between entities.', 'An algorithm for data processing.']",C,Associations define how different entities relate to each other within a data model.,Adding Associations and Attributes,Medium,8.4
What is the role of a key in a relational database?,"['To encrypt sensitive data.', 'To uniquely identify a record within a table.', 'To control user access permissions.', 'To sort data alphabetically.']",B,"Keys are crucial for uniquely identifying and referencing records within a table, preventing data redundancy.",Adding Associations and Attributes,Medium,8.4
"Consider a data structure with an attribute representing ""employee salary."" What data type would be most suitable for this attribute?","['String', 'Boolean', 'Integer or Float', 'Date']",C,"Salaries are numerical values, often including decimal points (for fractional amounts), making Integer or Float the appropriate data types.",Adding Associations and Attributes,Easy,8.4
"In a digital logic system, what is a Boolean expression used to represent?","['The physical layout of the circuit components.', ""The timing diagram of the system's operation."", 'The relationship between input and output signals.', 'The power consumption of the circuit.']",C),Boolean expressions are used to mathematically describe the logical relationships between input and output signals in a digital system.,Representation of System Behavior,Easy,8.4
Which of the following best describes a combinatorial logic circuit?,"['A circuit whose output depends only on the current inputs.', 'A circuit whose output depends on past inputs and the current inputs.', 'A circuit that uses sequential logic elements.', 'A circuit that requires a clock signal for operation.']",A),"Combinatorial logic circuits produce outputs that are solely determined by their current inputs, unlike sequential circuits which depend on past inputs as well.",Representation of System Behavior,Medium,8.4
What is a Karnaugh map primarily used for?,"['Simulating digital circuit behavior.', 'Designing sequential logic circuits.', 'Minimizing Boolean expressions.', 'Creating timing diagrams.']",C),Karnaugh maps (K-maps) are a graphical method for simplifying Boolean algebraic expressions.,Representation of System Behavior,Medium,8.4
A truth table depicts the relationship between:,"[' Circuit power consumption and input values.', ' Input variables and output values of a logic function.', ' Timing signals and output delays.', ' Sequential circuit states and next states.']",B),A truth table systematically lists all possible input combinations and their corresponding output values for a logic function.,Representation of System Behavior,Easy,8.4
Which of the following is NOT a common type of logic gate?,"['AND gate', 'OR gate', 'XOR gate', ' Integrator gate']",D),"Integrator gates are not a fundamental type of logic gate found in Boolean algebra.  AND, OR, and XOR are fundamental.",Representation of System Behavior,Easy,8.4
