question,options,answer,explanation,topic,difficulty,chapter
Which of the following is NOT a fundamental arithmetic operation performed by a CPU's arithmetic logic unit (ALU)?,"['Addition', 'Subtraction', 'Integration', 'Multiplication']",C,"Integration is a calculus operation, not a fundamental arithmetic operation performed directly by an ALU.  Addition, subtraction, and multiplication are fundamental arithmetic operations.",Arithmetic and Logical operation,Easy,4.2
Floating-point calculations within a CPU are primarily used to:,"['Perform integer arithmetic.', 'Enhance the speed of logical operations.', 'Enable high-precision mathematical computations.', 'Simplify memory addressing.']",C,"Floating-point calculations allow for the representation and manipulation of real numbers with a high degree of precision, crucial for many mathematical computations.",Arithmetic and Logical operation,Medium,4.2
What are adders and multipliers considered within the context of a CPU?,"['Software programs', 'Memory storage units', 'Specialized hardware units', 'Input/output devices']",C,"Adders and multipliers are physical components within the CPU's ALU, designed to perform arithmetic operations.",Arithmetic and Logical operation,Easy,4.2
"The term ""arithmetic and logical operations"" refers to:","[' High-level programming constructs.', ' Fundamental building blocks of computational processes.', ' Methods of data transfer between CPU and memory.', ' Techniques used in software debugging.']",B,Arithmetic and logical operations are the basic computational steps performed by the CPU.,Arithmetic and Logical operation,Easy,4.2
"In the context of CPU arithmetic, what is the primary purpose of extending arithmetic operations to support floating-point calculations?","['To reduce processing time.', 'To improve the accuracy of calculations involving real numbers.', 'To simplify the design of the ALU.', 'To increase the amount of data that can be processed.']",B,"Extending support for floating-point numbers allows for more accurate calculations involving real numbers, which are often represented as approximations in binary.",Arithmetic and Logical operation,Medium,4.2
Which component of the memory hierarchy offers the fastest access speed but has the smallest storage capacity?,"['Main memory (RAM)', 'Cache memory', 'Registers', 'Secondary storage (hard drives, SSDs)']",C,Registers are the fastest access memory but have a very limited capacity compared to other levels in the memory hierarchy.,The Memory Hierarchy,Easy,4.2
"In the memory hierarchy, which storage type typically has the lowest cost per bit?","['Cache memory', 'Registers', 'Main memory (RAM)', 'Tertiary storage (optical discs, network storage)']",D,Tertiary storage generally offers the lowest cost per bit due to its high capacity and relatively low cost of the storage media.,The Memory Hierarchy,Medium,4.2
What is the typical relationship between access time and storage capacity across the memory hierarchy?,"['Access time decreases as storage capacity increases.', 'Access time and storage capacity remain constant.', 'Access time increases as storage capacity increases.', 'There is no consistent relationship between access time and storage capacity.']",C,"As you move down the hierarchy (from registers to tertiary storage), access time increases, while storage capacity increases.",The Memory Hierarchy,Easy,4.2
Which of the following is NOT typically considered part of the memory hierarchy?,"['RAM', 'Cache', 'Registers', 'CPU']",D,"The CPU (Central Processing Unit) is the processing unit, not a storage level within the memory hierarchy.  The hierarchy involves different types of memory.",The Memory Hierarchy,Easy,4.2
How does the cost per bit generally change as you move down the memory hierarchy?,"['It remains constant.', 'It decreases.', 'It increases.', 'It fluctuates unpredictably.']",B,The cost per bit generally decreases as you move down the memory hierarchy because higher capacity storage tends to be cheaper per unit of storage.,The Memory Hierarchy,Medium,4.2
Which type of memory is characterized by high speed and temporary data storage during program execution?,"['External Memory', 'Secondary Memory', 'Internal Memory', 'Tertiary Memory']",C,"Internal memory, such as RAM and cache, is known for its speed and temporary storage of data during program execution.",Internal and External memory,Easy,4.2
Hard drives and SSDs are examples of which type of memory?,"['Internal Memory', 'Cache Memory', 'Register Memory', 'External Memory']",D,Hard drives and SSDs are external storage devices used for long-term data storage.,Internal and External memory,Easy,4.2
What is the primary difference between internal and external memory in terms of data access speed?,"['External memory is significantly faster.', 'Both have comparable speeds.', 'Internal memory is significantly faster.', 'Speed depends on the specific device.']",C,"Internal memory is designed for speed and quick access, unlike external memory which prioritizes storage capacity.",Internal and External memory,Medium,4.2
Which of the following is NOT a typical characteristic of external memory?,"['High storage capacity', 'Low cost per gigabyte', 'High speed data access', 'Long-term data storage']",C,"External memory is characterized by high storage capacity and long-term data storage, but not high-speed data access.  Speed is a key feature of internal memory.",Internal and External memory,Medium,4.2
RAM (Random Access Memory) is best categorized as which type of memory?,"['External Memory', 'Secondary Storage', 'Internal Memory', 'Tertiary Storage']",C,RAM is a type of internal memory that provides fast temporary storage for actively used data.,Internal and External memory,Easy,4.2
What is the primary purpose of cache memory in a computer system?,"['To store the operating system files.', 'To increase the speed of data retrieval for frequently accessed items.', 'To manage input/output operations.', 'To permanently store program instructions.']",B,"Cache memory's main function is to store frequently accessed data and instructions, making them readily available to the CPU, thereby speeding up data retrieval.",Cache memory principles,Easy,4.2
Which principle explains why cache memory is effective?,"['Principle of least privilege', 'Principle of locality of reference', 'Principle of data integrity', 'Principle of least effort']",B,The principle of locality of reference states that recently accessed data and instructions are likely to be accessed again soon.  Cache memory leverages this principle.,Cache memory principles,Medium,4.2
Where is cache memory typically located in relation to the CPU?,"['In the hard drive', 'In main memory (RAM)', 'On a remote server', 'Close to the CPU']",D,Cache memory is designed to be physically close to the CPU to minimize access time.,Cache memory principles,Easy,4.2
What characteristic distinguishes cache memory from main memory?,"['Lower cost per bit', 'Larger storage capacity', 'Higher speed', 'Persistence across power loss']",C,Cache memory is smaller and faster than main memory.  This speed difference is crucial for performance.,Cache memory principles,Medium,4.2
How does the principle of locality of reference contribute to improved system performance when using cache memory?,"['It reduces the number of instructions executed by the CPU.', 'It increases the amount of data stored in main memory.', 'It increases the probability of finding frequently accessed data in cache.', 'It prevents data corruption in main memory.']",C,"Because frequently accessed data is likely to be in the cache, access times are reduced, leading to improved performance.",Cache memory principles,Medium,4.2
What is the primary trade-off involved in choosing a cache size?,"['Cost versus speed', 'Complexity versus efficiency', 'Capacity versus security', 'Size versus power consumption']",A,Larger caches improve capacity but may increase access times and cost.  The optimal size balances these factors.,Elements of Cache design - Cache size,Easy,4.2
How does the mapping function in a cache system operate?,"[""It determines the cache's replacement algorithm."", 'It defines how data from main memory is placed in the cache.', ""It manages the cache's power consumption."", 'It optimizes data access patterns for improved performance.']",B,The mapping function dictates the location of main memory data within the cache.,Elements of Cache design - Cache size,Easy,4.2
Increasing cache size generally leads to which of the following?,"['Decreased cost and increased speed', 'Increased cost and decreased speed', 'Increased cost and potentially decreased speed', 'Decreased cost and potentially increased speed']",C,"While increased capacity improves performance, it also increases cost and might lead to slightly slower access times due to increased complexity.",Elements of Cache design - Cache size,Medium,4.2
The optimal cache size is determined by balancing which three key factors?,"['Size, cost, and complexity', 'Speed, cost, and power consumption', 'Capacity, speed, and cost', 'Capacity, size, and power consumption']",C,"The passage explicitly states that the optimal cache size balances capacity, speed, and cost.",Elements of Cache design - Cache size,Easy,4.2
What is a potential negative consequence of using a very large cache?,"['Increased data security risks', 'Reduced system power consumption', 'Increased access times', 'Improved data compression efficiency']",C,A larger cache can increase access times due to increased complexity in managing the larger memory space.,Elements of Cache design - Cache size,Medium,4.2
"What is a key characteristic of a function, also known as a mapping?","['Each element in the range maps to multiple elements in the domain.', 'Each element in the domain maps to multiple elements in the range.', 'Each element in the domain maps to exactly one element in the range.', 'Elements in the domain and range can be arbitrarily paired.']",C,"A function, or mapping, is defined by the property that each input (element in the domain) has only one output (element in the range).",Mapping function,Easy,4.2
"If a relation is NOT a function (mapping), what condition is violated?","['Each element in the range has at least one element in the domain mapped to it.', 'Each element in the domain has exactly one element in the range mapped to it.', ' The domain and range are disjoint sets.', 'The domain and range are equal sets.']",B,"The defining characteristic of a function is that every element in the domain maps to exactly one element in the range. If this isn't true, it's not a function.",Mapping function,Easy,4.2
Which of the following correctly describes the relationship between the domain and range of a function?,"['The domain is always a subset of the range.', 'The range is always a subset of the domain.', 'The domain and range are always equal sets.', 'The domain is a set of inputs, and the range is a set of outputs.']",D,"The domain represents all possible inputs to the function, while the range represents all possible outputs.  They don't have to be subsets of each other or equal.",Mapping function,Easy,4.2
Consider a set of ordered pairs representing a relation.  Under what condition does this relation represent a function (mapping)?,"['No two ordered pairs share the same second element.', 'No two ordered pairs share the same first element.', 'All ordered pairs have the same first element.', 'All ordered pairs have the same second element.']",B,"A function requires that each input (first element of the ordered pair) maps to only one output (second element).  Therefore, no two ordered pairs can have the same first element with different second elements.",Mapping function,Medium,4.2
"In the context of functions, what does it mean to ""map"" an element?","['To assign a unique numerical value to an element.', 'To assign a unique element in the range to an element in the domain.', 'To order elements according to their magnitude.', 'To graphically represent elements on a coordinate system.']",B,Mapping refers to the assignment of an input (from the domain) to a specific output (from the range) according to the function's rule.,Mapping function,Easy,4.2
Which of the following is NOT a common cache mapping technique?,"['Direct Mapping', 'Associative Mapping', 'Set-Associative Mapping', 'FIFO Mapping']",D,"Direct mapping, associative mapping, and set-associative mapping are all common cache mapping techniques. FIFO (First-In, First-Out) is a replacement algorithm, not a mapping technique.",Replacement algorithm,Easy,4.2
What is the primary purpose of a cache replacement algorithm?,"['To increase cache size.', 'To determine which data to evict from a full cache.', 'To improve the speed of data access to main memory.', 'To optimize cache mapping techniques.']",B,A replacement algorithm is invoked when the cache is full and needs to make space for new data.  It decides which existing data to remove.,Replacement algorithm,Easy,4.2
"In a cache memory system, what happens when a cache miss occurs?","['The requested data is immediately retrieved from the main memory.', 'The cache replacement algorithm is immediately triggered.', 'The requested data is found in the cache.', 'The system automatically increases the cache size.']",A,"A cache miss indicates the requested data is not in the cache. The system retrieves it from main memory. While a replacement algorithm may be needed later if the cache is full, it doesn't immediately trigger on a miss.",Replacement algorithm,Medium,4.2
Which replacement algorithm would be LEAST likely to lead to thrashing in a cache?,"['Random Replacement', 'First-In, First-Out (FIFO)', 'Least Recently Used (LRU)', 'Least Frequently Used (LFU)']",C,"LRU tends to keep frequently accessed data in the cache, reducing the chance of thrashing (repeatedly evicting and reloading the same data). FIFO and Random are more prone to thrashing. LFU is also less effective than LRU against thrashing.",Replacement algorithm,Medium,4.2
A cache replacement algorithm's effectiveness is primarily judged by which metric?,"['Cache size', 'Memory access speed', 'Hit ratio', 'Instruction count']",C,A good replacement algorithm maximizes the hit ratio (the percentage of memory accesses found in the cache). This directly impacts performance.,Replacement algorithm,Easy,4.2
Which cache replacement algorithm removes the least recently accessed data?,"['First-In-First-Out (FIFO)', 'Least Recently Used (LRU)', 'Random Replacement', 'Least Frequently Used (LFU)']",B,LRU specifically targets the least recently used data for removal.,Write policy,Easy,4.2
What is the primary function of a write policy in a cache system?,"['Determining cache size', 'Managing data replacement algorithms', 'Handling data modifications in cache and main memory', 'Predicting future data access patterns']",C,Write policies define how changes made to data in the cache are propagated to main memory.,Write policy,Medium,4.2
A cache replacement algorithm that removes the oldest data is known as:,"['LRU', 'MRU (Most Recently Used)', 'FIFO', 'Random Replacement']",C,"FIFO follows a ""first-in, first-out"" principle, removing the oldest data item.",Write policy,Easy,4.2
How does the choice of cache replacement algorithm impact the system?,"['It only affects memory allocation.', 'It affects cache efficiency and system performance.', 'It only impacts data retrieval speed.', 'It has no significant impact on system performance.']",B,"The algorithm directly impacts how effectively the cache stores and retrieves data, influencing overall system speed and efficiency.",Write policy,Medium,4.2
Which of the following is NOT a common cache replacement algorithm?,"['Least Recently Used (LRU)', 'First-In-First-Out (FIFO)', ' Write-Back', 'Random Replacement']",C,"Write-back is a write policy, not a replacement algorithm.  Replacement algorithms focus on which data to remove when the cache is full.",Write policy,Medium,4.2
What is the primary trade-off involved in determining the optimal size of a cache?,"['Cost versus complexity', 'Speed versus security', 'Capacity versus cost', 'Speed versus capacity']",D) Speed versus capacity,Larger caches offer increased capacity but can lead to slower access times.  The optimal size finds a balance between these two competing factors.,Number of caches,Easy,4.2
"In the context of cache memory, what does the ""mapping function"" determine?","['The speed of data retrieval', 'The amount of data stored', 'How data from main memory is placed in the cache', 'The cost of cache implementation']",C) How data from main memory is placed in the cache,The mapping function dictates the strategy used to locate and store data from main memory within the cache.,Number of caches,Medium,4.2
A larger cache generally results in:,"['Decreased cost and increased speed', 'Increased cost and decreased speed', 'Increased cost and potentially decreased speed', 'Decreased cost and potentially increased speed']",C) Increased cost and potentially decreased speed,"While a larger cache can hold more data, it may come at a higher cost and might not always result in faster access times due to increased complexity.",Number of caches,Easy,4.2
The optimal cache size is a compromise between which three factors?,"['Size, speed, and security', 'Cost, complexity, and capacity', 'Capacity, speed, and cost', 'Speed, security, and complexity']","C) Capacity, speed, and cost","Finding the ideal cache size involves balancing the amount of data it can store (capacity), how quickly it can access that data (speed), and the financial expense (cost).",Number of caches,Medium,4.2
Which of the following is NOT a direct consequence of increasing cache size?,"['Increased storage capacity', 'Increased cost', 'Improved system security', 'Potentially slower access times']",C) Improved system security,"Increasing cache size affects cost, storage capacity, and speed; it does not directly enhance system security.",Number of caches,Easy,4.2
What characteristic distinguishes volatile memory like RAM from non-volatile memory?,"['Data retention after power loss', 'Access speed', 'Cost per unit of storage', 'Physical size']",A,"Volatile memory loses data when power is removed, while non-volatile memory retains data even without power.  This is the key differentiating characteristic.",Memory Write Ability and Storage Permanence,Easy,4.2
"In a computer system's memory hierarchy, which type of memory typically offers the fastest access speeds but the smallest storage capacity?","['Main memory', 'L3 cache', 'L2 cache', 'L1 cache']",D,"The L1 cache is closest to the CPU and designed for extremely fast access, but its size is limited compared to other levels of cache and main memory.",Memory Write Ability and Storage Permanence,Medium,4.2
"The term ""memory write ability"" primarily refers to:","['The capacity of the memory.', 'The speed of data retrieval.', 'The ease with which data can be modified.', 'The physical location of the memory.']",C,Memory write ability describes how easily data can be written or changed within the memory.,Memory Write Ability and Storage Permanence,Easy,4.2
Which of the following is a trade-off inherent in the design of a computer's memory hierarchy?,"['Cost versus capacity', 'Speed versus capacity', 'Complexity versus reliability', 'Access time versus data integrity']",B,"Faster memory (like cache) generally has less capacity, while slower memory (like main memory) has larger capacity. This speed-capacity trade-off is fundamental to the design.",Memory Write Ability and Storage Permanence,Medium,4.2
What happens to data stored in volatile memory when the power supply is interrupted?,"['It is automatically backed up to a secondary storage device.', 'It is encrypted to protect it from loss.', 'It is permanently erased.', 'It is lost.']",D,"Volatile memory, by definition, loses its stored data when power is removed.",Memory Write Ability and Storage Permanence,Easy,4.2
What is a key characteristic that distinguishes non-volatile memories like ROM and flash memory from volatile memories?,"['Faster read speeds', 'Lower cost per bit', 'Data retention without power', 'Higher capacity']",C,"Non-volatile memory's defining feature is its ability to retain data even when power is removed, unlike volatile memory.",Composing Memory,Easy,4.2
"In the context of ""Composing Memory,"" what is the primary goal of integrating different memory types?","['Minimizing cost only', 'Maximizing speed only', 'Achieving a balance of speed, capacity, and cost', 'Increasing capacity only']",C,Composing memory aims to find an optimal balance across various performance and economic factors.,Composing Memory,Easy,4.2
Which application critically relies on the permanence of data storage offered by non-volatile memory?,"['Temporary file storage', 'Random Access Memory (RAM)', 'Firmware storage', 'Cache memory']",C,"Firmware, essential for device operation, necessitates non-volatile memory for persistent data storage.",Composing Memory,Medium,4.2
What is a significant trade-off often encountered when using non-volatile memory?,"['High cost and high speed', 'Low cost and high speed', 'High cost and low write speed', 'Low cost and low read speed']",C,Non-volatile memory often sacrifices write speed for the benefit of data persistence.,Composing Memory,Medium,4.2
Designing memory hierarchies is a key aspect of which memory-related concept?,"['Volatile memory optimization', 'Composing memory', 'Non-volatile memory design', 'Cache memory management']",B,"Memory hierarchies are a central component of composing memory, allowing for efficient interaction between different memory types.",Composing Memory,Medium,4.2
