question,options,answer,explanation,topic,difficulty,chapter
"Which type of memory is volatile, meaning its contents are lost when power is removed?","['ROM', 'Cache Memory', 'RAM', 'Secondary Storage']",C,"RAM (Random Access Memory) is volatile, unlike ROM (Read-Only Memory) which retains data even without power. Cache memory is also volatile.",Memory Device Classification and Hierarchy,Easy,2.5
What is the primary function of primary memory in a computer system?,"['Long-term data storage', 'High-speed data transfer', 'Storing the operating system and currently running programs', 'Backing up important files']",C,"Primary memory (RAM and ROM) holds the operating system, currently running applications, and their data for immediate access by the CPU.",Memory Device Classification and Hierarchy,Easy,2.5
Which of the following is NOT a characteristic used to classify memory devices?,"['Access speed', 'Cost per bit', 'Volatility', 'Function']",B,"While cost is a factor in choosing memory, it's not a primary characteristic used for the fundamental classification of memory types.",Memory Device Classification and Hierarchy,Medium,2.5
What is the main difference between RAM and ROM?,"['RAM is faster than ROM.', 'ROM is used for booting, while RAM is used for running applications.', 'RAM is volatile, while ROM is non-volatile.', 'RAM is non-volatile, while ROM is volatile.']",C,"The key distinction is that RAM loses its data when power is removed, while ROM retains data even without power.",Memory Device Classification and Hierarchy,Easy,2.5
"Besides RAM, what is another component typically considered part of primary memory?","['Hard Disk Drive', 'Solid State Drive', 'ROM', 'USB Flash Drive']",C,Primary memory consists of both RAM and ROM.  The other options are types of secondary storage.,Memory Device Classification and Hierarchy,Medium,2.5
What is the primary function of the address bus in a microprocessor system's memory interfacing?,"['Transferring data between the processor and memory.', 'Controlling read and write operations.', 'Selecting specific memory locations.', 'Providing power to the memory modules.']",C,"The address bus is used by the processor to specify the memory location it wants to access.  The data bus carries the data, and control signals manage read/write operations.",Interfacing I/O and Memory,Easy,2.5
Which control signals are typically used to manage read and write operations in memory interfacing?,"[' CLK and RST', ' RD and WR', ' INT and IRQ', ' ACK and NAK']",B,RD (Read) and WR (Write) signals are standard control signals used to indicate the direction of data transfer between the processor and memory.,Interfacing I/O and Memory,Easy,2.5
What components are involved in the interfacing process within a microprocessor system?,"['Microprocessor and memory only.', 'Microprocessor, memory, and peripheral devices.', 'Memory and peripheral devices only.', 'Only the microprocessor.']",B,"Interfacing encompasses the connection and communication between the microprocessor, memory, and all peripheral devices.",Interfacing I/O and Memory,Easy,2.5
"In memory interfacing, data transfer between the processor and memory occurs via which bus?","['Address bus', 'Control bus', 'Data bus', 'System bus (general)']",C,The data bus is the pathway for the actual data being transferred to and from memory.,Interfacing I/O and Memory,Medium,2.5
"The term ""interfacing,"" in the context of microprocessor systems, refers to:","['The physical packaging of the microprocessor.', 'The process of connecting and enabling communication between different components.', 'The internal clock speed of the processor.', ' The software used to control the memory.']",B,Interfacing describes the connection and communication pathways established between the various components of the system.,Interfacing I/O and Memory,Medium,2.5
What is the primary advantage of a parallel interface over a serial interface?,"['Lower cost of implementation', 'Simplified data synchronization', 'Higher data transmission speed', 'Reduced electromagnetic interference']",C) Higher data transmission speed,"Parallel interfaces transmit multiple bits simultaneously, leading to faster data transfer compared to serial interfaces which transmit bits one at a time.",Parallel Interface,Easy,2.5
Which of the following devices commonly utilizes a parallel interface for data transfer?,"['Modem', 'Network card', 'External Hard Drive', 'Bluetooth headset']",C) External Hard Drive,"External hard drives frequently employ parallel interfaces, though this is becoming less common with the rise of USB and other serial interfaces.",Parallel Interface,Easy,2.5
What is a crucial component responsible for coordinating the simultaneous data transfer in a parallel interface?,"['Data Bus only', 'Control lines only', 'Synchronization mechanisms', 'Data Bus and Control lines only']",C) Synchronization mechanisms,Synchronization mechanisms are essential to ensure that all bits arrive at the destination simultaneously and in the correct order.,Parallel Interface,Medium,2.5
"In a parallel interface, data is transferred via:","['A single communication line', 'Multiple communication lines', 'Radio waves', 'Infrared signals']",B) Multiple communication lines,The defining characteristic of a parallel interface is the use of multiple lines for simultaneous data transmission.,Parallel Interface,Easy,2.5
"Besides data buses, what other components are integral to the functional operation of a parallel interface?","['Power supply and casing', 'Control lines and synchronization mechanisms', 'Cooling fans and heat sinks', ' Software drivers and operating system']",B) Control lines and synchronization mechanisms,"Control lines manage data flow, and synchronization mechanisms ensure proper timing and order of data transfer.",Parallel Interface,Medium,2.5
What is the primary function of a Programmable Peripheral Interface (PPI)?,"['To control the speed of the CPU.', 'To facilitate communication between the CPU and peripheral devices.', 'To manage memory allocation in a computer system.', 'To regulate power supply to peripheral devices.']",B,The PPI's core function is to enable communication between the CPU and external devices.,Introduction to Programmable Peripheral Interface (PPI),Easy,2.5
Which of the following is a well-known example of a PPI chip?,"['Intel 8086', 'Intel 8255', 'Motorola 68000', 'Zilog Z80']",B,The Intel 8255 is a widely used example of a PPI chip.,Introduction to Programmable Peripheral Interface (PPI),Easy,2.5
"In microprocessor-based systems, what role does a PPI play regarding peripheral devices?","['It exclusively manages output devices.', 'It exclusively manages input devices.', 'It provides flexible interfacing for both input and output devices.', 'It only manages memory-mapped I/O devices.']",C,PPIs offer versatile interfacing capabilities for both input and output peripherals.,Introduction to Programmable Peripheral Interface (PPI),Medium,2.5
The design of a PPI chip prioritizes which aspect of peripheral device interaction?,"['High-speed data transfer rates.', 'Complex data encryption.', 'Flexible and adaptable interfacing.', 'Direct memory access (DMA) capabilities.']",C,A key feature of PPI design is its ability to interface with a wide variety of devices.,Introduction to Programmable Peripheral Interface (PPI),Medium,2.5
What type of system commonly utilizes a PPI chip?,"['Analog signal processing systems.', 'Microprocessor-based systems.', 'Mainframe computer systems.', 'Quantum computing systems.']",B,PPIs are integral components in systems employing microprocessors.,Introduction to Programmable Peripheral Interface (PPI),Easy,2.5
What is the primary characteristic of a serial interface concerning data transmission?,"['Simultaneous transmission of multiple bits.', 'Transmission of data in packets.', 'Transmission of data one bit at a time.', 'Transmission of data using parallel lines.']",C,"By definition, a serial interface transmits data sequentially, one bit at a time.",Serial Interface,Easy,2.5
"Compared to parallel communication, what advantage does serial communication offer regarding hardware?","['Increased complexity.', 'Higher cost.', 'Reduced complexity.', 'Shorter transmission distances.']",C,"Serial communication simplifies hardware requirements, leading to reduced complexity compared to parallel communication.",Serial Interface,Easy,2.5
In which application areas is serial communication frequently employed?,"['Only in high-speed data transfer.', 'Networking, telecommunications, and microcontroller interfacing.', 'Exclusively in short-distance communication.', 'Primarily in large-scale data centers.']",B,"Serial communication finds widespread use in networking, telecommunications, and connecting microcontrollers to external peripherals.",Serial Interface,Medium,2.5
What is a significant benefit of serial communication concerning transmission distance?,"['It significantly limits transmission distance.', 'It offers no advantage in transmission distance.', 'It allows for longer transmission distances.', 'It only works over short distances.']",C,Serial communication generally allows for longer transmission distances compared to parallel communication.,Serial Interface,Easy,2.5
Which of the following best describes how data is sent in a serial interface?,"[' In groups of eight bits simultaneously.', ' As a continuous stream of bits.', ' One bit at a time, sequentially.', ' Using multiple communication lines simultaneously.']",C,"The fundamental principle of serial communication is the sequential transmission of data, one bit at a time.",Serial Interface,Easy,2.5
What distinguishes synchronous from asynchronous transmission in serial interfaces?,"['Data error correction methods', 'Use of modulation techniques', 'Presence or absence of a common clock signal', 'Data encoding schemes']",C,"Synchronous transmission uses a common clock signal for synchronized data transfer, while asynchronous transmission doesn't, relying on start and stop bits.",Synchronous and Asynchronous Transmission,Easy,2.5
In which type of serial transmission is a common clock signal essential for data synchronization?,"['Asynchronous transmission', 'Isochronous transmission', 'Synchronous transmission', ' Half-duplex transmission']",C,Synchronous transmission relies on a common clock signal to maintain synchronization during data transfer.,Synchronous and Asynchronous Transmission,Easy,2.5
Which of the following communication systems is most likely to employ synchronous transmission?,"['Low-speed dial-up modem', ' Simple serial port communication', ' Fiber optic network', ' Older RS-232 communication']",C,High-speed systems like fiber optic networks typically utilize synchronous transmission for efficient data transfer.,Synchronous and Asynchronous Transmission,Medium,2.5
"In asynchronous transmission, what mechanism is used to delineate the beginning and end of each data byte?","['Cyclic redundancy check (CRC)', 'Parity bits', 'Start and stop bits', ' Framing bits']",C,"Start and stop bits frame each data byte in asynchronous transmission, indicating the beginning and end of the byte.",Synchronous and Asynchronous Transmission,Easy,2.5
Which transmission method is generally more efficient for high-speed data transfer?,"['Asynchronous transmission due to its simpler implementation.', 'Synchronous transmission due to its efficient use of bandwidth.', 'Both methods offer equal efficiency at high speeds.', 'Neither method is suitable for high-speed data transfer.']",B,"Synchronous transmission, with its continuous data stream synchronized by a clock, is more efficient at high speeds compared to asynchronous transmission, which has overhead from start and stop bits.",Synchronous and Asynchronous Transmission,Medium,2.5
Which serial transmission method uses a common clock signal for synchronized data transfer?,"['Asynchronous transmission', 'Synchronous transmission', 'Isochronous transmission', 'Simplex transmission']",B,"Synchronous transmission relies on a shared clock signal to maintain synchronization between sender and receiver, ensuring data is sent and received at a consistent rate.",Serial Interface Standards,Easy,2.5
"In asynchronous serial transmission, what signals delimit the beginning and end of each data byte?","['Parity bits and checksums', 'Header and trailer fields', 'Start and stop bits', 'Acknowledgement and negative acknowledgement signals']",C,"Start and stop bits are crucial for asynchronous transmission, signaling the start and end of each data byte to allow for asynchronous data transfer without a shared clock.",Serial Interface Standards,Easy,2.5
Which of the following communication systems is MOST likely to utilize synchronous serial transmission?,"['Low-speed data acquisition systems', ' Simple remote control devices', 'High-speed fiber optic networks', ' Short-range wireless communication systems']",C,High-speed systems like fiber optic networks benefit from the efficiency and speed offered by synchronous transmission.,Serial Interface Standards,Medium,2.5
What is a key characteristic that distinguishes synchronous from asynchronous serial data transmission?,"['Data encoding scheme', 'Use of error detection methods', 'Presence or absence of a common clock signal', 'Data rate variability']",C,"The fundamental difference lies in the use of a common clock signal for synchronization in synchronous transmission, absent in asynchronous transmission.",Serial Interface Standards,Medium,2.5
Asynchronous serial communication is best suited for applications requiring:,"['High data transfer rates and precise timing', ' Low error rates and guaranteed delivery', ' Simple, low-cost, and flexible data transfer', ' Real-time, continuous data streams']",C,"Asynchronous transmission is simpler and less demanding, making it ideal for applications where high-speed or precise timing is not critical.",Serial Interface Standards,Medium,2.5
What is the primary advantage of using Direct Memory Access (DMA) in a computer system?,"['Increased microprocessor processing speed', 'Reduced CPU workload during data transfers', 'Enhanced memory capacity', 'Simplified peripheral device configuration']",B,"DMA offloads data transfer tasks from the CPU, freeing it for other processing.",Introduction to Direct Memory Access (DMA),Easy,2.5
In what type of applications is DMA particularly beneficial?,"['Simple text processing', 'Applications with minimal data transfer', 'Applications involving large data transfers, like video processing', 'Single-threaded applications']",C,"DMA's efficiency shines when handling substantial data movement, such as in video or disk I/O.",Introduction to Direct Memory Access (DMA),Easy,2.5
How does DMA transfer data to and from memory?,"[""Through the CPU's cache memory"", 'Directly between peripherals and memory, bypassing the CPU', 'Via a dedicated interrupt system', 'Exclusively using the system bus for every transfer']",B,DMA's core function is to enable direct data exchange between peripherals and main memory without CPU intervention.,Introduction to Direct Memory Access (DMA),Medium,2.5
What is the role of a DMA controller in a computer system?,"[""Managing the CPU's instruction queue"", 'Controlling the transfer of data between peripherals and memory', 'Monitoring system memory usage', 'Performing arithmetic and logic operations']",B,"The DMA controller manages the data transfer process, handling requests and managing the flow of data between memory and peripherals.",Introduction to Direct Memory Access (DMA),Medium,2.5
Which of the following best describes the impact of DMA on system performance in applications requiring significant data transfers?,"['Negligible impact', 'Decreased system performance', 'Significant performance improvement', 'Inconsistent performance effects']",C,DMA significantly improves system performance by reducing the CPU's workload in these scenarios.,Introduction to Direct Memory Access (DMA),Easy,2.5
What is the primary function of a DMA controller?,"[' Manage interrupt requests from peripherals.', ' Execute instructions directly from memory.', ' Facilitate high-speed data transfer between peripherals and memory without CPU intervention.', ' Control the clock speed of the microprocessor.']",C,DMA controllers are designed to offload the CPU by handling direct data transfers between peripherals and memory.,DMA Controllers,Easy,2.5
How does the use of DMA impact the CPU's workload?,"[""It significantly increases the CPU's workload."", ""It has no effect on the CPU's workload."", ""It slightly increases the CPU's workload."", ""It reduces the CPU's workload.""]",D,DMA reduces the CPU's workload by handling data transfers independently.,DMA Controllers,Easy,2.5
In what type of applications is DMA particularly beneficial?,"['Simple, low-data-volume operations.', 'Applications with minimal memory access.', 'Applications involving large data transfers, like video processing.', 'Applications that prioritize CPU utilization.']",C,"DMA's efficiency shines in applications that demand high-speed, large-volume data transfers.",DMA Controllers,Medium,2.5
Which component is bypassed when a DMA controller is used for data transfer?,"['RAM', 'Hard Disk', 'Microprocessor/CPU', ' Peripheral devices']",C,"DMA controllers transfer data directly between memory and peripherals, eliminating the CPU as an intermediary.",DMA Controllers,Medium,2.5
What is a key advantage of employing Direct Memory Access (DMA)?,"['Increased complexity of the system architecture.', 'Higher CPU utilization for data transfer.', 'Improved system efficiency by reducing CPU workload.', ' Lower data transfer speeds.']",C,DMA enhances system performance by freeing the CPU from handling data transfers.,DMA Controllers,Easy,2.5
